number,value,datetime_start,datetime_complete,duration,params_epsilon,params_k,params_lr,params_n_epochs,params_proportion,params_samples,params_wd,state
0,0.890177628411924,2026-09-01 08:12:14.209868,2026-09-01 08:12:25.193762,0 days 00:00:10.983894,0.1316230103092925,16,0.03253824951282945,50,2,SUBSPACE,0.00017296262304374396,COMPLETE
1,0.8776067674467062,2026-09-01 08:12:25.266229,2026-09-01 08:13:40.324011,0 days 00:01:15.057782,0.27705326634679056,71,0.0049922254789382435,150,1,MIXED,0.0009582422386921224,COMPLETE
2,0.8873391483032884,2026-09-01 08:13:40.403362,2026-09-01 08:14:42.676052,0 days 00:01:02.272690,0.16956180282810995,23,0.001795570283181768,225,2,SUBSPACE,0.37650299356467154,COMPLETE
3,0.8769087105998663,2026-09-01 08:14:42.739441,2026-09-01 08:17:11.768585,0 days 00:02:29.029144,0.10084813565750601,115,0.0006376530778761661,200,1,UNIFORM,0.0002572107019414529,COMPLETE
4,0.8869098512009541,2026-09-01 08:17:11.958362,2026-09-01 08:17:28.540446,0 days 00:00:16.582084,0.11567747360938377,11,0.0007386265081951704,125,1,MIXED,0.011771842730435786,COMPLETE
5,0.8820189627176124,2026-09-01 08:17:28.620516,2026-09-01 08:18:11.545694,0 days 00:00:42.925178,0.17612921621304822,8,0.09757219939869242,250,2,UNIFORM,0.830368338123394,COMPLETE
6,0.8863276506850792,2026-09-01 08:18:11.613926,2026-09-01 08:18:38.334057,0 days 00:00:26.720131,0.05264848237603523,5,0.00010492035552749626,250,1,SUBSPACE,0.0848088724003594,COMPLETE
7,0.8861870962990638,2026-09-01 08:18:38.402474,2026-09-01 08:19:18.148908,0 days 00:00:39.746434,0.15373239683064463,21,0.0002569052945923138,250,1,MIXED,0.0011801483065795376,COMPLETE
8,0.8764109325267098,2026-09-01 08:19:18.205911,2026-09-01 08:20:46.663362,0 days 00:01:28.457451,0.030011457254553592,127,0.004493738331525859,75,2,SUBSPACE,0.0041402625948293555,COMPLETE
9,0.47477744807121663,2026-09-01 08:20:46.756034,2026-09-01 08:22:06.718213,0 days 00:01:19.962179,0.15295152091512204,124,0.033746009971539176,100,1,SUBSPACE,0.0009554235011655868,COMPLETE
10,0.8588679040242562,2026-09-01 08:22:06.792879,2026-09-01 08:22:33.904703,0 days 00:00:27.111824,0.4828010987396334,48,0.01830983828249589,50,2,SUBSPACE,0.00011902977823950003,COMPLETE
11,0.8840592465925665,2026-09-01 08:22:33.999972,2026-09-01 08:23:57.522743,0 days 00:01:23.522771,0.32607333566543284,24,0.0035149552824565804,300,2,SUBSPACE,0.46776541857293163,COMPLETE
12,0.879219101385965,2026-09-01 08:23:57.609755,2026-09-01 08:24:43.381520,0 days 00:00:45.771765,0.24611496809101652,21,0.015545782934166648,175,2,SUBSPACE,0.04776535175121608,COMPLETE
13,0.8827628232301823,2026-09-01 08:24:43.457172,2026-09-01 08:26:23.616678,0 days 00:01:40.159506,0.22930608249786089,37,0.001572573544190892,300,2,SUBSPACE,0.07468442221956931,COMPLETE
14,0.8806199301628814,2026-09-01 08:26:23.693572,2026-09-01 08:27:00.714265,0 days 00:00:37.020693,0.37510440388798066,12,0.0732345090728185,200,2,SUBSPACE,0.008560997786144754,COMPLETE
15,0.8837871189314633,2026-09-01 08:27:00.793489,2026-09-01 08:27:11.815383,0 days 00:00:11.021894,0.20235568440081156,16,0.009013209616219193,50,2,UNIFORM,0.26554420582803334,COMPLETE
16,0.8870423225871348,2026-09-01 08:27:11.892407,2026-09-01 08:27:48.179578,0 days 00:00:36.287171,0.08723499748101876,33,0.0015637676087286829,125,2,SUBSPACE,0.020143330891312046,COMPLETE
17,0.8848316221323312,2026-09-01 08:27:48.269869,2026-09-01 08:28:22.503672,0 days 00:00:34.233803,0.30099365669144523,7,0.037072349740867296,200,2,SUBSPACE,0.00035843724261699515,COMPLETE
18,0.8798300414568081,2026-09-01 08:28:22.581841,2026-09-01 08:29:09.567277,0 days 00:00:46.985436,0.37699511520149886,59,0.0017581150525664369,75,2,UNIFORM,0.0033438268966318563,COMPLETE
19,0.8850233688506333,2026-09-01 08:29:09.646511,2026-09-01 08:29:40.370898,0 days 00:00:30.724387,0.13454589641631595,14,0.00035294731495604746,150,2,MIXED,0.27039483302713224,COMPLETE
20,0.8841584878683153,2026-09-01 08:29:40.441555,2026-09-01 08:30:44.470195,0 days 00:01:04.028640,0.011903816938078626,30,0.00010396184035454988,225,2,SUBSPACE,0.03408231345771102,COMPLETE
21,0.8863575128789131,2026-09-01 08:30:44.532962,2026-09-01 08:31:18.847543,0 days 00:00:34.314581,0.07782156409450156,35,0.001813325310199938,100,2,SUBSPACE,0.015353542294175097,COMPLETE
22,0.8864841465429907,2026-09-01 08:31:18.925231,2026-09-01 08:31:46.091423,0 days 00:00:27.166192,0.09882423616592104,16,0.0009086398130537677,125,2,SUBSPACE,0.148602821214918,COMPLETE
23,0.8804796003046392,2026-09-01 08:31:46.145571,2026-09-01 08:32:08.598390,0 days 00:00:22.452819,0.18304484369626153,27,0.00735051182596651,75,2,SUBSPACE,0.0027633304189984328,COMPLETE
24,0.8829321171711656,2026-09-01 08:32:08.667596,2026-09-01 08:32:58.645291,0 days 00:00:49.977695,0.06235556379243319,41,0.002379395131553737,150,2,SUBSPACE,0.7864907536361029,COMPLETE
25,0.8781231813250372,2026-09-01 08:32:58.708725,2026-09-01 08:34:20.901684,0 days 00:01:22.192959,0.22152162013978513,83,0.00021612885451929777,100,2,SUBSPACE,0.02596353098266634,COMPLETE
26,0.8873227577758458,2026-09-01 08:34:20.973346,2026-09-01 08:35:30.348666,0 days 00:01:09.375320,0.12973652770166025,19,0.0011549948690162,275,2,SUBSPACE,0.00013078672996195026,COMPLETE
27,0.8872576447216215,2026-09-01 08:35:30.412530,2026-09-01 08:36:21.540087,0 days 00:00:51.127557,0.13942843613803738,9,0.0005025799127043124,275,2,SUBSPACE,0.00011266852387834943,COMPLETE
28,0.8785814425101128,2026-09-01 08:36:21.620028,2026-09-01 08:37:23.106440,0 days 00:01:01.486412,0.18649763599359787,19,0.012853497670897196,275,2,MIXED,0.00031838833041713746,COMPLETE
29,0.8859771628311336,2026-09-01 08:37:23.177942,2026-09-01 08:37:57.796028,0 days 00:00:34.618086,0.2857575545242795,11,0.0029887803611571197,275,1,UNIFORM,0.0006571632308262876,COMPLETE
30,0.8862430037145875,2026-09-01 08:37:57.867071,2026-09-01 08:38:36.876640,0 days 00:00:39.009569,0.23826260329761562,6,0.0010418835709210775,225,2,MIXED,0.0016713393841446516,COMPLETE
31,0.887589945825939,2026-09-01 08:38:36.940251,2026-09-01 08:39:27.878009,0 days 00:00:50.937758,0.1545947098814407,9,0.0005310605309995535,275,2,SUBSPACE,0.0001154599888899728,COMPLETE
32,0.8872524805828381,2026-09-01 08:39:27.947466,2026-09-01 08:40:28.712763,0 days 00:01:00.765297,0.12495632561842465,14,0.00044417078890821303,300,2,SUBSPACE,0.0001888813656835034,COMPLETE
33,0.8846201169699887,2026-09-01 08:40:28.792165,2026-09-01 08:41:08.954097,0 days 00:00:40.161932,0.1616690007948945,9,0.00017613400209779852,225,2,SUBSPACE,0.00017308951219701274,COMPLETE
34,0.8875951099647221,2026-09-01 08:41:09.017972,2026-09-01 08:42:02.072371,0 days 00:00:53.054399,0.10779824754391348,11,0.000914974112261757,275,2,SUBSPACE,0.0004717323869417922,COMPLETE
35,0.8849405181023272,2026-09-01 08:42:02.147049,2026-09-01 08:42:51.043987,0 days 00:00:48.896938,0.10337541408952633,11,0.0007669323808210266,250,2,UNIFORM,0.0005318024449772989,COMPLETE
36,0.8863485317679857,2026-09-01 08:42:51.123516,2026-09-01 08:43:10.254960,0 days 00:00:19.131444,0.05985349692734406,5,0.00032354330769327573,175,1,SUBSPACE,0.00026848895206373107,COMPLETE
37,0.886220999992815,2026-09-01 08:43:10.319282,2026-09-01 08:43:54.330217,0 days 00:00:44.010935,0.20322622421095657,7,0.0006518846301375744,250,2,MIXED,0.007939535511398435,COMPLETE
38,0.8128814726866455,2026-09-01 08:43:54.397491,2026-09-01 08:44:47.335189,0 days 00:00:52.937698,0.260777975306714,9,0.02989754433930088,300,2,SUBSPACE,0.0004674547707035436,COMPLETE
39,0.8833407577183667,2026-09-01 08:44:47.410910,2026-09-01 08:45:24.712327,0 days 00:00:37.301417,0.16724256155328837,14,0.0067974689881682504,275,1,SUBSPACE,0.001030856712182198,COMPLETE
40,0.8844032231410897,2026-09-01 08:45:24.775649,2026-09-01 08:46:20.732249,0 days 00:00:55.956600,0.04028096760062071,24,0.00014445720419812094,200,2,UNIFORM,0.00020310849396246915,COMPLETE
41,0.8876624682966784,2026-09-01 08:46:20.815131,2026-09-01 08:47:23.924821,0 days 00:01:03.109690,0.1160004640403547,19,0.001080060011181116,275,2,SUBSPACE,0.00010858038070989602,COMPLETE
42,0.8870629791422682,2026-09-01 08:47:23.991856,2026-09-01 08:48:13.450337,0 days 00:00:49.458481,0.11651213783363379,17,0.00044613014444309766,225,2,SUBSPACE,0.0001585391140430613,COMPLETE
43,0.8837121266552188,2026-09-01 08:48:13.526621,2026-09-01 08:49:02.091718,0 days 00:00:48.565097,0.14589029210026744,12,0.004696280886098536,250,2,SUBSPACE,0.00010982417270934895,COMPLETE
44,0.8858235858342733,2026-09-01 08:49:02.154972,2026-09-01 08:50:10.686896,0 days 00:01:08.531924,0.07545835538811027,19,0.0012450275658345891,300,2,SUBSPACE,0.0006728801736003374,COMPLETE
45,0.8871768147232739,2026-09-01 08:50:10.772977,2026-09-01 08:51:27.074314,0 days 00:01:16.301337,0.10717478643996584,24,0.0006072454922351619,275,2,SUBSPACE,0.000284964100346419,COMPLETE
46,0.8868117325640712,2026-09-01 08:51:27.163633,2026-09-01 08:52:14.792304,0 days 00:00:47.628671,0.21113197510674628,10,0.002351079963809539,250,2,SUBSPACE,0.0014493200080087656,COMPLETE
47,0.886025660830142,2026-09-01 08:52:14.871474,2026-09-01 08:53:06.920548,0 days 00:00:52.049074,0.17984412973839936,7,0.0002501442630718132,300,2,SUBSPACE,0.0003783285075176179,COMPLETE
48,0.5894006725055863,2026-09-01 08:53:06.991207,2026-09-01 08:53:40.627895,0 days 00:00:33.636688,0.16083137486482052,13,0.054008155549483086,175,2,SUBSPACE,0.00022174975281575747,COMPLETE
49,0.8880010561786451,2026-09-01 08:53:40.708209,2026-09-01 08:54:40.015488,0 days 00:00:59.307279,0.48661596234250465,17,0.000825527750983732,275,2,MIXED,0.00010246890454947991,COMPLETE
50,0.8855483147843455,2026-09-01 08:54:40.087689,2026-09-01 08:55:32.392874,0 days 00:00:52.305185,0.48890217551496906,16,0.0008267454280689942,250,2,MIXED,0.0001032623725311344,COMPLETE
51,0.8842164160337977,2026-09-01 08:55:32.463295,2026-09-01 08:56:44.459091,0 days 00:01:11.995796,0.34011435338996077,22,0.0012964853640245278,275,2,MIXED,0.00015570799668631892,COMPLETE
52,0.883605700490728,2026-09-01 08:56:44.523080,2026-09-01 08:58:10.169851,0 days 00:01:25.646771,0.3992170399672093,27,0.0003324179914351063,300,2,MIXED,0.00027102293801668114,COMPLETE
53,0.8839647204000547,2026-09-01 08:58:10.243411,2026-09-01 08:59:03.774745,0 days 00:00:53.531334,0.408254995228469,17,0.02311846611845356,250,2,MIXED,0.006112127723725196,COMPLETE
54,0.8849230049360185,2026-09-01 08:59:03.857327,2026-09-01 08:59:53.350929,0 days 00:00:49.493602,0.4462681664793876,8,0.000651929618951046,275,2,MIXED,0.08020336942328059,COMPLETE
55,0.882457016403101,2026-09-01 08:59:53.422102,2026-09-01 09:00:38.572386,0 days 00:00:45.150284,0.023752022204695133,14,0.0032393465873423884,225,2,SUBSPACE,0.00010003202913353759,COMPLETE
56,0.8866705045947363,2026-09-01 09:00:38.644219,2026-09-01 09:01:21.876876,0 days 00:00:43.232657,0.08988468205688242,31,0.0014720388217246219,150,2,SUBSPACE,0.0004400573593160667,COMPLETE
57,0.5,2026-09-01 09:01:21.944049,2026-09-01 09:01:35.445803,0 days 00:00:13.501754,0.4590820816916228,21,0.09432633171112806,50,2,SUBSPACE,0.12159107297790207,COMPLETE
58,0.886447099460415,2026-09-01 09:01:35.516777,2026-09-01 09:02:32.278000,0 days 00:00:56.761223,0.3208331941507145,12,0.002120064061855989,300,2,UNIFORM,0.0007236177070167099,COMPLETE
59,0.8850446989890861,2026-09-01 09:02:32.357225,2026-09-01 09:04:11.067894,0 days 00:01:38.710669,0.11933659122038856,42,0.0008737491847941567,200,2,SUBSPACE,0.002172549642316605,COMPLETE
60,0.8853877774265166,2026-09-01 09:04:11.140823,2026-09-01 09:05:30.808334,0 days 00:01:19.667511,0.049261260770930196,26,0.0005232298328326147,275,2,SUBSPACE,0.0001517079928303892,COMPLETE
61,0.8877576680725099,2026-09-01 09:05:30.877436,2026-09-01 09:06:33.423392,0 days 00:01:02.545956,0.14378288590683289,19,0.0010915217623815,275,2,SUBSPACE,0.00013154039974072723,COMPLETE
62,0.8877179266566557,2026-09-01 09:06:33.490403,2026-09-01 09:07:34.250836,0 days 00:01:00.760433,0.14983254600207677,17,0.000891599712137645,275,2,SUBSPACE,0.00021402883566837936,COMPLETE
63,0.887780569905375,2026-09-01 09:07:34.330059,2026-09-01 09:08:37.163285,0 days 00:01:02.833226,0.1435992970275448,19,0.001030284580572991,275,2,SUBSPACE,0.00021068193788226124,COMPLETE
64,0.8848457673820421,2026-09-01 09:08:37.233746,2026-09-01 09:09:40.086673,0 days 00:01:02.852927,0.07763680333204964,19,0.0010009264445314887,275,2,SUBSPACE,0.00021890559761300688,COMPLETE
65,0.8876916569071928,2026-09-01 09:09:40.156850,2026-09-01 09:10:31.581216,0 days 00:00:51.424366,0.13523435803049322,15,0.0018415177166726101,250,2,SUBSPACE,0.0003501620423333996,COMPLETE
66,0.8874590461341706,2026-09-01 09:10:31.658410,2026-09-01 09:11:24.683181,0 days 00:00:53.024771,0.18935007075085886,16,0.001473746682447943,250,2,SUBSPACE,0.00029689137266532766,COMPLETE
67,0.8875598591043318,2026-09-01 09:11:24.755605,2026-09-01 09:12:32.195819,0 days 00:01:07.440214,0.13545601659808526,18,0.001944249550095771,300,2,MIXED,0.00015123460182478853,COMPLETE
68,0.8877655265445714,2026-09-01 09:12:32.266609,2026-09-01 09:13:33.494568,0 days 00:01:01.227959,0.14396526821102787,15,0.002878792443046369,300,2,SUBSPACE,0.00036412619702980365,COMPLETE
69,0.8830277660025434,2026-09-01 09:13:33.562348,2026-09-01 09:14:34.412744,0 days 00:01:00.850396,0.14240229118613115,15,0.005728613543907776,300,2,SUBSPACE,0.0008283963919714084,COMPLETE
70,0.8807770996041127,2026-09-01 09:14:34.481625,2026-09-01 09:15:00.551822,0 days 00:00:26.070197,0.19143901769021643,21,0.011094682688608314,100,2,SUBSPACE,0.0005427098477277448,COMPLETE
71,0.8878126773769408,2026-09-01 09:15:00.627735,2026-09-01 09:15:55.188022,0 days 00:00:54.560287,0.12581155606581929,13,0.0010957248739856455,275,2,SUBSPACE,0.0003773140317280008,COMPLETE
72,0.887641587213772,2026-09-01 09:15:55.248940,2026-09-01 09:16:50.116624,0 days 00:00:54.867684,0.17247771436036316,13,0.002656605077541558,275,2,SUBSPACE,0.00034315262372866247,COMPLETE
73,0.887733868128552,2026-09-01 09:16:50.188183,2026-09-01 09:17:51.531144,0 days 00:01:01.342961,0.1499003395768677,15,0.0016287490836221687,300,2,SUBSPACE,0.00023656224455056153,COMPLETE
74,0.8873209615536604,2026-09-01 09:17:51.594906,2026-09-01 09:18:50.612650,0 days 00:00:59.017744,0.1506702112675649,13,0.0012842645419921556,300,2,SUBSPACE,0.00021324886183327237,COMPLETE
75,0.8846472848305444,2026-09-01 09:18:50.683837,2026-09-01 09:19:45.986658,0 days 00:00:55.302821,0.2563921979243987,10,0.0036779425108446986,300,2,SUBSPACE,0.00024813381603203534,COMPLETE
76,0.8762456800856439,2026-09-01 09:19:46.067823,2026-09-01 09:26:18.083979,0 days 00:06:32.016156,0.09397621038363584,144,0.000755795094408456,300,2,UNIFORM,0.0001474996624847959,COMPLETE
77,0.8860180268858537,2026-09-01 09:26:18.211632,2026-09-01 09:27:32.548088,0 days 00:01:14.336456,0.22879168977504022,22,0.0003913971068586476,275,2,SUBSPACE,0.00018920655426525373,COMPLETE
78,0.8869159134508302,2026-09-01 09:27:32.627343,2026-09-01 09:28:33.278459,0 days 00:01:00.651116,0.16236965472014947,17,0.0041250172476771695,275,2,SUBSPACE,0.0004100933654808143,COMPLETE
79,0.8867769307592271,2026-09-01 09:28:33.347150,2026-09-01 09:28:59.608165,0 days 00:00:26.261015,0.12760451277702564,15,0.0015858898208883033,125,2,MIXED,0.0005800911042112775,COMPLETE
80,0.8845942962760722,2026-09-01 09:28:59.686402,2026-09-01 09:30:25.995055,0 days 00:01:26.308653,0.20771465377039688,26,0.0006693743186445007,300,2,SUBSPACE,0.00013906120033235916,COMPLETE
81,0.8872872823876822,2026-09-01 09:30:26.074078,2026-09-01 09:31:17.417353,0 days 00:00:51.343275,0.1364680539837972,15,0.001891642710248612,250,2,SUBSPACE,0.0003543581629970905,COMPLETE
82,0.8878373754319915,2026-09-01 09:31:17.486291,2026-09-01 09:32:12.715628,0 days 00:00:55.229337,0.15081969054146407,17,0.0009835853756337632,250,2,SUBSPACE,0.0002717045530249455,COMPLETE
83,0.8877518303504071,2026-09-01 09:32:12.779163,2026-09-01 09:33:15.085883,0 days 00:01:02.306720,0.14938902089347017,18,0.0011468578669578333,275,2,SUBSPACE,0.00024897435000652605,COMPLETE
84,0.8863312431294501,2026-09-01 09:33:15.164935,2026-09-01 09:34:32.903157,0 days 00:01:17.738222,0.11170449520904609,20,0.0010984424840657597,300,2,SUBSPACE,0.0002520264009711637,COMPLETE
85,0.8878847507921341,2026-09-01 09:34:32.977965,2026-09-01 09:35:28.488308,0 days 00:00:55.510343,0.19754105160239394,12,0.0014530890140300027,275,2,SUBSPACE,0.0009169355206765265,COMPLETE
86,0.8871615468346972,2026-09-01 09:35:28.592200,2026-09-01 09:36:30.403231,0 days 00:01:01.811031,0.19664422071944432,12,0.002613921605608166,250,2,SUBSPACE,0.0010242030104834995,COMPLETE
87,0.8634123461535698,2026-09-01 09:36:30.496369,2026-09-01 09:37:11.976648,0 days 00:00:41.480279,0.17358219977939307,10,0.04684599336050813,275,1,SUBSPACE,0.000803117888415763,COMPLETE
88,0.8859812043310508,2026-09-01 09:37:12.062369,2026-09-01 09:38:19.381771,0 days 00:01:07.319402,0.12810650800312082,18,0.0013070437673684211,250,2,UNIFORM,0.0014001255858950572,COMPLETE
89,0.8854214565924947,2026-09-01 09:38:19.461941,2026-09-01 09:39:45.514459,0 days 00:01:26.052518,0.06737163023067425,23,0.0005912742392321889,275,2,SUBSPACE,0.00017640809213539894,COMPLETE
90,0.8862378395758043,2026-09-01 09:39:45.596852,2026-09-01 09:40:39.778159,0 days 00:00:54.181307,0.21667705642745494,11,0.0010051279647226737,225,2,MIXED,0.0001306043017388223,COMPLETE
91,0.8877143342122849,2026-09-01 09:40:39.859483,2026-09-01 09:41:47.502571,0 days 00:01:07.643088,0.15562039601493383,13,0.001580377901449673,275,2,SUBSPACE,0.0002911075027613156,COMPLETE
92,0.8873867481912043,2026-09-01 09:41:47.567067,2026-09-01 09:43:03.070840,0 days 00:01:15.503773,0.1718218001359172,14,0.0007311688379536368,300,2,SUBSPACE,0.0004296394011072286,COMPLETE
93,0.886170481243848,2026-09-01 09:43:03.159842,2026-09-01 09:44:28.647167,0 days 00:01:25.487325,0.098930014866047,20,0.0011937874838407712,275,2,SUBSPACE,0.00017537693324763185,COMPLETE
94,0.8879786034013263,2026-09-01 09:44:28.749387,2026-09-01 09:45:52.021128,0 days 00:01:23.271741,0.18097424082732577,18,0.002090834510348158,300,2,SUBSPACE,0.0005543713992498964,COMPLETE
95,0.8768568446842601,2026-09-01 09:45:52.107885,2026-09-01 09:47:06.746942,0 days 00:01:14.639057,0.17769975705797864,18,0.01972586052458304,275,2,SUBSPACE,0.000616694528743046,COMPLETE
96,0.8863413468792436,2026-09-01 09:47:06.836039,2026-09-01 09:47:52.801155,0 days 00:00:45.965116,0.2837974594561837,16,0.0022258078486805345,175,2,SUBSPACE,0.0012695859448920972,COMPLETE
97,0.8777976160539154,2026-09-01 09:47:52.886442,2026-09-01 09:48:45.024876,0 days 00:00:52.138434,0.12091009013645776,95,0.00141739001271801,50,2,SUBSPACE,0.0004894291344295803,COMPLETE
98,0.8844921361392718,2026-09-01 09:48:45.118271,2026-09-01 09:50:06.270958,0 days 00:01:21.152687,0.16524346910635365,29,0.0008584009024346115,250,2,SUBSPACE,0.0008572035196606952,COMPLETE
99,0.8847797562167249,2026-09-01 09:50:06.361170,2026-09-01 09:51:33.242654,0 days 00:01:26.881484,0.3683673018763016,25,0.0027741069066178708,275,2,MIXED,0.0003061518135253975,COMPLETE
100,0.8870304226151557,2026-09-01 09:51:33.338522,2026-09-01 09:52:46.298431,0 days 00:01:12.959909,0.08648018472789344,12,0.0010770350408186968,300,2,SUBSPACE,0.0001318492074893179,COMPLETE
101,0.8876676324354618,2026-09-01 09:52:46.384228,2026-09-01 09:54:08.727965,0 days 00:01:22.343737,0.1453313812965227,17,0.0016849870078747495,300,2,SUBSPACE,0.00023620571829099606,COMPLETE
102,0.8875064214943131,2026-09-01 09:54:08.806258,2026-09-01 09:55:41.831786,0 days 00:01:33.025528,0.15702518095724,20,0.0009690709930315127,300,2,SUBSPACE,0.00039730710731529186,COMPLETE
103,0.8871433600850691,2026-09-01 09:55:41.923601,2026-09-01 09:56:51.210316,0 days 00:01:09.286715,0.18582346015547907,15,0.001967558744797562,275,2,SUBSPACE,0.0001237143770946409,COMPLETE
104,0.8877832642386533,2026-09-01 09:56:51.293030,2026-09-01 09:58:05.306726,0 days 00:01:14.013696,0.11042060758345933,14,0.0012343052537716556,300,2,SUBSPACE,0.0017543698675258341,COMPLETE
105,0.8873548652474117,2026-09-01 09:58:05.391630,2026-09-01 09:59:30.946202,0 days 00:01:25.554572,0.12735979866284342,23,0.0007686328445703724,275,2,SUBSPACE,0.0006850128611819079,COMPLETE
106,0.8872553994438895,2026-09-01 09:59:31.030138,2026-09-01 10:00:45.860093,0 days 00:01:14.829955,0.11141561194621813,13,0.0004662748186455013,300,2,SUBSPACE,0.002819514510602133,COMPLETE
107,0.8875587364654659,2026-09-01 10:00:45.947226,2026-09-01 10:01:55.167344,0 days 00:01:09.220118,0.19684662930775648,14,0.0005602040115833563,275,2,SUBSPACE,0.00393831511970676,COMPLETE
108,0.8859627930536496,2026-09-01 10:01:55.268751,2026-09-01 10:02:22.123281,0 days 00:00:26.854530,0.10610117166803193,16,0.00119458438728301,100,2,SUBSPACE,0.0021464722736414983,COMPLETE
109,0.8855494374232116,2026-09-01 10:02:22.208599,2026-09-01 10:03:31.794928,0 days 00:01:09.586329,0.14082402590900805,18,0.002316656038763378,250,2,UNIFORM,0.0011858458563040707,COMPLETE
110,0.8863361827404603,2026-09-01 10:03:31.884199,2026-09-01 10:03:50.484333,0 days 00:00:18.600134,0.4340218705812996,12,0.0013556331618094725,75,2,MIXED,0.0017114361053270155,COMPLETE
111,0.8871236016410285,2026-09-01 10:03:50.562778,2026-09-01 10:05:09.132569,0 days 00:01:18.569791,0.15079534472119266,16,0.0016537930134605736,300,2,SUBSPACE,0.00019301705816614781,COMPLETE
112,0.8880131806783972,2026-09-01 10:05:09.211998,2026-09-01 10:06:24.241458,0 days 00:01:15.029460,0.16560234667961213,14,0.0009231543824991738,300,2,SUBSPACE,0.0005106287103363537,COMPLETE
113,0.8869650850331582,2026-09-01 10:06:24.333580,2026-09-01 10:07:57.647645,0 days 00:01:33.314065,0.16688382832389562,20,0.0006954689167646501,300,2,SUBSPACE,0.00048642045866229336,COMPLETE
114,0.8877484624338092,2026-09-01 10:07:57.733504,2026-09-01 10:09:07.147917,0 days 00:01:09.414413,0.12140754876201537,14,0.0009311424132057623,275,2,SUBSPACE,0.000989437292823688,COMPLETE
