number,value,datetime_start,datetime_complete,duration,params_contamination,params_leaf_size,params_metric,params_n_neighbors,params_p,state
149,0.8923236648680495,2026-09-01 08:01:52.630125,2026-09-01 08:01:53.999824,0 days 00:00:01.369699,0.07517192774977323,50,manhattan,12,,COMPLETE
150,0.8920861144840172,2026-09-01 08:01:54.078068,2026-09-01 08:01:55.451863,0 days 00:00:01.373795,0.08534318399780749,40,manhattan,11,,COMPLETE
151,0.8924940814478989,2026-09-01 08:01:55.512432,2026-09-01 08:01:56.881390,0 days 00:00:01.368958,0.34810183832783703,40,manhattan,13,,COMPLETE
152,0.892181763315395,2026-09-01 08:01:56.960724,2026-09-01 08:01:58.338854,0 days 00:00:01.378130,0.34600579654525215,30,manhattan,14,,COMPLETE
153,0.8924940814478989,2026-09-01 08:01:58.410372,2026-09-01 08:01:59.762744,0 days 00:00:01.352372,0.3085753711702758,30,manhattan,13,,COMPLETE
154,0.8903756619078753,2026-09-01 08:01:59.850856,2026-09-01 08:02:01.249328,0 days 00:00:01.398472,0.34192414771964025,40,manhattan,15,,COMPLETE
155,0.8923236648680495,2026-09-01 08:02:01.322971,2026-09-01 08:02:02.697728,0 days 00:00:01.374757,0.11748429466961274,60,manhattan,12,,COMPLETE
156,0.892181763315395,2026-09-01 08:02:02.771345,2026-09-01 08:02:04.145091,0 days 00:00:01.373746,0.14030586667636993,50,manhattan,14,,COMPLETE
157,0.8750222282495456,2026-09-01 08:02:04.219797,2026-09-01 08:02:04.332185,0 days 00:00:00.112388,0.36250075176178237,60,minkowski,10,2.0,COMPLETE
158,0.8923236648680495,2026-09-01 08:02:04.395607,2026-09-01 08:02:05.772516,0 days 00:00:01.376909,0.1321765378986064,50,manhattan,12,,COMPLETE
159,0.8889512577147745,2026-09-01 08:02:05.847948,2026-09-01 08:02:07.231459,0 days 00:00:01.383511,0.3224504908387403,50,manhattan,16,,COMPLETE
160,0.8924940814478989,2026-09-01 08:02:07.308676,2026-09-01 08:02:08.677321,0 days 00:00:01.368645,0.14958317162098214,60,manhattan,13,,COMPLETE
161,0.8924940814478989,2026-09-01 08:02:08.756582,2026-09-01 08:02:10.147758,0 days 00:00:01.391176,0.14432578057040787,50,manhattan,13,,COMPLETE
162,0.892181763315395,2026-09-01 08:02:10.223847,2026-09-01 08:02:11.590358,0 days 00:00:01.366511,0.3344289987186862,50,manhattan,14,,COMPLETE
163,0.8923236648680495,2026-09-01 08:02:11.651656,2026-09-01 08:02:13.030797,0 days 00:00:01.379141,0.11858284947613504,50,manhattan,12,,COMPLETE
164,0.8903756619078753,2026-09-01 08:02:13.094035,2026-09-01 08:02:14.477863,0 days 00:00:01.383828,0.1588642070229198,50,manhattan,15,,COMPLETE
165,0.8924940814478989,2026-09-01 08:02:14.555112,2026-09-01 08:02:15.910411,0 days 00:00:01.355299,0.1344092889853366,50,manhattan,13,,COMPLETE
166,0.8920861144840172,2026-09-01 08:02:15.989738,2026-09-01 08:02:17.368237,0 days 00:00:01.378499,0.11006157574054395,50,manhattan,11,,COMPLETE
167,0.892181763315395,2026-09-01 08:02:17.439947,2026-09-01 08:02:18.807217,0 days 00:00:01.367270,0.3095263647120411,50,manhattan,14,,COMPLETE
168,0.8924940814478989,2026-09-01 08:02:18.878610,2026-09-01 08:02:20.285085,0 days 00:00:01.406475,0.12903399220656053,50,manhattan,13,,COMPLETE
169,0.8923236648680495,2026-09-01 08:02:20.358926,2026-09-01 08:02:21.752608,0 days 00:00:01.393682,0.10201850292098331,60,manhattan,12,,COMPLETE
170,0.8876907587961,2026-09-01 08:02:21.832748,2026-09-01 08:02:23.201912,0 days 00:00:01.369164,0.11999650042763822,50,manhattan,17,,COMPLETE
171,0.8924940814478989,2026-09-01 08:02:23.290576,2026-09-01 08:02:24.665537,0 days 00:00:01.374961,0.07851107900753145,60,manhattan,13,,COMPLETE
172,0.8924940814478989,2026-09-01 08:02:24.738443,2026-09-01 08:02:26.112526,0 days 00:00:01.374083,0.045983083488230554,60,manhattan,13,,COMPLETE
173,0.8923236648680495,2026-09-01 08:02:26.185554,2026-09-01 08:02:27.573031,0 days 00:00:01.387477,0.021296980505955708,60,manhattan,12,,COMPLETE
174,0.892181763315395,2026-09-01 08:02:27.636443,2026-09-01 08:02:29.002947,0 days 00:00:01.366504,0.1448128508274102,60,manhattan,14,,COMPLETE
175,0.8903756619078753,2026-09-01 08:02:29.092164,2026-09-01 08:02:30.474918,0 days 00:00:01.382754,0.08854763729007978,60,manhattan,15,,COMPLETE
176,0.8460413059253776,2026-09-01 08:02:30.551782,2026-09-01 08:02:30.697837,0 days 00:00:00.146055,0.12379705762823717,50,euclidean,55,,COMPLETE
177,0.8920861144840172,2026-09-01 08:02:30.757059,2026-09-01 08:02:32.143901,0 days 00:00:01.386842,0.06483163359750994,50,manhattan,11,,COMPLETE
178,0.8923236648680495,2026-09-01 08:02:32.207353,2026-09-01 08:02:33.593659,0 days 00:00:01.386306,0.053475984388976085,60,manhattan,12,,COMPLETE
179,0.8924940814478989,2026-09-01 08:02:33.668219,2026-09-01 08:02:35.036207,0 days 00:00:01.367988,0.09870643501548487,50,manhattan,13,,COMPLETE
180,0.8903756619078753,2026-09-01 08:02:35.116902,2026-09-01 08:02:36.497083,0 days 00:00:01.380181,0.15641471506823215,50,manhattan,15,,COMPLETE
181,0.8924940814478989,2026-09-01 08:02:36.569395,2026-09-01 08:02:37.949334,0 days 00:00:01.379939,0.1363243450853669,50,manhattan,13,,COMPLETE
182,0.8924940814478989,2026-09-01 08:02:38.021277,2026-09-01 08:02:39.388241,0 days 00:00:01.366964,0.11001768058089709,50,manhattan,13,,COMPLETE
183,0.892181763315395,2026-09-01 08:02:39.467243,2026-09-01 08:02:40.828757,0 days 00:00:01.361514,0.12210037957324013,50,manhattan,14,,COMPLETE
184,0.8923236648680495,2026-09-01 08:02:40.908041,2026-09-01 08:02:42.278470,0 days 00:00:01.370429,0.14107623353390325,50,manhattan,12,,COMPLETE
185,0.8920861144840172,2026-09-01 08:02:42.345139,2026-09-01 08:02:43.718615,0 days 00:00:01.373476,0.1286640515100985,50,manhattan,11,,COMPLETE
186,0.8924940814478989,2026-09-01 08:02:43.782111,2026-09-01 08:02:45.156098,0 days 00:00:01.373987,0.114654833963289,50,manhattan,13,,COMPLETE
187,0.892181763315395,2026-09-01 08:02:45.235551,2026-09-01 08:02:46.606519,0 days 00:00:01.370968,0.1442268018437333,20,minkowski,14,1.0,COMPLETE
188,0.8923236648680495,2026-09-01 08:02:46.685798,2026-09-01 08:02:48.060048,0 days 00:00:01.374250,0.10112424043856624,60,manhattan,12,,COMPLETE
189,0.892181763315395,2026-09-01 08:02:48.130287,2026-09-01 08:02:49.502851,0 days 00:00:01.372564,0.12345260921060155,40,manhattan,14,,COMPLETE
190,0.8924758946982707,2026-09-01 08:02:49.585631,2026-09-01 08:02:50.948492,0 days 00:00:01.362861,0.16921328229450158,50,manhattan,10,,COMPLETE
191,0.8924940814478989,2026-09-01 08:02:51.019474,2026-09-01 08:02:52.382691,0 days 00:00:01.363217,0.15253447988729663,50,manhattan,13,,COMPLETE
192,0.8923236648680495,2026-09-01 08:02:52.456297,2026-09-01 08:02:53.843037,0 days 00:00:01.386740,0.13516627747631615,50,manhattan,12,,COMPLETE
193,0.8924940814478989,2026-09-01 08:02:53.906995,2026-09-01 08:02:55.282422,0 days 00:00:01.375427,0.17543849113872756,50,manhattan,13,,COMPLETE
194,0.8903756619078753,2026-09-01 08:02:55.358230,2026-09-01 08:02:56.731366,0 days 00:00:01.373136,0.13458952711898356,50,manhattan,15,,COMPLETE
195,0.8923236648680495,2026-09-01 08:02:56.803054,2026-09-01 08:02:58.179740,0 days 00:00:01.376686,0.10961356659607224,50,manhattan,12,,COMPLETE
196,0.892181763315395,2026-09-01 08:02:58.260507,2026-09-01 08:02:59.622156,0 days 00:00:01.361649,0.16125178482617153,50,manhattan,14,,COMPLETE
197,0.8924940814478989,2026-09-01 08:02:59.701488,2026-09-01 08:03:01.088215,0 days 00:00:01.386727,0.11801272911436937,60,manhattan,13,,COMPLETE
198,0.8920861144840172,2026-09-01 08:03:01.157416,2026-09-01 08:03:02.525962,0 days 00:00:01.368546,0.2552357510501026,50,manhattan,11,,COMPLETE
199,0.8903756619078753,2026-09-01 08:03:02.605268,2026-09-01 08:03:03.976273,0 days 00:00:01.371005,0.32281818441025745,50,manhattan,15,,COMPLETE
