number,value,datetime_start,datetime_complete,duration,params_coef0,params_degree,params_gamma,params_kernel,params_nu,state
0,0.6182130397308783,2026-09-01 18:56:58.537163,2026-09-01 18:57:23.511147,0 days 00:00:24.973984,0.2482102251210051,,scale,sigmoid,0.457771400966063,COMPLETE
1,0.5708959623010057,2026-09-01 18:57:23.582638,2026-09-01 18:57:34.942894,0 days 00:00:11.360256,0.56609806415636,,auto,sigmoid,0.20556463082979629,COMPLETE
2,0.5829962617824949,2026-09-01 18:57:35.013267,2026-09-01 18:57:47.382135,0 days 00:00:12.368868,0.6248217336516185,5.0,auto,poly,0.22997530625967222,COMPLETE
3,0.6343616903179294,2026-09-01 18:57:47.460049,2026-09-01 18:58:09.266920,0 days 00:00:21.806871,0.7267095670629896,5.0,auto,poly,0.491523066281521,COMPLETE
4,0.7918648054991837,2026-09-01 18:58:09.339208,2026-09-01 18:58:15.700704,0 days 00:00:06.361496,,,auto,rbf,0.10084813565750601,COMPLETE
5,0.5835995155409813,2026-09-01 18:58:15.772561,2026-09-01 18:58:36.785455,0 days 00:00:21.012894,0.3706378578800389,2.0,auto,poly,0.3603154487751809,COMPLETE
6,0.570008219837624,2026-09-01 18:58:36.874069,2026-09-01 18:58:49.341986,0 days 00:00:12.467917,0.9798176953017798,,auto,sigmoid,0.14565524008727823,COMPLETE
7,0.5689896584713597,2026-09-01 18:58:49.416323,2026-09-01 18:58:50.205030,0 days 00:00:00.788707,0.7555503030728158,,auto,sigmoid,0.020792508519115387,COMPLETE
8,0.7198614227678276,2026-09-01 18:58:50.298268,2026-09-01 18:58:56.664342,0 days 00:00:06.366074,0.25400855986968496,2.0,scale,poly,0.09588868773256108,COMPLETE
9,0.7991651189506548,2026-09-01 18:58:56.736741,2026-09-01 18:59:08.247393,0 days 00:00:11.510652,,,auto,rbf,0.15373239683064463,COMPLETE
10,0.8504758150923204,2026-09-01 18:59:08.318789,2026-09-01 18:59:28.885194,0 days 00:00:20.566405,,,scale,rbf,0.3080496987063302,COMPLETE
11,0.8513037360970614,2026-09-01 18:59:28.957094,2026-09-01 18:59:50.308831,0 days 00:00:21.351737,,,scale,rbf,0.2940477800340864,COMPLETE
12,0.8491678755274605,2026-09-01 18:59:50.381761,2026-09-01 19:00:12.763262,0 days 00:00:22.381501,,,scale,rbf,0.3263983485886668,COMPLETE
13,0.8491284602210999,2026-09-01 19:00:12.838607,2026-09-01 19:00:35.318033,0 days 00:00:22.479426,,,scale,rbf,0.3279138279929875,COMPLETE
14,0.8534323622116975,2026-09-01 19:00:35.390791,2026-09-01 19:00:54.484727,0 days 00:00:19.093936,,,scale,rbf,0.26886858076888487,COMPLETE
15,0.8552668703124161,2026-09-01 19:00:54.558273,2026-09-01 19:01:12.969017,0 days 00:00:18.410744,,,scale,rbf,0.2512665439328045,COMPLETE
16,0.855461601882954,2026-09-01 19:01:13.042625,2026-09-01 19:01:31.314370,0 days 00:00:18.271745,,,scale,rbf,0.24839772685892178,COMPLETE
17,0.8383596497027014,2026-09-01 19:01:31.385809,2026-09-01 19:01:55.175385,0 days 00:00:23.789576,,,scale,rbf,0.41053956676938547,COMPLETE
18,0.8550907487536157,2026-09-01 19:01:55.245085,2026-09-01 19:02:10.420706,0 days 00:00:15.175621,,,scale,rbf,0.23554917571845538,COMPLETE
19,0.8386626985265412,2026-09-01 19:02:10.490980,2026-09-01 19:02:33.223110,0 days 00:00:22.732130,,,scale,rbf,0.38255857672953153,COMPLETE
20,0.8476689463515272,2026-09-01 19:02:33.293800,2026-09-01 19:02:44.433031,0 days 00:00:11.139231,,,scale,rbf,0.1726271304681234,COMPLETE
21,0.8555590924002051,2026-09-01 19:02:44.513598,2026-09-01 19:03:02.333251,0 days 00:00:17.819653,,,scale,rbf,0.24771446400337058,COMPLETE
22,0.8535093467910827,2026-09-01 19:03:02.404845,2026-09-01 19:03:20.687999,0 days 00:00:18.283154,,,scale,rbf,0.2685311746138385,COMPLETE
23,0.8521482714018254,2026-09-01 19:03:20.760334,2026-09-01 19:03:34.729492,0 days 00:00:13.969158,,,scale,rbf,0.20266250313428752,COMPLETE
24,0.8535701661055806,2026-09-01 19:03:34.802564,2026-09-01 19:03:52.927187,0 days 00:00:18.124623,,,scale,rbf,0.2679515377260056,COMPLETE
25,0.8366827030418389,2026-09-01 19:03:53.000119,2026-09-01 19:04:00.022114,0 days 00:00:07.021995,,,scale,rbf,0.10848979550078189,COMPLETE
26,0.8550853603319867,2026-09-01 19:04:00.093223,2026-09-01 19:04:16.266728,0 days 00:00:16.173505,,,scale,rbf,0.23666375966037093,COMPLETE
27,0.8500519259241704,2026-09-01 19:04:16.337794,2026-09-01 19:04:29.216804,0 days 00:00:12.879010,,,scale,rbf,0.18752344594796436,COMPLETE
28,0.5673912430664609,2026-09-01 19:04:29.289219,2026-09-01 19:04:51.261400,0 days 00:00:21.972181,0.11197918313812238,,scale,sigmoid,0.38407931547588964,COMPLETE
29,0.6669327033536687,2026-09-01 19:04:51.332840,2026-09-01 19:05:11.866909,0 days 00:00:20.534069,0.04074995066374354,3.0,scale,poly,0.4490453362415728,COMPLETE
30,0.553679955196272,2026-09-01 19:05:11.939986,2026-09-01 19:05:13.945238,0 days 00:00:02.005252,0.9256219523313141,,scale,sigmoid,0.046686499218092314,COMPLETE
31,0.8550612122202418,2026-09-01 19:05:14.017198,2026-09-01 19:05:30.642016,0 days 00:00:16.624818,,,scale,rbf,0.23633451735645422,COMPLETE
32,0.854338664794024,2026-09-01 19:05:30.711907,2026-09-01 19:05:45.825649,0 days 00:00:15.113742,,,scale,rbf,0.22141821537872095,COMPLETE
33,0.8512649195042155,2026-09-01 19:05:45.897792,2026-09-01 19:06:05.588519,0 days 00:00:19.690727,,,scale,rbf,0.29440598736315826,COMPLETE
34,0.8551711759357081,2026-09-01 19:06:05.659656,2026-09-01 19:06:22.946789,0 days 00:00:17.287133,,,scale,rbf,0.2548084469893407,COMPLETE
35,0.8547174009846343,2026-09-01 19:06:23.017331,2026-09-01 19:06:40.598887,0 days 00:00:17.581556,,,scale,rbf,0.25912949364273086,COMPLETE
36,0.7026649736378956,2026-09-01 19:06:40.673625,2026-09-01 19:06:56.892692,0 days 00:00:16.219067,0.4725324286869847,4.0,scale,poly,0.3337145933294283,COMPLETE
37,0.5702860728010687,2026-09-01 19:06:56.964040,2026-09-01 19:07:07.736097,0 days 00:00:10.772057,0.8358879686500496,,auto,sigmoid,0.19876753077735576,COMPLETE
38,0.8464488181021032,2026-09-01 19:07:07.806086,2026-09-01 19:07:19.308165,0 days 00:00:11.502079,,,scale,rbf,0.16628999076339807,COMPLETE
39,0.5815510172516805,2026-09-01 19:07:19.379361,2026-09-01 19:07:26.254124,0 days 00:00:06.874763,0.4078064240601951,3.0,auto,poly,0.12865510451302742,COMPLETE
40,0.847381164722303,2026-09-01 19:07:26.324286,2026-09-01 19:07:49.021128,0 days 00:00:22.696842,,,scale,rbf,0.3545009632418431,COMPLETE
41,0.855408366272971,2026-09-01 19:07:49.092452,2026-09-01 19:08:05.428493,0 days 00:00:16.336041,,,scale,rbf,0.23902928285831598,COMPLETE
42,0.8552038058222395,2026-09-01 19:08:05.501677,2026-09-01 19:08:22.781051,0 days 00:00:17.279374,,,scale,rbf,0.25366316795090854,COMPLETE
43,0.8515699141469767,2026-09-01 19:08:22.851694,2026-09-01 19:08:42.364677,0 days 00:00:19.512983,,,scale,rbf,0.28840524315926047,COMPLETE
44,0.8315653489564299,2026-09-01 19:08:42.445972,2026-09-01 19:08:57.194299,0 days 00:00:14.748327,,,auto,rbf,0.22383649632060332,COMPLETE
45,0.5506514127767959,2026-09-01 19:08:57.262601,2026-09-01 19:09:11.068626,0 days 00:00:13.806025,0.17789164477592984,,scale,sigmoid,0.21328380437073818,COMPLETE
46,0.8485082928058334,2026-09-01 19:09:11.141871,2026-09-01 19:09:25.545786,0 days 00:00:14.403915,,,scale,rbf,0.17974441590645385,COMPLETE
47,0.7116464746376224,2026-09-01 19:09:25.627776,2026-09-01 19:09:41.042145,0 days 00:00:15.414369,0.023076480886311312,4.0,auto,poly,0.3035836424171341,COMPLETE
48,0.8554345100964302,2026-09-01 19:09:41.115195,2026-09-01 19:09:59.885010,0 days 00:00:18.769815,,,scale,rbf,0.24846951893123648,COMPLETE
49,0.8522824331218295,2026-09-01 19:09:59.954569,2026-09-01 19:10:19.386589,0 days 00:00:19.432020,,,scale,rbf,0.2769630576728532,COMPLETE
50,0.8449962892235309,2026-09-01 19:10:19.479665,2026-09-01 19:10:31.113291,0 days 00:00:11.633626,,,scale,rbf,0.1556978569476163,COMPLETE
51,0.8557233893670974,2026-09-01 19:10:31.184635,2026-09-01 19:10:48.580968,0 days 00:00:17.396333,,,scale,rbf,0.2419109402876123,COMPLETE
52,0.8558964175727406,2026-09-01 19:10:48.666952,2026-09-01 19:11:06.825356,0 days 00:00:18.158404,,,scale,rbf,0.24351472990768386,COMPLETE
53,0.850177306512631,2026-09-01 19:11:06.900577,2026-09-01 19:11:28.320944,0 days 00:00:21.420367,,,scale,rbf,0.3142377201854403,COMPLETE
54,0.8503314253497796,2026-09-01 19:11:28.392610,2026-09-01 19:11:41.926203,0 days 00:00:13.533593,,,scale,rbf,0.19205846937573073,COMPLETE
55,0.8554690858018831,2026-09-01 19:11:41.999613,2026-09-01 19:11:59.060336,0 days 00:00:17.060723,,,scale,rbf,0.24038184268740337,COMPLETE
56,0.8514043698602627,2026-09-01 19:11:59.136834,2026-09-01 19:12:19.413133,0 days 00:00:20.276299,,,scale,rbf,0.2823769977111017,COMPLETE
57,0.8528058584117378,2026-09-01 19:12:19.509463,2026-09-01 19:12:35.327582,0 days 00:00:15.818119,,,scale,rbf,0.20650455222793565,COMPLETE
58,0.8313999543480945,2026-09-01 19:12:35.402638,2026-09-01 19:12:52.368664,0 days 00:00:16.966026,,,auto,rbf,0.2187415562378687,COMPLETE
59,0.5566854970382391,2026-09-01 19:12:52.453648,2026-09-01 19:13:15.152461,0 days 00:00:22.698813,0.6055079596524611,,scale,sigmoid,0.34112353379611043,COMPLETE
60,0.8558674298600881,2026-09-01 19:13:15.232663,2026-09-01 19:13:31.584371,0 days 00:00:16.351708,,,scale,rbf,0.24387877013331677,COMPLETE
61,0.855310775970134,2026-09-01 19:13:31.661073,2026-09-01 19:13:49.628220,0 days 00:00:17.967147,,,scale,rbf,0.2502198541247867,COMPLETE
62,0.8520335179782443,2026-09-01 19:13:49.702188,2026-09-01 19:14:10.065214,0 days 00:00:20.363026,,,scale,rbf,0.2782677292758453,COMPLETE
63,0.850365502127304,2026-09-01 19:14:10.137538,2026-09-01 19:14:31.716691,0 days 00:00:21.579153,,,scale,rbf,0.31275105961598865,COMPLETE
64,0.8558395896816716,2026-09-01 19:14:31.789895,2026-09-01 19:14:49.146916,0 days 00:00:17.357021,,,scale,rbf,0.24531807372709347,COMPLETE
65,0.8548251694172148,2026-09-01 19:14:49.220714,2026-09-01 19:15:06.671990,0 days 00:00:17.451276,,,scale,rbf,0.23192066765791164,COMPLETE
66,0.8529613243542937,2026-09-01 19:15:06.750094,2026-09-01 19:15:21.730276,0 days 00:00:14.980182,,,scale,rbf,0.20762200537838454,COMPLETE
67,0.7073724584299487,2026-09-01 19:15:21.802566,2026-09-01 19:15:35.558489,0 days 00:00:13.755923,0.3289064452921799,3.0,scale,poly,0.2696762612202983,COMPLETE
68,0.851271505352873,2026-09-01 19:15:35.621717,2026-09-01 19:15:53.893544,0 days 00:00:18.271827,,,scale,rbf,0.29632587887478795,COMPLETE
69,0.8497196399237139,2026-09-01 19:15:53.973020,2026-09-01 19:16:05.720590,0 days 00:00:11.747570,,,scale,rbf,0.1844994124629762,COMPLETE
70,0.8558596964771946,2026-09-01 19:16:05.783651,2026-09-01 19:16:21.202670,0 days 00:00:15.419019,,,scale,rbf,0.242256575269609,COMPLETE
71,0.8556051434480162,2026-09-01 19:16:21.281520,2026-09-01 19:16:36.778452,0 days 00:00:15.496932,,,scale,rbf,0.24140624398879806,COMPLETE
72,0.8546150209736829,2026-09-01 19:16:36.857188,2026-09-01 19:16:51.371392,0 days 00:00:14.514204,,,scale,rbf,0.2271307047462061,COMPLETE
73,0.8541692787622596,2026-09-01 19:16:51.450022,2026-09-01 19:17:08.053270,0 days 00:00:16.603248,,,scale,rbf,0.262763556756262,COMPLETE
74,0.8556228054966889,2026-09-01 19:17:08.117220,2026-09-01 19:17:23.542342,0 days 00:00:15.425122,,,scale,rbf,0.24167571972977692,COMPLETE
75,0.8544748222257424,2026-09-01 19:17:23.602496,2026-09-01 19:17:37.823283,0 days 00:00:14.220787,,,scale,rbf,0.22212992278884944,COMPLETE
76,0.8540338198296411,2026-09-01 19:17:37.899214,2026-09-01 19:17:54.866283,0 days 00:00:16.967069,,,scale,rbf,0.2639970969728656,COMPLETE
77,0.5458337148053121,2026-09-01 19:17:54.929219,2026-09-01 19:18:07.849251,0 days 00:00:12.920032,0.8395495726293317,,scale,sigmoid,0.19827157272505982,COMPLETE
78,0.832932311695245,2026-09-01 19:18:07.912081,2026-09-01 19:18:23.593494,0 days 00:00:15.681413,,,auto,rbf,0.24523311600702533,COMPLETE
79,0.8515050036234642,2026-09-01 19:18:23.656519,2026-09-01 19:18:41.422613,0 days 00:00:17.766094,,,scale,rbf,0.28198613126471117,COMPLETE
80,0.6677698545250892,2026-09-01 19:18:41.494497,2026-09-01 19:19:01.900323,0 days 00:00:20.405826,0.4987054543514257,4.0,scale,poly,0.4948573533994481,COMPLETE
81,0.8550606135067274,2026-09-01 19:19:01.967093,2026-09-01 19:19:17.056518,0 days 00:00:15.089425,,,scale,rbf,0.23633670562689024,COMPLETE
82,0.8533845649161365,2026-09-01 19:19:17.119699,2026-09-01 19:19:30.693207,0 days 00:00:13.573508,,,scale,rbf,0.21176660967136668,COMPLETE
83,0.855870722784417,2026-09-01 19:19:30.756410,2026-09-01 19:19:46.392410,0 days 00:00:15.636000,,,scale,rbf,0.24385001018481364,COMPLETE
84,0.8552649743862876,2026-09-01 19:19:46.455571,2026-09-01 19:20:02.341391,0 days 00:00:15.885820,,,scale,rbf,0.2514284097844166,COMPLETE
85,0.8532523989078468,2026-09-01 19:20:02.405033,2026-09-01 19:20:19.489649,0 days 00:00:17.084616,,,scale,rbf,0.2703439096122176,COMPLETE
86,0.8546172661493616,2026-09-01 19:20:19.566184,2026-09-01 19:20:34.220570,0 days 00:00:14.654386,,,scale,rbf,0.22755008703713592,COMPLETE
87,0.8513526809268585,2026-09-01 19:20:34.300181,2026-09-01 19:20:54.150141,0 days 00:00:19.849960,,,scale,rbf,0.29363598881353026,COMPLETE
88,0.8464028169470851,2026-09-01 19:20:54.229206,2026-09-01 19:21:04.978761,0 days 00:00:10.749555,,,scale,rbf,0.16587556146037893,COMPLETE
89,0.8548001731279913,2026-09-01 19:21:05.049013,2026-09-01 19:21:21.519093,0 days 00:00:16.470080,,,scale,rbf,0.2584920514876544,COMPLETE
90,0.8513538783538872,2026-09-01 19:21:21.581317,2026-09-01 19:21:34.228204,0 days 00:00:12.646887,,,scale,rbf,0.19569597026312663,COMPLETE
91,0.8554830058910916,2026-09-01 19:21:34.300340,2026-09-01 19:21:49.482166,0 days 00:00:15.181826,,,scale,rbf,0.24027881364772363,COMPLETE
92,0.8559323403836008,2026-09-01 19:21:49.545384,2026-09-01 19:22:05.053636,0 days 00:00:15.508252,,,scale,rbf,0.24262912442803466,COMPLETE
93,0.8541745673983029,2026-09-01 19:22:05.116491,2026-09-01 19:22:20.237356,0 days 00:00:15.120865,,,scale,rbf,0.2184382702349298,COMPLETE
94,0.8526496440772889,2026-09-01 19:22:20.316165,2026-09-01 19:22:37.858771,0 days 00:00:17.542606,,,scale,rbf,0.274548692664046,COMPLETE
95,0.8335521298609612,2026-09-01 19:22:37.921552,2026-09-01 19:22:54.269295,0 days 00:00:16.347743,,,auto,rbf,0.25544917425926045,COMPLETE
96,0.5533941193859694,2026-09-01 19:22:54.332590,2026-09-01 19:23:13.065799,0 days 00:00:18.733209,0.6895245064141531,,scale,sigmoid,0.3042033933481698,COMPLETE
97,0.85339020280173,2026-09-01 19:23:13.129120,2026-09-01 19:23:27.033455,0 days 00:00:13.904335,,,scale,rbf,0.21169594313541273,COMPLETE
98,0.8546016995979888,2026-09-01 19:23:27.112133,2026-09-01 19:23:41.905112,0 days 00:00:14.792979,,,scale,rbf,0.2287100839465353,COMPLETE
99,0.8557751281932947,2026-09-01 19:23:41.982966,2026-09-01 19:23:57.580234,0 days 00:00:15.597268,,,scale,rbf,0.24566243686435782,COMPLETE
100,0.6908297545648787,2026-09-01 19:23:57.643567,2026-09-01 19:24:06.028021,0 days 00:00:08.384454,0.8535589726286064,2.0,scale,poly,0.1750630688336447,COMPLETE
101,0.8559319911340507,2026-09-01 19:24:06.097240,2026-09-01 19:24:21.960795,0 days 00:00:15.863555,,,scale,rbf,0.24264898557247735,COMPLETE
102,0.8557814146851952,2026-09-01 19:24:22.060126,2026-09-01 19:24:40.597259,0 days 00:00:18.537133,,,scale,rbf,0.24580967243659058,COMPLETE
103,0.8541254728901273,2026-09-01 19:24:40.678274,2026-09-01 19:24:59.300245,0 days 00:00:18.621971,,,scale,rbf,0.2631286284745996,COMPLETE
104,0.8516477469038405,2026-09-01 19:24:59.370035,2026-09-01 19:25:17.372847,0 days 00:00:18.002812,,,scale,rbf,0.2860182623596802,COMPLETE
105,0.8549325886002452,2026-09-01 19:25:17.441902,2026-09-01 19:25:32.402608,0 days 00:00:14.960706,,,scale,rbf,0.23389588338507356,COMPLETE
106,0.8552677683826877,2026-09-01 19:25:32.471948,2026-09-01 19:25:48.357224,0 days 00:00:15.885276,,,scale,rbf,0.24998857265822605,COMPLETE
107,0.8520990272152712,2026-09-01 19:25:48.427761,2026-09-01 19:26:01.691358,0 days 00:00:13.263597,,,scale,rbf,0.20380745439660802,COMPLETE
108,0.8544629976338344,2026-09-01 19:26:01.761046,2026-09-01 19:26:16.112438,0 days 00:00:14.351392,,,scale,rbf,0.22233081108001207,COMPLETE
109,0.8335585660312405,2026-09-01 19:26:16.181897,2026-09-01 19:26:32.682041,0 days 00:00:16.500144,,,auto,rbf,0.2604462104698467,COMPLETE
110,0.852932436427227,2026-09-01 19:26:32.752434,2026-09-01 19:26:49.933020,0 days 00:00:17.180586,,,scale,rbf,0.2724550182609399,COMPLETE
111,0.8554876958136204,2026-09-01 19:26:50.002329,2026-09-01 19:27:05.335672,0 days 00:00:15.333343,,,scale,rbf,0.240162072988079,COMPLETE
112,0.8556568822742133,2026-09-01 19:27:05.404058,2026-09-01 19:27:21.218464,0 days 00:00:15.814406,,,scale,rbf,0.2472153811256055,COMPLETE
113,0.8557612081040864,2026-09-01 19:27:21.289025,2026-09-01 19:27:36.875322,0 days 00:00:15.586297,,,scale,rbf,0.24558646728145078,COMPLETE
114,0.8552625795322302,2026-09-01 19:27:36.945713,2026-09-01 19:27:53.029698,0 days 00:00:16.083985,,,scale,rbf,0.25081842259815645,COMPLETE
115,0.8537353112499517,2026-09-01 19:27:53.099074,2026-09-01 19:28:06.950622,0 days 00:00:13.851548,,,scale,rbf,0.21588977844867613,COMPLETE
116,0.8547745282324605,2026-09-01 19:28:07.020037,2026-09-01 19:28:21.765265,0 days 00:00:14.745228,,,scale,rbf,0.23027164054647123,COMPLETE
117,0.5409521540589658,2026-09-01 19:28:21.840029,2026-09-01 19:28:25.356660,0 days 00:00:03.516631,0.14042498959910776,,scale,sigmoid,0.07551712460546314,COMPLETE
118,0.8378946488732336,2026-09-01 19:28:25.427052,2026-09-01 19:28:50.251262,0 days 00:00:24.824210,,,scale,rbf,0.44505928256772026,COMPLETE
119,0.8496851640038467,2026-09-01 19:28:50.321630,2026-09-01 19:29:09.935166,0 days 00:00:19.613536,,,scale,rbf,0.32011147495351544,COMPLETE
120,0.8502764933848392,2026-09-01 19:29:10.006728,2026-09-01 19:29:22.132026,0 days 00:00:12.125298,,,scale,rbf,0.19050088341224525,COMPLETE
121,0.8557192981580829,2026-09-01 19:29:22.202545,2026-09-01 19:29:41.178584,0 days 00:00:18.976039,,,scale,rbf,0.24664866417979808,COMPLETE
122,0.8541038693108184,2026-09-01 19:29:41.259927,2026-09-01 19:29:59.752769,0 days 00:00:18.492842,,,scale,rbf,0.2634325185677427,COMPLETE
123,0.8557687918086012,2026-09-01 19:29:59.823101,2026-09-01 19:30:18.294920,0 days 00:00:18.471819,,,scale,rbf,0.24555731560616456,COMPLETE
124,0.8549474067597251,2026-09-01 19:30:18.373976,2026-09-01 19:30:35.817839,0 days 00:00:17.443863,,,scale,rbf,0.23378077753910276,COMPLETE
125,0.8515361866190023,2026-09-01 19:30:35.898198,2026-09-01 19:30:56.197160,0 days 00:00:20.298962,,,scale,rbf,0.2816384099354581,COMPLETE
126,0.6911956683077238,2026-09-01 19:30:56.273468,2026-09-01 19:31:10.326118,0 days 00:00:14.052650,0.291690827737609,5.0,scale,poly,0.2567019849444221,COMPLETE
127,0.8527657446062773,2026-09-01 19:31:10.396053,2026-09-01 19:31:30.469446,0 days 00:00:20.073393,,,scale,rbf,0.27413194666083707,COMPLETE
128,0.8543011953065851,2026-09-01 19:31:30.551542,2026-09-01 19:31:46.506085,0 days 00:00:15.954543,,,scale,rbf,0.22107214059790017,COMPLETE
129,0.851414049062078,2026-09-01 19:31:46.575732,2026-09-01 19:32:06.818524,0 days 00:00:20.242792,,,scale,rbf,0.2929893491328861,COMPLETE
130,0.8335862565312785,2026-09-01 19:32:06.896439,2026-09-01 19:32:25.221537,0 days 00:00:18.325098,,,auto,rbf,0.24844518106580465,COMPLETE
131,0.8558006234104467,2026-09-01 19:32:25.293068,2026-09-01 19:32:42.760117,0 days 00:00:17.467049,,,scale,rbf,0.2454571740278574,COMPLETE
132,0.8548327531217298,2026-09-01 19:32:42.839039,2026-09-01 19:32:59.675719,0 days 00:00:16.836680,,,scale,rbf,0.23080488532826252,COMPLETE
133,0.8554129564099142,2026-09-01 19:32:59.754151,2026-09-01 19:33:16.819381,0 days 00:00:17.065230,,,scale,rbf,0.2389908591383229,COMPLETE
134,0.8537126599219926,2026-09-01 19:33:16.890747,2026-09-01 19:33:35.516696,0 days 00:00:18.625949,,,scale,rbf,0.26731330292099087,COMPLETE
135,0.8527452386684112,2026-09-01 19:33:35.587613,2026-09-01 19:33:49.517518,0 days 00:00:13.929905,,,scale,rbf,0.20622634244380544,COMPLETE
136,0.8552028079663822,2026-09-01 19:33:49.597235,2026-09-01 19:34:07.030591,0 days 00:00:17.433356,,,scale,rbf,0.25508733731958316,COMPLETE
137,0.8559251059286358,2026-09-01 19:34:07.114414,2026-09-01 19:34:25.273943,0 days 00:00:18.159529,,,scale,rbf,0.24429422267070497,COMPLETE
138,0.853434058566655,2026-09-01 19:34:25.351298,2026-09-01 19:34:40.866873,0 days 00:00:15.515575,,,scale,rbf,0.2140541830465933,COMPLETE
139,0.550847441559948,2026-09-01 19:34:40.941858,2026-09-01 19:34:56.759457,0 days 00:00:15.817599,0.4575298941462884,,scale,sigmoid,0.22619339883098186,COMPLETE
140,0.8553793785603185,2026-09-01 19:34:56.840725,2026-09-01 19:35:14.425431,0 days 00:00:17.584706,,,scale,rbf,0.2391993480532304,COMPLETE
141,0.8547959821333908,2026-09-01 19:35:14.504503,2026-09-01 19:35:33.655497,0 days 00:00:19.150994,,,scale,rbf,0.2585087327557155,COMPLETE
142,0.8554281238189442,2026-09-01 19:35:33.727909,2026-09-01 19:35:50.256957,0 days 00:00:16.529048,,,scale,rbf,0.2406881559227808,COMPLETE
143,0.8555609883263339,2026-09-01 19:35:50.330393,2026-09-01 19:36:07.818851,0 days 00:00:17.488458,,,scale,rbf,0.24769728975695302,COMPLETE
144,0.8531607957401534,2026-09-01 19:36:07.897357,2026-09-01 19:36:27.178983,0 days 00:00:19.281626,,,scale,rbf,0.2711549500722647,COMPLETE
145,0.8546133246187255,2026-09-01 19:36:27.257449,2026-09-01 19:36:44.127303,0 days 00:00:16.869854,,,scale,rbf,0.22771379158588,COMPLETE
146,0.8541599987027874,2026-09-01 19:36:44.213165,2026-09-01 19:37:04.430490,0 days 00:00:20.217325,,,scale,rbf,0.262374322807487,COMPLETE
147,0.8556777374616293,2026-09-01 19:37:04.503138,2026-09-01 19:37:22.062789,0 days 00:00:17.559651,,,scale,rbf,0.24675644622989135,COMPLETE
148,0.8540193509197112,2026-09-01 19:37:22.140992,2026-09-01 19:37:37.511522,0 days 00:00:15.370530,,,scale,rbf,0.21751421460363168,COMPLETE
149,0.7158315319956243,2026-09-01 19:37:37.585925,2026-09-01 19:37:52.947281,0 days 00:00:15.361356,0.9855316393750332,3.0,scale,poly,0.2796219063541916,COMPLETE
150,0.8549334367777239,2026-09-01 19:37:53.047771,2026-09-01 19:38:09.835937,0 days 00:00:16.788166,,,scale,rbf,0.23388805934341114,COMPLETE
