number,value,datetime_start,datetime_complete,duration,params_epsilon,params_k,params_lr,params_n_epochs,params_proportion,params_samples,params_wd,state
0,0.8919216478901574,2026-08-09 14:41:32.989894,2026-08-09 14:49:01.224570,0 days 00:07:28.234676,0.3660515335854786,93,0.002281167485681001,250,2,MIXED,0.01476343771074142,COMPLETE
1,0.8964697947277287,2026-08-09 14:49:01.287259,2026-08-09 14:52:17.118698,0 days 00:03:15.831439,0.1353982885353253,59,0.0016943642458979154,225,1,SUBSPACE,0.027713354390133626,COMPLETE
2,0.888993356672247,2026-08-09 14:52:17.217493,2026-08-09 14:59:15.471771,0 days 00:06:58.254278,0.24751720505560543,86,0.026356970435992628,250,2,MIXED,0.6668829342382537,COMPLETE
3,0.8921181658236397,2026-08-09 14:59:15.534384,2026-08-09 15:00:46.071533,0 days 00:01:30.537149,0.3324791783025361,23,0.008442123802485935,225,1,UNIFORM,0.008214380427751513,COMPLETE
4,0.8975163186785553,2026-08-09 15:00:46.134134,2026-08-09 15:01:43.810550,0 days 00:00:57.676416,0.16069334497735088,25,0.0027108160847900417,75,2,UNIFORM,0.4765928163155595,COMPLETE
5,0.5064910979228487,2026-08-09 15:01:43.878704,2026-08-09 15:07:30.068610,0 days 00:05:46.189906,0.08987234528249519,136,0.037377310329363846,200,1,SUBSPACE,0.1637283697057387,COMPLETE
6,0.8971575232970018,2026-08-09 15:07:30.131221,2026-08-09 15:11:54.876363,0 days 00:04:24.745142,0.07069115155698626,98,0.017000681801169464,200,1,MIXED,0.7016532513549357,COMPLETE
7,0.8945254964758123,2026-08-09 15:11:54.938260,2026-08-09 15:13:45.741178,0 days 00:01:50.802918,0.1982118667365726,24,0.00012922628152774743,150,2,MIXED,0.0004985200134952847,COMPLETE
8,0.8946146340017674,2026-08-09 15:13:45.804095,2026-08-09 15:16:48.721205,0 days 00:03:02.917110,0.14191753444830602,70,0.001876980219849124,175,1,UNIFORM,0.0011292163044994239,COMPLETE
9,0.8957628129019046,2026-08-09 15:16:48.805725,2026-08-09 15:17:35.941391,0 days 00:00:47.135666,0.48790344490591686,30,0.0031024288227061185,75,1,MIXED,0.0029471125596792465,COMPLETE
10,0.8972863461068681,2026-08-09 15:17:36.011831,2026-08-09 15:19:45.378328,0 days 00:02:09.366497,0.0220242130923195,6,0.0001915022298924013,300,2,UNIFORM,0.00010256651907835119,COMPLETE
11,0.8989824289055258,2026-08-09 15:19:45.488958,2026-08-09 15:21:46.924206,0 days 00:02:01.435248,0.024456024318245444,5,0.00011988473558590787,300,2,UNIFORM,0.00011686807827155584,COMPLETE
12,0.8973920986880393,2026-08-09 15:21:46.987116,2026-08-09 15:22:08.792417,0 days 00:00:21.805301,0.019816686652524965,5,0.0004495761347913365,50,2,UNIFORM,0.00010135148803833408,COMPLETE
13,0.8951913335871993,2026-08-09 15:22:08.855007,2026-08-09 15:23:09.545564,0 days 00:01:00.690557,0.21565959802630016,10,0.0005793182382424497,125,2,UNIFORM,0.09257136692395292,COMPLETE
14,0.8966560405155877,2026-08-09 15:23:09.613404,2026-08-09 15:25:38.664949,0 days 00:02:29.051545,0.29204672292747114,11,0.0005112486901912252,300,2,UNIFORM,0.0005463019485163742,COMPLETE
15,0.8912880866461658,2026-08-09 15:25:38.736861,2026-08-09 15:27:18.651097,0 days 00:01:39.914236,0.1436616323676734,40,0.009467171357901417,100,2,UNIFORM,0.07468319004819117,COMPLETE
16,0.8357958229751188,2026-08-09 15:27:18.712816,2026-08-09 15:27:44.937274,0 days 00:00:26.224458,0.0890879451451344,14,0.09529391663872033,50,2,SUBSPACE,0.002937546548727298,COMPLETE
17,0.8955927892456585,2026-08-09 15:27:45.028773,2026-08-09 15:28:42.029088,0 days 00:00:57.000315,0.4390396221895192,8,0.004946817450369443,125,2,UNIFORM,0.0058801401020509856,COMPLETE
18,0.8983263587522722,2026-08-09 15:28:42.091831,2026-08-09 15:31:01.165180,0 days 00:02:19.073349,0.170730828882499,16,0.0010092033145219594,275,2,UNIFORM,0.3075935762113121,COMPLETE
19,0.8983243941342567,2026-08-09 15:31:01.243978,2026-08-09 15:33:20.905331,0 days 00:02:19.661353,0.2660400402746063,16,0.00027695043594829904,275,2,UNIFORM,0.04146477447038445,COMPLETE
20,0.8983745199596209,2026-08-09 15:33:20.983872,2026-08-09 15:35:20.917385,0 days 00:01:59.933513,0.059314103028455675,7,0.0010302088179124289,275,2,SUBSPACE,0.28424251553975777,COMPLETE
21,0.8976592867381323,2026-08-09 15:35:20.994805,2026-08-09 15:37:25.408166,0 days 00:02:04.413361,0.054194544190724336,8,0.0007721166609951215,275,2,SUBSPACE,0.2889559329696919,COMPLETE
22,0.899271564545448,2026-08-09 15:37:25.473595,2026-08-09 15:39:17.013190,0 days 00:01:51.539595,0.10375874145315407,5,0.0009132689424651474,275,2,SUBSPACE,0.1602016166971964,COMPLETE
23,0.8993799553279542,2026-08-09 15:39:17.075957,2026-08-09 15:41:16.789528,0 days 00:01:59.713571,0.10622911074710722,5,0.0001071212524431857,300,2,SUBSPACE,0.14712078182628097,COMPLETE
24,0.8993427398495484,2026-08-09 15:41:16.908868,2026-08-09 15:43:17.438071,0 days 00:02:00.529203,0.10248258663288598,5,0.00010975654847069933,300,2,SUBSPACE,0.023923224431375737,COMPLETE
25,0.8978372811303268,2026-08-09 15:43:17.515524,2026-08-09 15:44:57.807743,0 days 00:01:40.292219,0.12178022554792578,5,0.0002965916845358031,250,2,SUBSPACE,0.10158052134010727,COMPLETE
26,0.897348540300041,2026-08-09 15:44:57.870645,2026-08-09 15:47:07.110775,0 days 00:02:09.240130,0.1939247812834077,7,0.00010781100700774115,300,2,SUBSPACE,0.02734007120378663,COMPLETE
27,0.8964033345068653,2026-08-09 15:47:07.189284,2026-08-09 15:49:06.051870,0 days 00:01:58.862586,0.10931427496851026,10,0.00023056081236228705,250,2,SUBSPACE,0.05125162077709553,COMPLETE
28,0.8985915821843499,2026-08-09 15:49:06.114675,2026-08-09 15:50:36.619170,0 days 00:01:30.504495,0.0917778647503342,5,0.00017246800411802697,225,2,SUBSPACE,0.15221356185232435,COMPLETE
29,0.8978607442826247,2026-08-09 15:50:36.682023,2026-08-09 15:52:33.090283,0 days 00:01:56.408260,0.2237664457126353,6,0.0003753894771296227,275,2,SUBSPACE,0.015474135525429335,COMPLETE
30,0.899705520599076,2026-08-09 15:52:33.161007,2026-08-09 15:54:49.034548,0 days 00:02:15.873541,0.17426029310416574,8,0.0012959675301610343,300,2,SUBSPACE,0.015195451061823772,COMPLETE
31,0.8999774237324061,2026-08-09 15:54:49.097580,2026-08-09 15:57:09.768504,0 days 00:02:20.670924,0.17966353504624633,9,0.001287279788051633,300,2,SUBSPACE,0.011796827380468321,COMPLETE
32,0.8990347438766786,2026-08-09 15:57:09.831260,2026-08-09 15:59:34.271723,0 days 00:02:24.440463,0.18165953700599652,12,0.0015258534926975815,300,2,SUBSPACE,0.013348173396179537,COMPLETE
33,0.8960550357987083,2026-08-09 15:59:34.334538,2026-08-09 16:01:55.031549,0 days 00:02:20.697011,0.2363711549643618,9,0.004705750438366216,300,2,SUBSPACE,0.02224304078738815,COMPLETE
34,0.8969036946494133,2026-08-09 16:01:55.102438,2026-08-09 16:03:41.271209,0 days 00:01:46.168771,0.28082759115981143,6,0.00016082984002141931,250,2,SUBSPACE,0.006536427647421765,COMPLETE
35,0.8991807430611936,2026-08-09 16:03:41.333890,2026-08-09 16:06:09.304103,0 days 00:02:27.970213,0.15057166901424668,13,0.0016910941297087652,300,2,SUBSPACE,0.014602616034173569,COMPLETE
36,0.8991966284011468,2026-08-09 16:06:09.366693,2026-08-09 16:07:46.980976,0 days 00:01:37.614283,0.13368157395471203,7,0.003873767926203654,225,2,SUBSPACE,0.0030731110737792114,COMPLETE
37,0.892860566905684,2026-08-09 16:07:47.043651,2026-08-09 16:09:20.517598,0 days 00:01:33.473947,0.3319928071133941,17,0.009835154602822587,275,1,SUBSPACE,0.04212932400018445,COMPLETE
38,0.8974861758250049,2026-08-09 16:09:20.580285,2026-08-09 16:11:40.997153,0 days 00:02:20.416868,0.2009161910194526,9,0.00030787379186744294,300,2,MIXED,0.011121547273627082,COMPLETE
39,0.8993339271344508,2026-08-09 16:11:41.076081,2026-08-09 16:12:43.815345,0 days 00:01:02.739264,0.1578575766554903,7,0.0013514217190753331,250,1,SUBSPACE,0.8936187094233122,COMPLETE
40,0.8979677878984919,2026-08-09 16:12:43.881603,2026-08-09 16:15:27.829875,0 days 00:02:43.948272,0.25297541739510077,19,0.0006535338136691458,275,2,SUBSPACE,0.0051482241230938666,COMPLETE
41,0.8991557082144834,2026-08-09 16:15:27.892532,2026-08-09 16:16:18.847206,0 days 00:00:50.954674,0.16694939667401712,7,0.0012242817012564308,200,1,SUBSPACE,0.8470232149164836,COMPLETE
42,0.8995348233595103,2026-08-09 16:16:18.911918,2026-08-09 16:17:20.102828,0 days 00:01:01.190910,0.1259708532999973,6,0.0021747650108850875,250,1,SUBSPACE,0.023252958626665196,COMPLETE
43,0.8994299688894318,2026-08-09 16:17:20.165607,2026-08-09 16:18:20.612940,0 days 00:01:00.447333,0.11929525239055996,6,0.002292603443273553,250,1,SUBSPACE,0.02483729627511564,COMPLETE
44,0.8989798468361343,2026-08-09 16:18:20.691387,2026-08-09 16:19:25.907199,0 days 00:01:05.215812,0.07479018840085597,9,0.0025035285011085055,250,1,MIXED,0.009775831878244098,COMPLETE
45,0.8965273861015511,2026-08-09 16:19:25.969849,2026-08-09 16:20:14.828873,0 days 00:00:48.859024,0.12332783348569941,6,0.006185394593781059,200,1,SUBSPACE,0.054342720287838236,COMPLETE
46,0.8974635546518562,2026-08-09 16:20:14.907492,2026-08-09 16:21:18.786772,0 days 00:01:03.879280,0.05514001261036851,11,0.002341401799529996,225,1,SUBSPACE,0.0017283111904773218,COMPLETE
47,0.8975584737679713,2026-08-09 16:21:18.849715,2026-08-09 16:22:15.644521,0 days 00:00:56.794806,0.18563870452911574,8,0.01949501708874426,225,1,MIXED,0.02108590570379631,COMPLETE
48,0.8970884248748032,2026-08-09 16:22:15.707324,2026-08-09 16:22:58.904763,0 days 00:00:43.197439,0.2158235983773245,6,0.00315324456308048,175,1,SUBSPACE,0.0040943290371038,COMPLETE
49,0.8996990654255967,2026-08-09 16:22:58.967538,2026-08-09 16:24:03.105453,0 days 00:01:04.137915,0.13547544156999286,8,0.0018964247455813732,250,1,SUBSPACE,0.035165101245010336,COMPLETE
50,0.8989939920858451,2026-08-09 16:24:03.183853,2026-08-09 16:25:22.203141,0 days 00:01:19.019288,0.133812822720486,13,0.001983652600797139,250,1,SUBSPACE,0.032570100605728125,COMPLETE
51,0.8952582989955525,2026-08-09 16:25:22.265781,2026-08-09 16:26:31.411974,0 days 00:01:09.146193,0.15889547121680586,8,0.006637613638937451,275,1,SUBSPACE,0.06627940810039562,COMPLETE
52,0.898764244041931,2026-08-09 16:26:31.478099,2026-08-09 16:27:38.103504,0 days 00:01:06.625405,0.1175043857847287,10,0.0027325520621895457,250,1,SUBSPACE,0.007558521432822958,COMPLETE
53,0.8988770692479577,2026-08-09 16:27:38.181802,2026-08-09 16:28:32.475080,0 days 00:00:54.293278,0.07772416788915146,6,0.0034417557867234333,225,1,SUBSPACE,0.01757494964725508,COMPLETE
54,0.5,2026-08-09 16:28:32.537753,2026-08-09 16:32:03.860713,0 days 00:03:31.322960,0.14232991823715838,50,0.063118565963729,275,1,SUBSPACE,0.10137772865643281,COMPLETE
55,0.8990063972453137,2026-08-09 16:32:03.932444,2026-08-09 16:33:14.812481,0 days 00:01:10.880037,0.030446259735614725,5,0.0020084471631158754,300,1,SUBSPACE,0.03585542825567978,COMPLETE
56,0.8750707823804973,2026-08-09 16:33:14.875115,2026-08-09 16:34:00.427029,0 days 00:00:45.551914,0.20465926011534305,9,0.013275172260777334,175,1,MIXED,0.010417881856094515,COMPLETE
57,0.8907997948714264,2026-08-09 16:34:00.489702,2026-08-09 16:42:21.536936,0 days 00:08:21.047234,0.1816643405958977,144,0.0013295859204784624,275,1,SUBSPACE,0.5548644508020608,COMPLETE
58,0.8989181016985076,2026-08-09 16:42:21.605306,2026-08-09 16:43:37.364452,0 days 00:01:15.759146,0.08431878406075735,8,0.0008161063938021243,300,1,SUBSPACE,0.21979149403102727,COMPLETE
59,0.893248214106092,2026-08-09 16:43:37.427417,2026-08-09 16:48:55.028467,0 days 00:05:17.601050,0.038227014682994206,95,0.001126130148388415,250,1,SUBSPACE,0.07644820688244817,COMPLETE
60,0.8989445398438006,2026-08-09 16:48:55.106959,2026-08-09 16:50:00.017433,0 days 00:01:04.910474,0.17097837510661743,5,0.0006226266838203188,275,1,SUBSPACE,0.02940164125137441,COMPLETE
61,0.8969240144128868,2026-08-09 16:50:00.074663,2026-08-09 16:52:05.678421,0 days 00:02:05.603758,0.09591414116585392,6,0.00010501287815493767,300,2,SUBSPACE,0.021029855310812928,COMPLETE
62,0.8981530794433148,2026-08-09 16:52:05.757018,2026-08-09 16:54:05.365578,0 days 00:01:59.608560,0.10963996290260149,5,0.00039411946011264456,300,2,SUBSPACE,0.023153686230520082,COMPLETE
63,0.8970676560557834,2026-08-09 16:54:05.437256,2026-08-09 16:56:03.875152,0 days 00:01:58.437896,0.1388777881549153,7,0.00013823253574313474,275,2,SUBSPACE,0.04567271567703834,COMPLETE
64,0.8982444061150588,2026-08-09 16:56:03.940285,2026-08-09 16:58:03.950920,0 days 00:02:00.010635,0.12265939173968024,5,0.0002056145719609632,300,2,SUBSPACE,0.1256235367059025,COMPLETE
65,0.8995111918113823,2026-08-09 16:58:04.013874,2026-08-09 17:00:00.269056,0 days 00:01:56.255182,0.10516362871720444,6,0.0042853813172565505,275,2,SUBSPACE,0.008315529222738505,COMPLETE
66,0.8976343641553086,2026-08-09 17:00:00.346524,2026-08-09 17:02:03.689104,0 days 00:02:03.342580,0.059080619561397964,11,0.004581159434229089,250,2,SUBSPACE,0.008580433614902976,COMPLETE
67,0.8966907861884884,2026-08-09 17:02:03.744363,2026-08-09 17:03:47.688531,0 days 00:01:43.944168,0.4680586577300988,6,0.005956039501870199,250,2,UNIFORM,0.002100333926530036,COMPLETE
68,0.8982643329549291,2026-08-09 17:03:47.752333,2026-08-09 17:05:47.662323,0 days 00:01:59.909990,0.2341259547752127,7,0.0016297747786203681,275,2,SUBSPACE,0.005327248240221907,COMPLETE
69,0.8990209915505708,2026-08-09 17:05:47.728466,2026-08-09 17:07:52.151123,0 days 00:02:04.422657,0.15011852600152098,8,0.004010663564094169,275,2,SUBSPACE,0.012540405865993672,COMPLETE
70,0.8941764680523921,2026-08-09 17:07:52.234958,2026-08-09 17:09:50.379412,0 days 00:01:58.144454,0.10125907063085797,10,0.00819080535869674,250,2,SUBSPACE,0.017027865394113637,COMPLETE
71,0.8994095929940149,2026-08-09 17:09:50.442373,2026-08-09 17:11:52.572017,0 days 00:02:02.129644,0.11346006729502335,5,0.0027849143041139136,300,2,SUBSPACE,0.0293442088288043,COMPLETE
72,0.8995882048375857,2026-08-09 17:11:52.650462,2026-08-09 17:13:59.349924,0 days 00:02:06.699462,0.12832300971027955,6,0.0020579582829416266,300,2,SUBSPACE,0.03220574065787274,COMPLETE
73,0.8996567980722944,2026-08-09 17:13:59.416283,2026-08-09 17:16:05.499263,0 days 00:02:06.082980,0.12922888019400713,6,0.0021013481842572543,300,2,SUBSPACE,0.034624374408523555,COMPLETE
74,0.8903635935400664,2026-08-09 17:16:05.562216,2026-08-09 17:25:31.609807,0 days 00:09:26.047591,0.17315451802545637,110,0.0022207211743123733,275,2,SUBSPACE,0.06675817584115992,COMPLETE
75,0.8995635067825349,2026-08-09 17:25:31.666967,2026-08-09 17:27:42.771634,0 days 00:02:11.104667,0.1581370841409505,7,0.0017782174839058337,300,2,SUBSPACE,0.0001718089403777647,COMPLETE
76,0.8992280061574497,2026-08-09 17:27:42.834555,2026-08-09 17:29:53.365061,0 days 00:02:10.530506,0.13246555507506244,7,0.0009168095571305551,300,2,MIXED,0.00030645453269798745,COMPLETE
77,0.9000092505442552,2026-08-09 17:29:53.427653,2026-08-09 17:32:13.429085,0 days 00:02:20.001432,0.1527166350545231,9,0.0015041040836563703,300,2,SUBSPACE,0.0008885319658803864,COMPLETE
78,0.8978579938174034,2026-08-09 17:32:13.491891,2026-08-09 17:34:33.816425,0 days 00:02:20.324534,0.15303523154029358,9,0.001509471412705009,300,2,UNIFORM,0.00033505946998862437,COMPLETE
79,0.8998201420272882,2026-08-09 17:34:33.880125,2026-08-09 17:36:58.620013,0 days 00:02:24.739888,0.38863275223179905,12,0.0018576296799645824,300,2,SUBSPACE,0.0008163181168445559,COMPLETE
80,0.8986332882182194,2026-08-09 17:36:58.698461,2026-08-09 17:39:23.753794,0 days 00:02:25.055333,0.42169991441947885,12,0.0007186254062149449,300,2,SUBSPACE,0.00016284700519542981,COMPLETE
81,0.8984778588672305,2026-08-09 17:39:23.815881,2026-08-09 17:41:39.355588,0 days 00:02:15.539707,0.3212603443444709,8,0.0016926034115949781,300,2,SUBSPACE,0.0006919225930490888,COMPLETE
82,0.8992578683512836,2026-08-09 17:41:39.426827,2026-08-09 17:44:12.480155,0 days 00:02:33.053328,0.37630380552328535,15,0.001102393097947486,300,2,SUBSPACE,0.0009393259937484841,COMPLETE
83,0.8996959220367723,2026-08-09 17:44:12.604572,2026-08-09 17:46:37.305449,0 days 00:02:24.700877,0.3569562139798031,12,0.0013126646269945516,300,2,SUBSPACE,0.00020171470368641459,COMPLETE
84,0.8991793958945546,2026-08-09 17:46:37.368589,2026-08-09 17:49:00.774426,0 days 00:02:23.405837,0.38546311216898443,10,0.0012903150005144953,300,2,SUBSPACE,0.0002325671406229287,COMPLETE
85,0.8994643216387294,2026-08-09 17:49:00.842813,2026-08-09 17:52:04.408787,0 days 00:03:03.565974,0.36084683292593284,20,0.0009666979060469887,300,2,SUBSPACE,0.00014338785914423037,COMPLETE
86,0.8978006831032972,2026-08-09 17:52:04.471389,2026-08-09 17:54:32.563465,0 days 00:02:28.092076,0.41139623563429095,11,0.0017368801627665482,300,2,SUBSPACE,0.0004569563575533418,COMPLETE
87,0.8981542020821807,2026-08-09 17:54:32.623949,2026-08-09 17:56:51.554325,0 days 00:02:18.930376,0.2081745521588253,14,0.0028699391351875406,275,2,SUBSPACE,0.0001953356013648539,COMPLETE
88,0.8986155505241378,2026-08-09 17:56:51.656880,2026-08-09 17:59:16.295417,0 days 00:02:24.638537,0.19070254752376617,12,0.0005251025341441197,300,2,SUBSPACE,0.0011644479613622347,COMPLETE
89,0.8978664136088977,2026-08-09 17:59:16.358219,2026-08-09 18:01:25.593917,0 days 00:02:09.235698,0.3523972050540664,9,0.0014304757964543357,275,2,SUBSPACE,0.00011991150821115936,COMPLETE
90,0.8976575466478902,2026-08-09 18:01:25.657008,2026-08-09 18:03:53.888476,0 days 00:02:28.231468,0.4002653035166899,13,0.001879752677751977,300,2,MIXED,0.00039109667817526774,COMPLETE
91,0.8994198651396385,2026-08-09 18:03:53.966290,2026-08-09 18:06:04.984569,0 days 00:02:11.018279,0.16397333085378218,7,0.003520437471686932,300,2,SUBSPACE,0.00024459380710634127,COMPLETE
92,0.8981843449357312,2026-08-09 18:06:05.063274,2026-08-09 18:08:09.074676,0 days 00:02:04.011402,0.43605959306284114,8,0.0021150041378857863,275,2,SUBSPACE,0.050296472403739564,COMPLETE
93,0.8971735209008413,2026-08-09 18:08:09.137575,2026-08-09 18:09:19.967974,0 days 00:01:10.830399,0.2961573557173833,9,0.0011852871623513755,150,2,SUBSPACE,0.038724490509748834,COMPLETE
94,0.8984940809988432,2026-08-09 18:09:20.031064,2026-08-09 18:13:01.398347,0 days 00:03:41.367283,0.17821988970535724,30,0.0024384752198941023,275,2,SUBSPACE,0.0005790593687602144,COMPLETE
95,0.8990922229866145,2026-08-09 18:13:01.459900,2026-08-09 18:15:12.459148,0 days 00:02:10.999248,0.12682579397645397,7,0.0007783343071276808,300,2,SUBSPACE,0.001597910552132218,COMPLETE
96,0.895171968066762,2026-08-09 18:15:12.519413,2026-08-09 18:15:51.226944,0 days 00:00:38.707531,0.15307288061104768,11,0.0019011885793522602,75,2,UNIFORM,0.0007577153833306685,COMPLETE
97,0.89928385744103,2026-08-09 18:15:51.290401,2026-08-09 18:18:07.057557,0 days 00:02:15.767156,0.14664529555930156,8,0.0033087749883938355,300,2,SUBSPACE,0.0039690553652742995,COMPLETE
98,0.8983653143209203,2026-08-09 18:18:07.126211,2026-08-09 18:20:19.089496,0 days 00:02:11.963285,0.4885068098637201,10,0.0014679355378120482,275,2,SUBSPACE,0.016652635049937584,COMPLETE
99,0.8976537858076893,2026-08-09 18:20:19.158325,2026-08-09 18:22:25.918918,0 days 00:02:06.760593,0.4732382429474756,6,0.0010454876556683776,300,2,SUBSPACE,0.033613942506210165,COMPLETE
100,0.898283193287877,2026-08-09 18:22:25.996499,2026-08-09 18:25:19.609691,0 days 00:02:53.613192,0.19377766685804765,18,0.0025418305198938018,300,2,SUBSPACE,0.00027727851500818654,COMPLETE
101,0.8990091477105352,2026-08-09 18:25:19.688001,2026-08-09 18:27:16.140274,0 days 00:01:56.452273,0.16179021001437383,6,0.003959562766970148,275,2,SUBSPACE,0.01975769073499295,COMPLETE
102,0.8986204901351477,2026-08-09 18:27:16.203214,2026-08-09 18:29:15.208422,0 days 00:01:59.005208,0.06690551175221982,7,0.002138093150329392,275,2,SUBSPACE,0.012911700016275462,COMPLETE
103,0.8991829883389254,2026-08-09 18:29:15.271081,2026-08-09 18:31:26.013251,0 days 00:02:10.742170,0.13526925675240464,7,0.0008743338057207485,300,2,SUBSPACE,0.02597216433895704,COMPLETE
104,0.899113496993124,2026-08-09 18:31:26.075937,2026-08-09 18:33:21.734468,0 days 00:01:55.658531,0.11044346433889507,6,0.0013612050575542826,275,2,SUBSPACE,0.007250451341771402,COMPLETE
105,0.8990971064656814,2026-08-09 18:33:21.789360,2026-08-09 18:35:36.783366,0 days 00:02:14.994006,0.0827475368655244,8,0.001720421739526505,300,2,SUBSPACE,0.009287839860374816,COMPLETE
106,0.8990466999806008,2026-08-09 18:35:36.862122,2026-08-09 18:37:33.009159,0 days 00:01:56.147037,0.09180177496127165,9,0.001221850655793292,250,2,SUBSPACE,0.05462826727654383,COMPLETE
107,0.8995758558100602,2026-08-09 18:37:33.071963,2026-08-09 18:39:04.971004,0 days 00:01:31.899041,0.12681941724765525,5,0.002802547889025053,225,2,SUBSPACE,0.0024322346463252643,COMPLETE
108,0.8992035887621155,2026-08-09 18:39:05.033835,2026-08-09 18:40:26.872502,0 days 00:01:21.838667,0.1260773037729378,5,0.001884594015327777,200,2,SUBSPACE,0.0020309790519829098,COMPLETE
109,0.8988871168658079,2026-08-09 18:40:26.939621,2026-08-09 18:42:00.010132,0 days 00:01:33.070511,0.1436473646094052,5,0.0029423378459001647,225,2,MIXED,0.0013747872799444452,COMPLETE
110,0.8981244521522334,2026-08-09 18:42:00.082080,2026-08-09 18:43:48.617794,0 days 00:01:48.535714,0.17478570507910118,12,0.005507520592236579,225,2,SUBSPACE,0.0029441392582929943,COMPLETE
111,0.8989814746624898,2026-08-09 18:43:48.687165,2026-08-09 18:45:55.545059,0 days 00:02:06.857894,0.09962049724729209,6,0.0015838879757400816,300,2,SUBSPACE,0.011515323547959012,COMPLETE
112,0.8827251025642868,2026-08-09 18:45:55.609690,2026-08-09 18:47:19.692685,0 days 00:01:24.082995,0.011739310377694157,6,0.0031403706298209454,200,2,SUBSPACE,0.015810088370797566,COMPLETE
113,0.8994602240068689,2026-08-09 18:47:19.785746,2026-08-09 18:48:51.517887,0 days 00:01:31.732141,0.11904056847934677,5,0.0024421022290435587,225,2,SUBSPACE,0.002355401397109508,COMPLETE
114,0.8963812185212061,2026-08-09 18:48:51.580576,2026-08-09 18:50:49.801868,0 days 00:01:58.221292,0.13355773863332437,7,0.004447901782651206,275,2,SUBSPACE,0.004205681773094411,COMPLETE
