number,value,datetime_start,datetime_complete,duration,params_coef0,params_degree,params_gamma,params_kernel,params_nu,state
151,0.858286756332331,2026-08-09 22:41:29.573023,2026-08-09 22:41:44.421721,0 days 00:00:14.848698,,,scale,rbf,0.24219684831412208,COMPLETE
152,0.8584436691658798,2026-08-09 22:41:44.499974,2026-08-09 22:41:59.672939,0 days 00:00:15.172965,,,scale,rbf,0.24661788248713068,COMPLETE
153,0.8579081199273063,2026-08-09 22:41:59.735572,2026-08-09 22:42:15.258394,0 days 00:00:15.522822,,,scale,rbf,0.2510758951148913,COMPLETE
154,0.8567986039996557,2026-08-09 22:42:15.321396,2026-08-09 22:42:29.486969,0 days 00:00:14.165573,,,scale,rbf,0.22895534099157575,COMPLETE
155,0.858286756332331,2026-08-09 22:42:29.549560,2026-08-09 22:42:44.428215,0 days 00:00:14.878655,,,scale,rbf,0.24190584287992511,COMPLETE
156,0.8573323072048934,2026-08-09 22:42:44.501674,2026-08-09 22:43:00.411233,0 days 00:00:15.909559,,,scale,rbf,0.2581970444689083,COMPLETE
157,0.5572212209015877,2026-08-09 22:43:00.473825,2026-08-09 22:43:16.944335,0 days 00:00:16.470510,0.9783960521119612,,scale,sigmoid,0.2699936398611221,COMPLETE
158,0.8575166111817233,2026-08-09 22:43:17.007123,2026-08-09 22:43:31.657859,0 days 00:00:14.650736,,,scale,rbf,0.23460558536998716,COMPLETE
159,0.8542822110989012,2026-08-09 22:43:31.719908,2026-08-09 22:43:44.796818,0 days 00:00:13.076910,,,scale,rbf,0.20960576998861025,COMPLETE
160,0.7082112810099299,2026-08-09 22:43:44.875080,2026-08-09 22:43:55.606977,0 days 00:00:10.731897,0.7456519110805072,4.0,scale,poly,0.2465552958974169,COMPLETE
161,0.8584994992010917,2026-08-09 22:43:55.685225,2026-08-09 22:44:10.651067,0 days 00:00:14.965842,,,scale,rbf,0.24561274695697466,COMPLETE
162,0.8562381083646515,2026-08-09 22:44:10.729434,2026-08-09 22:44:26.902007,0 days 00:00:16.172573,,,scale,rbf,0.26392199744206873,COMPLETE
163,0.8565341721974906,2026-08-09 22:44:26.964597,2026-08-09 22:44:41.046683,0 days 00:00:14.082086,,,scale,rbf,0.22456862216351237,COMPLETE
164,0.8580540563464256,2026-08-09 22:44:41.120244,2026-08-09 22:44:56.329555,0 days 00:00:15.209311,,,scale,rbf,0.24865896255527586,COMPLETE
165,0.8581064936717229,2026-08-09 22:44:56.407923,2026-08-09 22:45:11.042375,0 days 00:00:14.634452,,,scale,rbf,0.23826184195816147,COMPLETE
166,0.8573266693193002,2026-08-09 22:45:11.120689,2026-08-09 22:45:26.781562,0 days 00:00:15.660873,,,scale,rbf,0.2567981545795573,COMPLETE
167,0.8574765472690556,2026-08-09 22:45:26.844326,2026-08-09 22:45:41.178817,0 days 00:00:14.334491,,,scale,rbf,0.23385779134899232,COMPLETE
168,0.8547476609635046,2026-08-09 22:45:41.241423,2026-08-09 22:45:58.012179,0 days 00:00:16.770756,,,scale,rbf,0.27491596265076285,COMPLETE
169,0.8560620865914366,2026-08-09 22:45:58.074779,2026-08-09 22:46:11.733761,0 days 00:00:13.658982,,,scale,rbf,0.21999965246576228,COMPLETE
170,0.8579838571868699,2026-08-09 22:46:11.812034,2026-08-09 22:46:27.293046,0 days 00:00:15.481012,,,scale,rbf,0.24997261490065792,COMPLETE
171,0.8584670189929389,2026-08-09 22:46:27.355640,2026-08-09 22:46:42.668346,0 days 00:00:15.312706,,,scale,rbf,0.24407581957126867,COMPLETE
172,0.858134882670861,2026-08-09 22:46:42.730935,2026-08-09 22:46:57.623305,0 days 00:00:14.892370,,,scale,rbf,0.24017294387425245,COMPLETE
173,0.8558613678857554,2026-08-09 22:46:57.701749,2026-08-09 22:47:13.959123,0 days 00:00:16.257374,,,scale,rbf,0.2656325683657136,COMPLETE
174,0.8566515699390934,2026-08-09 22:47:14.021721,2026-08-09 22:47:28.108655,0 days 00:00:14.086934,,,scale,rbf,0.22691656967321358,COMPLETE
175,0.8574202681987081,2026-08-09 22:47:28.171272,2026-08-09 22:47:43.804485,0 days 00:00:15.633213,,,scale,rbf,0.25540585171859165,COMPLETE
176,0.8337504287661885,2026-08-09 22:47:43.867134,2026-08-09 22:47:58.772903,0 days 00:00:14.905769,,,auto,rbf,0.24267788359627457,COMPLETE
177,0.8572734337093172,2026-08-09 22:47:58.850556,2026-08-09 22:48:13.281165,0 days 00:00:14.430609,,,scale,rbf,0.23153334147075158,COMPLETE
178,0.8563288134620732,2026-08-09 22:48:13.376805,2026-08-09 22:48:37.569632,0 days 00:00:24.192827,,,scale,rbf,0.26322451255615603,COMPLETE
179,0.8584655721019461,2026-08-09 22:48:37.662774,2026-08-09 22:49:00.292206,0 days 00:00:22.629432,,,scale,rbf,0.24429972484389287,COMPLETE
180,0.8574906170366425,2026-08-09 22:49:00.387096,2026-08-09 22:49:21.088439,0 days 00:00:20.701343,,,scale,rbf,0.2549873380283252,COMPLETE
181,0.85849580713442,2026-08-09 22:49:21.166813,2026-08-09 22:49:38.546294,0 days 00:00:17.379481,,,scale,rbf,0.2454614777367549,COMPLETE
182,0.8585299338047371,2026-08-09 22:49:38.609168,2026-08-09 22:49:54.209724,0 days 00:00:15.600556,,,scale,rbf,0.24487904936779192,COMPLETE
183,0.8578864165624115,2026-08-09 22:49:54.278787,2026-08-09 22:50:10.272500,0 days 00:00:15.993713,,,scale,rbf,0.236132384316383,COMPLETE
184,0.8552642509407911,2026-08-09 22:50:10.351190,2026-08-09 22:50:24.079928,0 days 00:00:13.728738,,,scale,rbf,0.21628594741771015,COMPLETE
185,0.8582951383215316,2026-08-09 22:50:24.158200,2026-08-09 22:50:39.439594,0 days 00:00:15.281394,,,scale,rbf,0.24751085950692864,COMPLETE
186,0.856841661479895,2026-08-09 22:50:39.518820,2026-08-09 22:50:53.713265,0 days 00:00:14.194445,,,scale,rbf,0.2285157506007867,COMPLETE
187,0.8568396657681805,2026-08-09 22:50:53.778117,2026-08-09 22:51:09.931276,0 days 00:00:16.153159,,,scale,rbf,0.26093563112431634,COMPLETE
188,0.8540287058183728,2026-08-09 22:51:10.009667,2026-08-09 22:51:27.036361,0 days 00:00:17.026694,,,scale,rbf,0.2808972728211598,COMPLETE
189,0.5569638239832162,2026-08-09 22:51:27.109160,2026-08-09 22:51:41.005920,0 days 00:00:13.896760,0.43169557181066665,,scale,sigmoid,0.24227570113160377,COMPLETE
190,0.8577869802262389,2026-08-09 22:51:41.069078,2026-08-09 22:51:56.678173,0 days 00:00:15.609095,,,scale,rbf,0.2524436222628714,COMPLETE
191,0.8580224243157515,2026-08-09 22:51:56.756469,2026-08-09 22:52:12.145872,0 days 00:00:15.389403,,,scale,rbf,0.24888394417138876,COMPLETE
192,0.8576557122882207,2026-08-09 22:52:12.228004,2026-08-09 22:52:27.044323,0 days 00:00:14.816319,,,scale,rbf,0.23547427201874616,COMPLETE
193,0.8553005230012012,2026-08-09 22:52:27.107422,2026-08-09 22:52:44.074071,0 days 00:00:16.966649,,,scale,rbf,0.2690126374282553,COMPLETE
194,0.8583698777252379,2026-08-09 22:52:44.136896,2026-08-09 22:52:59.488997,0 days 00:00:15.352101,,,scale,rbf,0.24301245906781183,COMPLETE
195,0.8566562099688295,2026-08-09 22:52:59.551663,2026-08-09 22:53:13.902191,0 days 00:00:14.350528,,,scale,rbf,0.22617221085069272,COMPLETE
196,0.8576845503224945,2026-08-09 22:53:13.965134,2026-08-09 22:53:29.993199,0 days 00:00:16.028065,,,scale,rbf,0.253967162031327,COMPLETE
197,0.682478424485387,2026-08-09 22:53:30.071916,2026-08-09 22:53:42.015147,0 days 00:00:11.943231,0.8608524812098115,2.0,scale,poly,0.26268306559979615,COMPLETE
198,0.8582454949926347,2026-08-09 22:53:42.095256,2026-08-09 22:53:57.258796,0 days 00:00:15.163540,,,scale,rbf,0.24117353595729266,COMPLETE
199,0.8554838790149666,2026-08-09 22:53:57.337186,2026-08-09 22:54:11.052646,0 days 00:00:13.715460,,,scale,rbf,0.21741960042141403,COMPLETE
