number,value,datetime_start,datetime_complete,duration,params_coef0,params_degree,params_gamma,params_kernel,params_nu,state
0,0.8343344239066306,2026-08-09 22:04:39.789809,2026-08-09 22:05:01.912460,0 days 00:00:22.122651,,,auto,rbf,0.38398623012183963,COMPLETE
1,0.5876289323316524,2026-08-09 22:05:01.974434,2026-08-09 22:05:17.538512,0 days 00:00:15.564078,0.4096689261577843,2.0,auto,poly,0.36924042442680854,COMPLETE
2,0.8495544698329466,2026-08-09 22:05:17.616694,2026-08-09 22:05:37.481207,0 days 00:00:19.864513,,,scale,rbf,0.3453872359369577,COMPLETE
3,0.6375808980453251,2026-08-09 22:05:37.559499,2026-08-09 22:05:55.751762,0 days 00:00:18.192263,0.46611212698404725,4.0,auto,poly,0.47844607646757426,COMPLETE
4,0.83305507291208,2026-08-09 22:05:55.814364,2026-08-09 22:06:15.159375,0 days 00:00:19.345011,,,auto,rbf,0.3246537803990481,COMPLETE
5,0.6916421339646435,2026-08-09 22:06:15.237828,2026-08-09 22:06:30.801080,0 days 00:00:15.563252,0.9195368729845518,3.0,scale,poly,0.3801041253469005,COMPLETE
6,0.6374910411253818,2026-08-09 22:06:30.863818,2026-08-09 22:06:49.341668,0 days 00:00:18.477850,0.8575360154478097,2.0,auto,poly,0.4855524407145187,COMPLETE
7,0.8536550087998412,2026-08-09 22:06:49.404225,2026-08-09 22:07:06.609921,0 days 00:00:17.205696,,,scale,rbf,0.28787565953252586,COMPLETE
8,0.6394688912199911,2026-08-09 22:07:06.672518,2026-08-09 22:07:25.809713,0 days 00:00:19.137195,0.5533676821642126,,auto,sigmoid,0.4811500113956895,COMPLETE
9,0.637515837843434,2026-08-09 22:07:25.872276,2026-08-09 22:07:44.432921,0 days 00:00:18.560645,0.5047003210583879,3.0,auto,poly,0.4882211187656823,COMPLETE
10,0.5569317928101991,2026-08-09 22:07:44.502614,2026-08-09 22:07:49.118785,0 days 00:00:04.616171,0.002095226610021428,,scale,sigmoid,0.09689368106642904,COMPLETE
11,0.8573909811292985,2026-08-09 22:07:49.181383,2026-08-09 22:08:03.558321,0 days 00:00:14.376938,,,scale,rbf,0.23240570936379945,COMPLETE
12,0.853833624998285,2026-08-09 22:08:03.636569,2026-08-09 22:08:16.272613,0 days 00:00:12.636044,,,scale,rbf,0.20467775453691944,COMPLETE
13,0.8497645683836856,2026-08-09 22:08:16.335216,2026-08-09 22:08:27.295584,0 days 00:00:10.960368,,,scale,rbf,0.17779698818310033,COMPLETE
14,0.8521174127094406,2026-08-09 22:08:27.358300,2026-08-09 22:08:39.312640,0 days 00:00:11.954340,,,scale,rbf,0.19478967950634385,COMPLETE
15,0.7900021329168949,2026-08-09 22:08:39.390931,2026-08-09 22:08:39.862749,0 days 00:00:00.471818,,,scale,rbf,0.010714190847747274,COMPLETE
16,0.8582684456773507,2026-08-09 22:08:39.925575,2026-08-09 22:08:54.586653,0 days 00:00:14.661078,,,scale,rbf,0.2416245906913993,COMPLETE
17,0.5595046643524727,2026-08-09 22:08:54.654114,2026-08-09 22:09:08.232716,0 days 00:00:13.578602,0.009612117604259951,,scale,sigmoid,0.2577477326798916,COMPLETE
18,0.8405670315908691,2026-08-09 22:09:08.310898,2026-08-09 22:09:15.540011,0 days 00:00:07.229113,,,scale,rbf,0.1223520213110896,COMPLETE
19,0.8578920544480049,2026-08-09 22:09:15.618198,2026-08-09 22:09:30.891768,0 days 00:00:15.273570,,,scale,rbf,0.2518780135571398,COMPLETE
20,0.5451144353570265,2026-08-09 22:09:30.954335,2026-08-09 22:09:36.423325,0 days 00:00:05.468990,0.2614832860586038,,scale,sigmoid,0.1049639881670488,COMPLETE
21,0.8582763287386229,2026-08-09 22:09:36.481836,2026-08-09 22:09:51.194505,0 days 00:00:14.712669,,,scale,rbf,0.24186964764963786,COMPLETE
22,0.853275125074995,2026-08-09 22:09:51.273540,2026-08-09 22:10:09.018271,0 days 00:00:17.744731,,,scale,rbf,0.29466386259001087,COMPLETE
23,0.8578874643110614,2026-08-09 22:10:09.081021,2026-08-09 22:10:24.612358,0 days 00:00:15.531337,,,scale,rbf,0.2519249686369907,COMPLETE
24,0.8480713566723503,2026-08-09 22:10:24.687872,2026-08-09 22:10:35.307670,0 days 00:00:10.619798,,,scale,rbf,0.16984133912677907,COMPLETE
25,0.8450604763015471,2026-08-09 22:10:35.370221,2026-08-09 22:10:44.377553,0 days 00:00:09.007332,,,scale,rbf,0.14730482256277116,COMPLETE
26,0.8564063468621799,2026-08-09 22:10:44.440099,2026-08-09 22:10:58.193298,0 days 00:00:13.753199,,,scale,rbf,0.22209578685800221,COMPLETE
27,0.8393950498865563,2026-08-09 22:10:58.256175,2026-08-09 22:11:21.062527,0 days 00:00:22.806352,,,scale,rbf,0.41685364159396976,COMPLETE
28,0.5589174760732876,2026-08-09 22:11:21.140705,2026-08-09 22:11:37.996695,0 days 00:00:16.855990,0.6577377627033442,,scale,sigmoid,0.28876606383790815,COMPLETE
29,0.8516760111709963,2026-08-09 22:11:38.059311,2026-08-09 22:11:56.895085,0 days 00:00:18.835774,,,scale,rbf,0.3180042121681286,COMPLETE
30,0.8566388472769138,2026-08-09 22:11:56.965004,2026-08-09 22:12:12.811499,0 days 00:00:15.846495,,,scale,rbf,0.26167934981126595,COMPLETE
31,0.858233121580005,2026-08-09 22:12:12.874625,2026-08-09 22:12:27.918303,0 days 00:00:15.043678,,,scale,rbf,0.24766891513683228,COMPLETE
32,0.8570734135027359,2026-08-09 22:12:27.996564,2026-08-09 22:12:42.082277,0 days 00:00:14.085713,,,scale,rbf,0.23018107967204574,COMPLETE
33,0.8495004858310704,2026-08-09 22:12:42.160474,2026-08-09 22:13:01.966772,0 days 00:00:19.806298,,,scale,rbf,0.34617300523727346,COMPLETE
34,0.8366815804539994,2026-08-09 22:13:02.045437,2026-08-09 22:13:25.547623,0 days 00:00:23.502186,,,auto,rbf,0.41896636985766866,COMPLETE
35,0.6945021884226269,2026-08-09 22:13:25.625814,2026-08-09 22:13:37.608114,0 days 00:00:11.982300,0.23826277640006704,5.0,scale,poly,0.27946140466659425,COMPLETE
36,0.8511853654459979,2026-08-09 22:13:37.669967,2026-08-09 22:13:56.431596,0 days 00:00:18.761629,,,scale,rbf,0.3227405543830266,COMPLETE
37,0.8004598618718031,2026-08-09 22:13:56.494187,2026-08-09 22:14:05.626567,0 days 00:00:09.132380,,,auto,rbf,0.15008957301461276,COMPLETE
38,0.6982280824079259,2026-08-09 22:14:05.691108,2026-08-09 22:14:14.367217,0 days 00:00:08.676109,0.7649993393717616,5.0,scale,poly,0.19674401673861566,COMPLETE
39,0.783395478964575,2026-08-09 22:14:14.429829,2026-08-09 22:14:17.420006,0 days 00:00:02.990177,,,auto,rbf,0.06571746410238469,COMPLETE
40,0.8488920432221264,2026-08-09 22:14:17.483306,2026-08-09 22:14:37.591771,0 days 00:00:20.108465,,,scale,rbf,0.353580714011941,COMPLETE
41,0.857802047849683,2026-08-09 22:14:37.670016,2026-08-09 22:14:52.919254,0 days 00:00:15.249238,,,scale,rbf,0.25052385154451917,COMPLETE
42,0.8582438485304701,2026-08-09 22:14:52.982122,2026-08-09 22:15:07.821944,0 days 00:00:14.839822,,,scale,rbf,0.24114098057111547,COMPLETE
43,0.8564520985532338,2026-08-09 22:15:07.900273,2026-08-09 22:15:21.747444,0 days 00:00:13.847171,,,scale,rbf,0.2222268776648562,COMPLETE
44,0.6993403923319766,2026-08-09 22:15:21.810051,2026-08-09 22:15:34.912645,0 days 00:00:13.102594,0.27605576878005045,4.0,scale,poly,0.30326093291545697,COMPLETE
45,0.8547978531131232,2026-08-09 22:15:34.990906,2026-08-09 22:15:48.003599,0 days 00:00:13.012693,,,scale,rbf,0.21234933775336975,COMPLETE
46,0.8338500646735328,2026-08-09 22:15:48.081847,2026-08-09 22:16:04.684593,0 days 00:00:16.602746,,,auto,rbf,0.2721806255411141,COMPLETE
47,0.5559239085016071,2026-08-09 22:16:04.747202,2026-08-09 22:16:19.728235,0 days 00:00:14.981033,0.981162253754335,,scale,sigmoid,0.24480641204881112,COMPLETE
48,0.8496060090879721,2026-08-09 22:16:19.787963,2026-08-09 22:16:31.076641,0 days 00:00:11.288678,,,scale,rbf,0.1766146984477605,COMPLETE
49,0.6969139062439582,2026-08-09 22:16:31.154822,2026-08-09 22:16:43.970859,0 days 00:00:12.816037,0.13919619390956078,4.0,scale,poly,0.30569594853901205,COMPLETE
50,0.8338237212789019,2026-08-09 22:16:44.033661,2026-08-09 22:16:58.418397,0 days 00:00:14.384736,,,auto,rbf,0.23643124856216438,COMPLETE
51,0.855532374809628,2026-08-09 22:16:58.482326,2026-08-09 22:17:14.705676,0 days 00:00:16.223350,,,scale,rbf,0.2676351961021007,COMPLETE
52,0.8583121517638973,2026-08-09 22:17:14.768269,2026-08-09 22:17:29.894083,0 days 00:00:15.125814,,,scale,rbf,0.247479194252332,COMPLETE
53,0.8529386480799381,2026-08-09 22:17:29.956677,2026-08-09 22:17:42.347780,0 days 00:00:12.391103,,,scale,rbf,0.19889632278743394,COMPLETE
54,0.8545960866587918,2026-08-09 22:17:42.426092,2026-08-09 22:17:59.290535,0 days 00:00:16.864443,,,scale,rbf,0.2762403985906992,COMPLETE
55,0.8581329368519394,2026-08-09 22:17:59.353126,2026-08-09 22:18:14.145901,0 days 00:00:14.792775,,,scale,rbf,0.2397760052891453,COMPLETE
56,0.5544602535302269,2026-08-09 22:18:14.224184,2026-08-09 22:18:27.363814,0 days 00:00:13.139630,0.6930830318366571,,scale,sigmoid,0.21855888656136513,COMPLETE
57,0.849318227458748,2026-08-09 22:18:27.426412,2026-08-09 22:18:38.323629,0 days 00:00:10.897217,,,scale,rbf,0.17411857970942343,COMPLETE
58,0.8581419674474474,2026-08-09 22:18:38.386241,2026-08-09 22:18:53.026052,0 days 00:00:14.639811,,,scale,rbf,0.23912502187701157,COMPLETE
59,0.8456969087672863,2026-08-09 22:18:53.102669,2026-08-09 22:19:02.421923,0 days 00:00:09.319254,,,scale,rbf,0.15128391943396202,COMPLETE
60,0.8517842785315054,2026-08-09 22:19:02.486601,2026-08-09 22:19:14.458569,0 days 00:00:11.971968,,,scale,rbf,0.19398201700984474,COMPLETE
61,0.8580273637022449,2026-08-09 22:19:14.537103,2026-08-09 22:19:29.315214,0 days 00:00:14.778111,,,scale,rbf,0.23722725695127192,COMPLETE
62,0.8565559753479709,2026-08-09 22:19:29.391831,2026-08-09 22:19:45.382697,0 days 00:00:15.990866,,,scale,rbf,0.26212680110385483,COMPLETE
63,0.854310350634075,2026-08-09 22:19:45.456127,2026-08-09 22:19:58.382089,0 days 00:00:12.925962,,,scale,rbf,0.20925752562635033,COMPLETE
64,0.8537332905918408,2026-08-09 22:19:58.444693,2026-08-09 22:20:15.828956,0 days 00:00:17.384263,,,scale,rbf,0.28866222115755313,COMPLETE
65,0.858215808780882,2026-08-09 22:20:15.907239,2026-08-09 22:20:30.723619,0 days 00:00:14.816380,,,scale,rbf,0.2406361930896673,COMPLETE
66,0.8523595424331966,2026-08-09 22:20:30.786511,2026-08-09 22:20:49.387720,0 days 00:00:18.601209,,,scale,rbf,0.3096999101036747,COMPLETE
67,0.5566529419908971,2026-08-09 22:20:49.450472,2026-08-09 22:21:02.235244,0 days 00:00:12.784772,0.3670896631093097,,scale,sigmoid,0.22396452019836077,COMPLETE
68,0.8507690599823629,2026-08-09 22:21:02.310612,2026-08-09 22:21:14.000185,0 days 00:00:11.689573,,,scale,rbf,0.18616152456096874,COMPLETE
69,0.8507260523949164,2026-08-09 22:21:14.063065,2026-08-09 22:21:33.562491,0 days 00:00:19.499426,,,scale,rbf,0.3319928071133941,COMPLETE
70,0.5830183892361288,2026-08-09 22:21:33.625688,2026-08-09 22:21:41.050570,0 days 00:00:07.424882,0.6297295594149002,3.0,auto,poly,0.15940651921513002,COMPLETE
71,0.8584671686713176,2026-08-09 22:21:41.129421,2026-08-09 22:21:56.232695,0 days 00:00:15.103274,,,scale,rbf,0.24408780861427826,COMPLETE
72,0.8575467464286116,2026-08-09 22:21:56.319006,2026-08-09 22:22:11.927904,0 days 00:00:15.608898,,,scale,rbf,0.25465763958962373,COMPLETE
73,0.8541663600338771,2026-08-09 22:22:12.006540,2026-08-09 22:22:24.909160,0 days 00:00:12.902620,,,scale,rbf,0.20637295445147585,COMPLETE
74,0.8538799754028532,2026-08-09 22:22:24.987335,2026-08-09 22:22:42.061751,0 days 00:00:17.074416,,,scale,rbf,0.2813643695674398,COMPLETE
75,0.8583883380585966,2026-08-09 22:22:42.124298,2026-08-09 22:22:57.231879,0 days 00:00:15.107581,,,scale,rbf,0.24357705841398122,COMPLETE
76,0.8560174325418257,2026-08-09 22:22:57.307010,2026-08-09 22:23:13.443351,0 days 00:00:16.136341,,,scale,rbf,0.2650152092247489,COMPLETE
77,0.8532138068325685,2026-08-09 22:23:13.521533,2026-08-09 22:23:31.285113,0 days 00:00:17.763580,,,scale,rbf,0.29625045954091267,COMPLETE
78,0.8566175929471548,2026-08-09 22:23:31.363310,2026-08-09 22:23:45.233920,0 days 00:00:13.870610,,,scale,rbf,0.2266860012131248,COMPLETE
79,0.8580665794374339,2026-08-09 22:23:45.312810,2026-08-09 22:24:00.657288,0 days 00:00:15.344478,,,scale,rbf,0.24935017494740658,COMPLETE
80,0.5549336862416883,2026-08-09 22:24:00.720290,2026-08-09 22:24:08.946668,0 days 00:00:08.226378,0.8385956813011279,,scale,sigmoid,0.13549883568239957,COMPLETE
81,0.8582081252907816,2026-08-09 22:24:09.009506,2026-08-09 22:24:23.797078,0 days 00:00:14.787572,,,scale,rbf,0.24077104691438825,COMPLETE
82,0.8573711237977396,2026-08-09 22:24:23.859795,2026-08-09 22:24:39.475387,0 days 00:00:15.615592,,,scale,rbf,0.25577446714575075,COMPLETE
83,0.8548774820105298,2026-08-09 22:24:39.537993,2026-08-09 22:24:52.717621,0 days 00:00:13.179628,,,scale,rbf,0.21291195487703662,COMPLETE
84,0.8509226299987901,2026-08-09 22:24:52.795923,2026-08-09 22:25:04.487817,0 days 00:00:11.691894,,,scale,rbf,0.18762489691016698,COMPLETE
85,0.8544130300017836,2026-08-09 22:25:04.551783,2026-08-09 22:25:21.241191,0 days 00:00:16.689408,,,scale,rbf,0.27724508219297556,COMPLETE
86,0.8339681609142355,2026-08-09 22:25:21.303821,2026-08-09 22:25:35.524049,0 days 00:00:14.220228,,,auto,rbf,0.22843044752039068,COMPLETE
87,0.71993199612333,2026-08-09 22:25:35.587046,2026-08-09 22:25:46.555845,0 days 00:00:10.968799,0.09832651543631077,2.0,scale,poly,0.245839809668645,COMPLETE
88,0.8555936431592616,2026-08-09 22:25:46.634192,2026-08-09 22:26:02.905559,0 days 00:00:16.271367,,,scale,rbf,0.2674066560027495,COMPLETE
89,0.8574504034455963,2026-08-09 22:26:02.984096,2026-08-09 22:26:17.359476,0 days 00:00:14.375380,,,scale,rbf,0.23337664612532222,COMPLETE
90,0.8535865558880356,2026-08-09 22:26:17.437717,2026-08-09 22:26:34.923664,0 days 00:00:17.485947,,,scale,rbf,0.2910912386468293,COMPLETE
91,0.8582353168628908,2026-08-09 22:26:34.986255,2026-08-09 22:26:49.803627,0 days 00:00:14.817372,,,scale,rbf,0.24092522109474582,COMPLETE
92,0.8551700533478688,2026-08-09 22:26:49.881892,2026-08-09 22:27:03.084844,0 days 00:00:13.202952,,,scale,rbf,0.21515926441897387,COMPLETE
93,0.8584945598145983,2026-08-09 22:27:03.163433,2026-08-09 22:27:18.278271,0 days 00:00:15.114838,,,scale,rbf,0.24564211593514634,COMPLETE
94,0.8568084827726423,2026-08-09 22:27:18.356603,2026-08-09 22:27:34.400009,0 days 00:00:16.043406,,,scale,rbf,0.2610938473276997,COMPLETE
95,0.8538474453019077,2026-08-09 22:27:34.481015,2026-08-09 22:27:47.305636,0 days 00:00:12.824621,,,scale,rbf,0.20492435785235008,COMPLETE
96,0.8547496566752191,2026-08-09 22:27:47.384213,2026-08-09 22:28:04.127606,0 days 00:00:16.743393,,,scale,rbf,0.27490438922007926,COMPLETE
97,0.8563834959630495,2026-08-09 22:28:04.193570,2026-08-09 22:28:18.026848,0 days 00:00:13.833278,,,scale,rbf,0.22154334821354982,COMPLETE
98,0.8344674879851919,2026-08-09 22:28:18.105427,2026-08-09 22:28:33.684451,0 days 00:00:15.579024,,,auto,rbf,0.25367656441831066,COMPLETE
99,0.8584918656037839,2026-08-09 22:28:33.747436,2026-08-09 22:28:48.864328,0 days 00:00:15.116892,,,scale,rbf,0.2460173417054407,COMPLETE
100,0.5600095295234365,2026-08-09 22:28:48.926932,2026-08-09 22:29:04.795930,0 days 00:00:15.868998,0.3453669107738382,,scale,sigmoid,0.2849715604696239,COMPLETE
101,0.8584704117028535,2026-08-09 22:29:04.858781,2026-08-09 22:29:19.817245,0 days 00:00:14.958464,,,scale,rbf,0.24425070417343323,COMPLETE
102,0.8567436221419226,2026-08-09 22:29:19.895980,2026-08-09 22:29:33.919365,0 days 00:00:14.023385,,,scale,rbf,0.22754381397035123,COMPLETE
103,0.8389091439768797,2026-08-09 22:29:33.981958,2026-08-09 22:29:58.472832,0 days 00:00:24.490874,,,scale,rbf,0.4588097459088989,COMPLETE
104,0.8583775612153386,2026-08-09 22:29:58.551108,2026-08-09 22:30:13.738419,0 days 00:00:15.187311,,,scale,rbf,0.24726784513761338,COMPLETE
105,0.8555851114916823,2026-08-09 22:30:13.817166,2026-08-09 22:30:30.300554,0 days 00:00:16.483388,,,scale,rbf,0.2673055211197822,COMPLETE
106,0.8529652908313262,2026-08-09 22:30:30.378928,2026-08-09 22:30:48.285247,0 days 00:00:17.906319,,,scale,rbf,0.2986132829717285,COMPLETE
107,0.6912146026226147,2026-08-09 22:30:48.363675,2026-08-09 22:30:59.275875,0 days 00:00:10.912200,0.14912981670475767,5.0,scale,poly,0.2496134974018658,COMPLETE
108,0.8578566305650733,2026-08-09 22:30:59.338469,2026-08-09 22:31:13.982298,0 days 00:00:14.643829,,,scale,rbf,0.2360669354100403,COMPLETE
109,0.8521373698265852,2026-08-09 22:31:14.045433,2026-08-09 22:31:32.821450,0 days 00:00:18.776017,,,scale,rbf,0.3133459979456399,COMPLETE
110,0.8034251901227238,2026-08-09 22:31:32.899913,2026-08-09 22:31:33.726821,0 days 00:00:00.826908,,,scale,rbf,0.019572242591576305,COMPLETE
111,0.8571329854974125,2026-08-09 22:31:33.789564,2026-08-09 22:31:49.651511,0 days 00:00:15.861947,,,scale,rbf,0.25956635918544846,COMPLETE
112,0.8583883879513894,2026-08-09 22:31:49.714171,2026-08-09 22:32:04.895941,0 days 00:00:15.181770,,,scale,rbf,0.24723169989237598,COMPLETE
113,0.8553417344481047,2026-08-09 22:32:04.958555,2026-08-09 22:32:18.263014,0 days 00:00:13.304459,,,scale,rbf,0.21679677253137178,COMPLETE
114,0.8532405992623351,2026-08-09 22:32:18.325606,2026-08-09 22:32:30.705662,0 days 00:00:12.380056,,,scale,rbf,0.20079887933574841,COMPLETE
115,0.8583835483504818,2026-08-09 22:32:30.781202,2026-08-09 22:32:45.666540,0 days 00:00:14.885338,,,scale,rbf,0.24344845461086706,COMPLETE
116,0.8570402347954832,2026-08-09 22:32:45.729598,2026-08-09 22:32:59.687903,0 days 00:00:13.958305,,,scale,rbf,0.22981434461428585,COMPLETE
117,0.8552178506434299,2026-08-09 22:32:59.750702,2026-08-09 22:33:16.064359,0 days 00:00:16.313657,,,scale,rbf,0.2696632354361956,COMPLETE
118,0.8574999469889075,2026-08-09 22:33:16.126980,2026-08-09 22:33:31.873616,0 days 00:00:15.746636,,,scale,rbf,0.25481639194998834,COMPLETE
119,0.8134107336859923,2026-08-09 22:33:31.951859,2026-08-09 22:33:43.539788,0 days 00:00:11.587929,,,auto,rbf,0.1875101022367778,COMPLETE
120,0.8537995482207608,2026-08-09 22:33:43.602370,2026-08-09 22:34:00.648196,0 days 00:00:17.045826,,,scale,rbf,0.2817802336586833,COMPLETE
121,0.858494360243427,2026-08-09 22:34:00.710790,2026-08-09 22:34:15.819960,0 days 00:00:15.109170,,,scale,rbf,0.24597464659265347,COMPLETE
122,0.8584341895352361,2026-08-09 22:34:15.882556,2026-08-09 22:34:31.115707,0 days 00:00:15.233151,,,scale,rbf,0.24671052534373208,COMPLETE
123,0.8585362202966376,2026-08-09 22:34:31.178297,2026-08-09 22:34:46.268305,0 days 00:00:15.090008,,,scale,rbf,0.24506773608631588,COMPLETE
124,0.8583459291846645,2026-08-09 22:34:46.330898,2026-08-09 22:35:01.494924,0 days 00:00:15.164026,,,scale,rbf,0.24742836734260254,COMPLETE
125,0.8580693734338342,2026-08-09 22:35:01.557546,2026-08-09 22:35:16.762907,0 days 00:00:15.205361,,,scale,rbf,0.24860680908831997,COMPLETE
126,0.8568617682754182,2026-08-09 22:35:16.825574,2026-08-09 22:35:32.742057,0 days 00:00:15.916483,,,scale,rbf,0.260851687902642,COMPLETE
127,0.8570688233657927,2026-08-09 22:35:32.820294,2026-08-09 22:35:47.101255,0 days 00:00:14.280961,,,scale,rbf,0.23085122343698442,COMPLETE
128,0.5555601401488551,2026-08-09 22:35:47.179624,2026-08-09 22:36:00.178125,0 days 00:00:12.998501,0.5754235129535693,,scale,sigmoid,0.22117169339116255,COMPLETE
129,0.8552588126263692,2026-08-09 22:36:00.240716,2026-08-09 22:36:16.532048,0 days 00:00:16.291332,,,scale,rbf,0.2695445785906703,COMPLETE
130,0.8584578886118454,2026-08-09 22:36:16.610313,2026-08-09 22:36:31.763788,0 days 00:00:15.153475,,,scale,rbf,0.24437249122539215,COMPLETE
131,0.8584957572416271,2026-08-09 22:36:31.842027,2026-08-09 22:36:47.076244,0 days 00:00:15.234217,,,scale,rbf,0.24545341305007645,COMPLETE
132,0.8578478993263224,2026-08-09 22:36:47.139300,2026-08-09 22:37:01.783597,0 days 00:00:14.644297,,,scale,rbf,0.23598903642784996,COMPLETE
133,0.857323825430107,2026-08-09 22:37:01.846256,2026-08-09 22:37:17.607801,0 days 00:00:15.761545,,,scale,rbf,0.2572120813497589,COMPLETE
134,0.8545660511974893,2026-08-09 22:37:17.670830,2026-08-09 22:37:30.833454,0 days 00:00:13.162624,,,scale,rbf,0.21174071438754832,COMPLETE
135,0.8584919154965768,2026-08-09 22:37:30.911698,2026-08-09 22:37:46.074823,0 days 00:00:15.163125,,,scale,rbf,0.2460522315118648,COMPLETE
136,0.7199080475827566,2026-08-09 22:37:46.148140,2026-08-09 22:37:56.154747,0 days 00:00:10.006607,0.7621039433300165,3.0,scale,poly,0.22197721961299133,COMPLETE
137,0.8544904137235116,2026-08-09 22:37:56.217899,2026-08-09 22:38:13.159186,0 days 00:00:16.941287,,,scale,rbf,0.27697872781044913,COMPLETE
138,0.8575935957611083,2026-08-09 22:38:13.222083,2026-08-09 22:38:27.776209,0 days 00:00:14.554126,,,scale,rbf,0.2346770964390624,COMPLETE
139,0.8584337903928932,2026-08-09 22:38:27.854451,2026-08-09 22:38:42.925721,0 days 00:00:15.071270,,,scale,rbf,0.24371029187458046,COMPLETE
140,0.8562809662737194,2026-08-09 22:38:42.988313,2026-08-09 22:38:59.062558,0 days 00:00:16.074245,,,scale,rbf,0.2635670339096006,COMPLETE
141,0.8584674680280746,2026-08-09 22:38:59.125151,2026-08-09 22:39:14.173032,0 days 00:00:15.047881,,,scale,rbf,0.24470546387880115,COMPLETE
142,0.8584517019055304,2026-08-09 22:39:14.235629,2026-08-09 22:39:29.232068,0 days 00:00:14.996439,,,scale,rbf,0.24445154256654977,COMPLETE
143,0.8566365522084421,2026-08-09 22:39:29.310311,2026-08-09 22:39:43.212761,0 days 00:00:13.902450,,,scale,rbf,0.22647383966680565,COMPLETE
144,0.8576356054926976,2026-08-09 22:39:43.276272,2026-08-09 22:39:57.737992,0 days 00:00:14.461720,,,scale,rbf,0.23524028843752157,COMPLETE
145,0.8576529182918204,2026-08-09 22:39:57.800823,2026-08-09 22:40:13.209240,0 days 00:00:15.408417,,,scale,rbf,0.253397009189092,COMPLETE
146,0.8548074325293527,2026-08-09 22:40:13.287584,2026-08-09 22:40:29.861394,0 days 00:00:16.573810,,,scale,rbf,0.272824058006461,COMPLETE
147,0.857195002238939,2026-08-09 22:40:29.939926,2026-08-09 22:40:45.754970,0 days 00:00:15.815044,,,scale,rbf,0.2590094507128189,COMPLETE
148,0.8313252897835774,2026-08-09 22:40:45.817477,2026-08-09 22:40:58.494229,0 days 00:00:12.676752,,,auto,rbf,0.2040554488525685,COMPLETE
149,0.8556003287935049,2026-08-09 22:40:58.556835,2026-08-09 22:41:12.135501,0 days 00:00:13.578666,,,scale,rbf,0.21786742498979553,COMPLETE
150,0.8538087284946471,2026-08-09 22:41:12.198158,2026-08-09 22:41:29.510411,0 days 00:00:17.312253,,,scale,rbf,0.2865303483766282,COMPLETE
