number,value,datetime_start,datetime_complete,duration,params_epsilon,params_k,params_lr,params_n_epochs,params_proportion,params_samples,params_wd,state
0,0.8645855290734159,2026-08-05 00:43:55.268542,2026-08-05 00:45:12.577145,0 days 00:01:17.308603,0.3660515335854786,93,0.002281167485681001,250,2,MIXED,0.01476343771074142,COMPLETE
1,0.8610399388463672,2026-08-05 00:45:12.646892,2026-08-05 00:45:48.737302,0 days 00:00:36.090410,0.1353982885353253,59,0.0016943642458979154,225,1,SUBSPACE,0.027713354390133626,COMPLETE
2,0.7510996872054679,2026-08-05 00:45:48.804326,2026-08-05 00:47:07.109952,0 days 00:01:18.305626,0.24751720505560543,86,0.026356970435992628,250,2,MIXED,0.6668829342382537,COMPLETE
3,0.8555109138882226,2026-08-05 00:47:07.172745,2026-08-05 00:47:33.073522,0 days 00:00:25.900777,0.3324791783025361,23,0.008442123802485935,225,1,UNIFORM,0.008214380427751513,COMPLETE
4,0.8584320053497314,2026-08-05 00:47:33.136296,2026-08-05 00:47:46.707883,0 days 00:00:13.571587,0.16069334497735088,25,0.0027108160847900417,75,2,UNIFORM,0.4765928163155595,COMPLETE
5,0.8628555887490885,2026-08-05 00:47:46.775904,2026-08-05 00:48:36.296391,0 days 00:00:49.520487,0.08987234528249519,136,0.037377310329363846,200,1,SUBSPACE,0.1637283697057387,COMPLETE
6,0.8720328737119334,2026-08-05 00:48:36.359508,2026-08-05 00:49:24.314851,0 days 00:00:47.955343,0.07069115155698626,98,0.017000681801169464,200,1,MIXED,0.7016532513549357,COMPLETE
7,0.8570866981157217,2026-08-05 00:49:24.377617,2026-08-05 00:49:51.445128,0 days 00:00:27.067511,0.1982118667365726,24,0.00012922628152774743,150,2,MIXED,0.0004985200134952847,COMPLETE
8,0.8573738100603057,2026-08-05 00:49:51.507819,2026-08-05 00:50:21.800302,0 days 00:00:30.292483,0.14191753444830602,70,0.001876980219849124,175,1,UNIFORM,0.0011292163044994239,COMPLETE
9,0.8574870799624937,2026-08-05 00:50:21.878753,2026-08-05 00:50:31.465323,0 days 00:00:09.586570,0.48790344490591686,30,0.0031024288227061185,75,1,MIXED,0.0029471125596792465,COMPLETE
10,0.8678658133263554,2026-08-05 00:50:31.532039,2026-08-05 00:51:15.202702,0 days 00:00:43.670663,0.020857664635959623,7,0.0001470974178222028,300,2,MIXED,0.00010254881785987903,COMPLETE
11,0.8699049744264424,2026-08-05 00:51:15.275623,2026-08-05 00:51:57.463877,0 days 00:00:42.188254,0.022795211103365215,5,0.00012743244238860694,300,2,MIXED,0.00011674832354952176,COMPLETE
12,0.8778977711875289,2026-08-05 00:51:57.526663,2026-08-05 00:52:26.046783,0 days 00:00:28.520120,0.018818250299811927,5,0.00037819112453006367,300,1,MIXED,0.00010135148803833408,COMPLETE
13,0.8547374076577723,2026-08-05 00:52:26.109740,2026-08-05 00:52:36.910583,0 days 00:00:10.800843,0.07244181790320466,11,0.0005793182382424497,100,1,MIXED,0.0925856112835083,COMPLETE
14,0.8559706564323979,2026-08-05 00:52:36.973898,2026-08-05 00:52:52.736252,0 days 00:00:15.762354,0.06616392789075656,13,0.012321404170357448,150,1,MIXED,0.04927648725114828,COMPLETE
15,0.8368365230622365,2026-08-05 00:52:52.799239,2026-08-05 00:53:32.764057,0 days 00:00:39.964818,0.09033082202673717,43,0.0004764231807821211,275,1,SUBSPACE,0.0038065833001435364,COMPLETE
16,0.8515673647000104,2026-08-05 00:53:32.833979,2026-08-05 00:53:45.923424,0 days 00:00:13.089445,0.2148713953268988,14,0.09730580688096313,125,1,MIXED,0.00035766673051521345,COMPLETE
17,0.873843677843438,2026-08-05 00:53:45.993024,2026-08-05 00:54:06.571910,0 days 00:00:20.578886,0.02422056339917706,8,0.00048542045969652474,200,1,MIXED,0.0017026073963747148,COMPLETE
18,0.8659259905362089,2026-08-05 00:54:06.636249,2026-08-05 00:54:11.688141,0 days 00:00:05.051892,0.013402112576939976,5,0.0004129466512834764,50,1,UNIFORM,0.0004051836033141419,COMPLETE
19,0.8738824440131707,2026-08-05 00:54:11.763753,2026-08-05 00:54:39.055020,0 days 00:00:27.291267,0.28509515746240693,7,0.0008163605305250651,275,1,SUBSPACE,0.0014330257707686623,COMPLETE
20,0.8702793102529252,2026-08-05 00:54:39.129877,2026-08-05 00:55:06.729680,0 days 00:00:27.599803,0.491496542276628,8,0.0010497176514718842,275,1,SUBSPACE,0.00020584953266268924,COMPLETE
21,0.8700882051505702,2026-08-05 00:55:06.801791,2026-08-05 00:55:35.534856,0 days 00:00:28.733065,0.3276664361226125,8,0.0002777440005371037,275,1,SUBSPACE,0.0012389432757502472,COMPLETE
22,0.8740305428959784,2026-08-05 00:55:35.606497,2026-08-05 00:56:06.051664,0 days 00:00:30.445167,0.41196815156593797,6,0.0009022558658525323,300,1,SUBSPACE,0.0010707818612762225,COMPLETE
23,0.8757005168015003,2026-08-05 00:56:06.114493,2026-08-05 00:56:36.123038,0 days 00:00:30.008545,0.42802083772590227,5,0.0008131121425398905,300,1,SUBSPACE,0.005230302379381986,COMPLETE
24,0.8673878991401178,2026-08-05 00:56:36.187674,2026-08-05 00:57:05.600362,0 days 00:00:29.412688,0.42545904215623864,5,0.005098762851615316,300,1,SUBSPACE,0.006442246339986088,COMPLETE
25,0.8650419401498798,2026-08-05 00:57:05.676817,2026-08-05 00:57:37.155226,0 days 00:00:31.478409,0.42870349095068216,11,0.001158944471054391,300,1,SUBSPACE,0.000659614138847597,COMPLETE
26,0.8672558518744654,2026-08-05 00:57:37.237761,2026-08-05 00:58:02.538008,0 days 00:00:25.300247,0.431557516014007,6,0.0002478770250589356,250,1,SUBSPACE,0.0002454016188149843,COMPLETE
27,0.8658893443913832,2026-08-05 00:58:02.617226,2026-08-05 00:58:34.184415,0 days 00:00:31.567189,0.36702124995345026,10,0.00026370934317857366,300,1,SUBSPACE,0.003339690540778789,COMPLETE
28,0.8605059954304377,2026-08-05 00:58:34.254162,2026-08-05 00:59:01.637322,0 days 00:00:27.383160,0.3980784680788142,15,0.0008627711418832373,250,1,SUBSPACE,0.015201541910132208,COMPLETE
29,0.867107147270256,2026-08-05 00:59:01.703316,2026-08-05 00:59:42.337164,0 days 00:00:40.633848,0.4662129737404325,6,0.004147157178654805,275,2,SUBSPACE,0.01126910931779176,COMPLETE
30,0.8594287199168466,2026-08-05 00:59:42.403678,2026-08-05 01:00:09.507306,0 days 00:00:27.103628,0.3070726891586105,17,0.001503611500418764,250,1,UNIFORM,0.00018903779857874228,COMPLETE
31,0.8740190341893389,2026-08-05 01:00:09.585979,2026-08-05 01:00:37.164785,0 days 00:00:27.578806,0.26308760579832824,6,0.0007454310029047261,275,1,SUBSPACE,0.0008232797648253176,COMPLETE
32,0.8752356256254074,2026-08-05 01:00:37.243166,2026-08-05 01:01:06.781142,0 days 00:00:29.537976,0.38199902863174257,5,0.0006510879609526786,300,1,SUBSPACE,0.0007735596214944924,COMPLETE
33,0.8692232349884064,2026-08-05 01:01:06.844057,2026-08-05 01:01:36.430742,0 days 00:00:29.586685,0.38342088741683944,5,0.00032243274268914954,300,1,SUBSPACE,0.0019882813360359236,COMPLETE
34,0.8661549532261934,2026-08-05 01:01:36.494352,2026-08-05 01:02:00.206793,0 days 00:00:23.712441,0.3464088904605956,9,0.001331865211472831,225,1,SUBSPACE,0.0046764180455749794,COMPLETE
35,0.8673203612037865,2026-08-05 01:02:00.280471,2026-08-05 01:02:30.400317,0 days 00:00:30.119846,0.4640474217630818,6,0.0002065399924416979,300,1,SUBSPACE,0.023423477103394826,COMPLETE
36,0.8694534091211952,2026-08-05 01:02:30.461948,2026-08-05 01:02:52.758473,0 days 00:00:22.296525,0.40139262420459365,5,0.0006403945892632439,225,1,SUBSPACE,0.0008442964457601054,COMPLETE
37,0.8660253288461491,2026-08-05 01:02:52.837275,2026-08-05 01:03:19.059823,0 days 00:00:26.222548,0.45715425730407394,6,0.002368117366163576,275,1,UNIFORM,0.0022249760258671136,COMPLETE
38,0.8754997201567123,2026-08-05 01:03:19.130715,2026-08-05 01:03:49.114438,0 days 00:00:29.983723,0.19358126882644183,7,0.00037766244827174537,300,1,SUBSPACE,0.009110285610300046,COMPLETE
39,0.8673818419260971,2026-08-05 01:03:49.187532,2026-08-05 01:04:14.903355,0 days 00:00:25.715823,0.17752690145186129,9,0.000190632668465822,250,1,SUBSPACE,0.027192272508372715,COMPLETE
40,0.8583063181588009,2026-08-05 01:04:14.982392,2026-08-05 01:05:00.900882,0 days 00:00:45.918490,0.22407287204515747,19,0.00035517654855822756,275,2,MIXED,0.005868185527011072,COMPLETE
41,0.8758383184204726,2026-08-05 01:05:00.963713,2026-08-05 01:05:30.614319,0 days 00:00:29.650606,0.11599762764384744,7,0.001806920308081376,300,1,SUBSPACE,0.01219955320507512,COMPLETE
42,0.8749309477601636,2026-08-05 01:05:30.681937,2026-08-05 01:06:00.638977,0 days 00:00:29.957040,0.13549883568239962,7,0.001808923067680691,300,1,SUBSPACE,0.01081393830482983,COMPLETE
43,0.8682301547497039,2026-08-05 01:06:00.701980,2026-08-05 01:06:31.015389,0 days 00:00:30.313409,0.10724406012759527,7,0.0001001123528095418,300,1,SUBSPACE,0.04272394948211483,COMPLETE
44,0.8789553607555526,2026-08-05 01:06:31.086983,2026-08-05 01:06:58.019253,0 days 00:00:26.932270,0.17242426613677928,5,0.0005403611785426752,275,1,SUBSPACE,0.020516890072473405,COMPLETE
45,0.8571978479930028,2026-08-05 01:06:58.089299,2026-08-05 01:07:23.508121,0 days 00:00:25.418822,0.1145138894059399,12,0.006648236151108531,250,1,UNIFORM,0.21417224774332322,COMPLETE
46,0.8712684533025142,2026-08-05 01:07:23.571387,2026-08-05 01:07:51.536273,0 days 00:00:27.964886,0.1703825106928824,9,0.003192377760780487,275,1,MIXED,0.01978754731762798,COMPLETE
47,0.8647505881554813,2026-08-05 01:07:51.620732,2026-08-05 01:08:17.073948,0 days 00:00:25.453216,0.05315008296206839,7,0.0005275490529925677,250,1,SUBSPACE,0.05484842706584993,COMPLETE
48,0.8680672156925455,2026-08-05 01:08:17.136933,2026-08-05 01:08:39.125806,0 days 00:00:21.988873,0.19374750116515066,5,0.00017756927732207097,225,1,MIXED,0.08869707664361413,COMPLETE
49,0.8747322711402826,2026-08-05 01:08:39.207825,2026-08-05 01:09:08.570098,0 days 00:00:29.362273,0.14757970561341888,10,0.0003941008727869575,275,1,SUBSPACE,0.007764191890671994,COMPLETE
50,0.8747131909161172,2026-08-05 01:09:08.663540,2026-08-05 01:09:38.801807,0 days 00:00:30.138267,0.22808999809478614,8,0.001254817792802037,300,1,MIXED,0.9795991829370584,COMPLETE
51,0.8800756424886911,2026-08-05 01:09:38.880602,2026-08-05 01:10:08.239016,0 days 00:00:29.358414,0.2528056754107896,5,0.000625516201628097,300,1,SUBSPACE,0.01426245536004528,COMPLETE
52,0.8781476312658851,2026-08-05 01:10:08.308418,2026-08-05 01:10:35.177943,0 days 00:00:26.869525,0.2634801268454277,5,0.001794159595556716,275,1,SUBSPACE,0.035534740742993245,COMPLETE
53,0.8780967506681108,2026-08-05 01:10:35.240983,2026-08-05 01:11:02.284236,0 days 00:00:27.043253,0.25570707654090175,5,0.0018645582992693973,275,1,SUBSPACE,0.0353408041072004,COMPLETE
54,0.8712599732028852,2026-08-05 01:11:02.362943,2026-08-05 01:11:29.343904,0 days 00:00:26.980961,0.24792961216545892,6,0.002062952809829331,275,1,SUBSPACE,0.26300720687724327,COMPLETE
55,0.8794220690958517,2026-08-05 01:11:29.406874,2026-08-05 01:11:56.156642,0 days 00:00:26.749768,0.281487628829974,5,0.0027979704105483617,275,1,SUBSPACE,0.034140830995902406,COMPLETE
56,0.8782496953221348,2026-08-05 01:11:56.220282,2026-08-05 01:12:21.303296,0 days 00:00:25.083014,0.2819409891799519,5,0.003471134161366588,250,1,MIXED,0.03641053748692861,COMPLETE
57,0.8391600703605981,2026-08-05 01:12:21.366611,2026-08-05 01:13:19.151858,0 days 00:00:57.785247,0.28420656195633986,144,0.0035801321988900943,225,1,UNIFORM,0.03799562332598226,COMPLETE
58,0.8644119898917212,2026-08-05 01:13:19.212706,2026-08-05 01:13:43.045143,0 days 00:00:23.832437,0.2787358130541745,5,0.01200847216835789,250,1,SUBSPACE,0.08467407639125259,COMPLETE
59,0.8763177469102151,2026-08-05 01:13:43.107785,2026-08-05 01:14:03.506664,0 days 00:00:20.398879,0.30802829408256294,5,0.002524969937569632,200,1,MIXED,0.12715736383306708,COMPLETE
60,0.850802338569189,2026-08-05 01:14:03.574656,2026-08-05 01:15:05.192526,0 days 00:01:01.617870,0.24416762968102995,104,0.004287874762417388,250,1,SUBSPACE,0.03371088590365249,COMPLETE
61,0.8680993189268554,2026-08-05 01:15:05.263165,2026-08-05 01:15:32.255068,0 days 00:00:26.991903,0.3051877850178938,6,0.006934061027017807,275,1,MIXED,0.06675155163739457,COMPLETE
62,0.8788578396098186,2026-08-05 01:15:32.334224,2026-08-05 01:15:59.116847,0 days 00:00:26.782623,0.2527107074513154,5,0.002709159385317831,275,1,MIXED,0.0320175526235983,COMPLETE
63,0.8779107941976735,2026-08-05 01:15:59.187267,2026-08-05 01:16:26.041339,0 days 00:00:26.854072,0.2616537929838414,5,0.002787077650889048,275,1,MIXED,0.018403927927312762,COMPLETE
64,0.8542077042916574,2026-08-05 01:16:26.104180,2026-08-05 01:17:03.366877,0 days 00:00:37.262697,0.327884347000985,51,0.005636427831612411,250,1,MIXED,0.031065915164644686,COMPLETE
65,0.8784359546532728,2026-08-05 01:17:03.444834,2026-08-05 01:17:29.598606,0 days 00:00:26.153772,0.21165916513855793,6,0.01100867420519149,275,1,MIXED,0.016285334074975615,COMPLETE
66,0.8725919545660491,2026-08-05 01:17:29.671431,2026-08-05 01:17:53.643101,0 days 00:00:23.971670,0.23475481399199177,6,0.04558736785493037,250,1,MIXED,0.014116772770144883,COMPLETE
67,0.8639546702331543,2026-08-05 01:17:53.721382,2026-08-05 01:18:20.717886,0 days 00:00:26.996504,0.2735602628940627,8,0.02034642131581819,275,1,MIXED,0.055610505173305264,COMPLETE
68,0.8682298518890028,2026-08-05 01:18:20.794097,2026-08-05 01:18:45.100263,0 days 00:00:24.306166,0.20123367353714403,6,0.03224170705901367,250,1,MIXED,0.020585228565078474,COMPLETE
69,0.8604505719221479,2026-08-05 01:18:45.160353,2026-08-05 01:19:13.639954,0 days 00:00:28.479601,0.22468276900049455,29,0.009595111214935819,225,1,MIXED,0.12537566859495303,COMPLETE
70,0.8643889724784424,2026-08-05 01:19:13.702818,2026-08-05 01:19:40.197248,0 days 00:00:26.494430,0.30319068515060843,5,0.008660884861833635,275,1,MIXED,0.016051339225697826,COMPLETE
71,0.8789620236909754,2026-08-05 01:19:40.268711,2026-08-05 01:20:07.493758,0 days 00:00:27.225047,0.25579604796894445,5,0.001001464640713931,275,1,SUBSPACE,0.026101439626561817,COMPLETE
72,0.8734227014689956,2026-08-05 01:20:07.563352,2026-08-05 01:20:34.867691,0 days 00:00:27.304339,0.29426202397827733,7,0.0014775096907164718,275,1,SUBSPACE,0.0285292896713564,COMPLETE
73,0.8788832799087056,2026-08-05 01:20:34.943977,2026-08-05 01:21:01.697298,0 days 00:00:26.753321,0.21645671639570477,5,0.0010231958049377941,275,1,MIXED,0.02413969659223295,COMPLETE
74,0.8728736150180142,2026-08-05 01:21:01.760510,2026-08-05 01:21:28.558792,0 days 00:00:26.798282,0.17681217431931928,6,0.0010083292700158134,275,1,MIXED,0.06813919317797014,COMPLETE
75,0.878652802915216,2026-08-05 01:21:28.621571,2026-08-05 01:21:53.604591,0 days 00:00:24.983020,0.2106683346302541,5,0.0004646893528547569,250,1,MIXED,0.008578011525477722,COMPLETE
76,0.8729426672578509,2026-08-05 01:21:53.685396,2026-08-05 01:22:23.250269,0 days 00:00:29.564873,0.20586613419110256,6,0.0007010806566300813,300,1,MIXED,0.008291964443702397,COMPLETE
77,0.86526090843673,2026-08-05 01:22:23.319178,2026-08-05 01:22:28.425682,0 days 00:00:05.106504,0.24074627091165865,5,0.0005526357642475069,50,1,MIXED,0.021296450334193896,COMPLETE
78,0.8734284558223153,2026-08-05 01:22:28.488771,2026-08-05 01:22:55.898967,0 days 00:00:27.410196,0.2108785274355689,6,0.0009915565730220573,275,1,MIXED,0.012033431599454377,COMPLETE
79,0.8662851833276396,2026-08-05 01:22:55.974894,2026-08-05 01:23:26.068922,0 days 00:00:30.094028,0.18290715812166977,8,0.00029899510734639,200,2,UNIFORM,0.006714818579468828,COMPLETE
80,0.7984268203745297,2026-08-05 01:23:26.144499,2026-08-05 01:23:54.079018,0 days 00:00:27.934519,0.15304519739112493,7,0.08633536254578732,300,1,MIXED,0.025088077412029394,COMPLETE
81,0.8772832668251235,2026-08-05 01:23:54.163040,2026-08-05 01:24:18.792842,0 days 00:00:24.629802,0.21445478115058836,5,0.0004842356237530582,250,1,MIXED,0.04459816303253267,COMPLETE
82,0.8804057606528223,2026-08-05 01:24:18.862844,2026-08-05 01:24:43.660522,0 days 00:00:24.797678,0.2669505098422009,5,0.0008235208584427255,250,1,MIXED,0.015679472392954665,COMPLETE
83,0.8739439247354813,2026-08-05 01:24:43.717568,2026-08-05 01:25:10.925463,0 days 00:00:27.207895,0.15893476368637746,6,0.00081891157055491,275,1,MIXED,0.01531393659343938,COMPLETE
84,0.8731543668878762,2026-08-05 01:25:11.004378,2026-08-05 01:25:33.210168,0 days 00:00:22.205790,0.25102657640609993,5,0.0006020195828570997,225,1,MIXED,0.004502716479760213,COMPLETE
85,0.8733472891544372,2026-08-05 01:25:33.283549,2026-08-05 01:25:58.111501,0 days 00:00:24.827952,0.232876901643076,5,0.00042304333954820965,250,1,MIXED,0.009406284178853322,COMPLETE
86,0.8747692201458093,2026-08-05 01:25:58.186440,2026-08-05 01:26:25.266498,0 days 00:00:27.080058,0.19236745895602073,6,0.0010898906423678018,275,1,MIXED,0.01797548636375324,COMPLETE
87,0.8752341113219021,2026-08-05 01:26:25.349866,2026-08-05 01:26:54.758146,0 days 00:00:29.408280,0.21922974759772995,7,0.0013667353702584793,300,1,SUBSPACE,0.02582940913424533,COMPLETE
88,0.8786328141089474,2026-08-05 01:26:54.820733,2026-08-05 01:27:19.479659,0 days 00:00:24.658926,0.26716313570085687,5,0.0007171969025173993,250,1,MIXED,0.013035103288768658,COMPLETE
89,0.8802288900034163,2026-08-05 01:27:19.542755,2026-08-05 01:27:44.411542,0 days 00:00:24.868787,0.26950814752347885,5,0.0006919630739853725,250,1,SUBSPACE,0.0119000429634521,COMPLETE
90,0.8766090989046135,2026-08-05 01:27:44.474180,2026-08-05 01:28:06.888452,0 days 00:00:22.414272,0.31542170521073837,5,0.0009085297955447064,225,1,SUBSPACE,0.010966628867291418,COMPLETE
91,0.880058682289433,2026-08-05 01:28:06.965654,2026-08-05 01:28:31.915811,0 days 00:00:24.950157,0.26083938772542203,5,0.0007028618115617667,250,1,SUBSPACE,0.002851456181734866,COMPLETE
92,0.8693198475520376,2026-08-05 01:28:31.978456,2026-08-05 01:28:56.857345,0 days 00:00:24.878889,0.345644765155645,5,0.000432874555722022,250,1,SUBSPACE,0.004028041646934047,COMPLETE
93,0.8799357208448118,2026-08-05 01:28:56.920276,2026-08-05 01:29:21.499330,0 days 00:00:24.579054,0.25522598988914924,5,0.0006067210204990445,250,1,SUBSPACE,0.0025335162957955426,COMPLETE
94,0.868385219428635,2026-08-05 01:29:21.579332,2026-08-05 01:29:34.294094,0 days 00:00:12.714762,0.29269813715426934,7,0.0005929271436809374,125,1,SUBSPACE,0.0033429532124367224,COMPLETE
95,0.8722133786897519,2026-08-05 01:29:34.369756,2026-08-05 01:29:59.350366,0 days 00:00:24.980610,0.2538234649570975,6,0.0011961664091378649,250,1,SUBSPACE,0.0027828594318767253,COMPLETE
96,0.8793854229510262,2026-08-05 01:29:59.429314,2026-08-05 01:30:26.408122,0 days 00:00:26.978808,0.24216776048003708,5,0.000760106611772207,275,1,SUBSPACE,0.0015370127202755067,COMPLETE
97,0.8723702605328894,2026-08-05 01:30:26.486637,2026-08-05 01:30:51.389134,0 days 00:00:24.902497,0.2708970866196711,6,0.0007914131696818476,250,1,SUBSPACE,0.0024595409280128424,COMPLETE
98,0.879592276809835,2026-08-05 01:30:51.468342,2026-08-05 01:31:13.613400,0 days 00:00:22.145058,0.2394045672052712,5,0.0006936560632107938,225,1,SUBSPACE,0.0015945147130652629,COMPLETE
99,0.8678318929278391,2026-08-05 01:31:13.676166,2026-08-05 01:31:33.619732,0 days 00:00:19.943566,0.2899276315093935,7,0.0002241625252977794,200,1,SUBSPACE,0.0012372378967947966,COMPLETE
100,0.8731089377827204,2026-08-05 01:31:33.681974,2026-08-05 01:31:56.425226,0 days 00:00:22.743252,0.2365049529603394,8,0.0006647879827175876,225,1,SUBSPACE,0.0015999706895558309,COMPLETE
101,0.870151200176386,2026-08-05 01:31:56.494613,2026-08-05 01:32:13.724000,0 days 00:00:17.229387,0.2728269412536842,5,0.0005327216911117514,175,1,SUBSPACE,0.000998764334890082,COMPLETE
102,0.8698474308932453,2026-08-05 01:32:13.807154,2026-08-05 01:32:35.872061,0 days 00:00:22.064907,0.2616179776852942,5,0.0003279250340063182,225,1,SUBSPACE,0.0005534053193158993,COMPLETE
103,0.872366020483075,2026-08-05 01:32:35.950997,2026-08-05 01:33:03.104392,0 days 00:00:27.153395,0.23140228096306595,6,0.0009266245424826285,275,1,SUBSPACE,0.001597507845883075,COMPLETE
104,0.8786176710738954,2026-08-05 01:33:03.178560,2026-08-05 01:33:25.383515,0 days 00:00:22.204955,0.2817133417427547,5,0.000754134229191364,225,1,SUBSPACE,0.0018937412464670965,COMPLETE
105,0.8786515914724119,2026-08-05 01:33:25.452837,2026-08-05 01:33:50.263013,0 days 00:00:24.810176,0.24481809408949,5,0.0010991495250228765,250,1,SUBSPACE,0.00602289974385051,COMPLETE
106,0.8740817263544536,2026-08-05 01:33:50.331527,2026-08-05 01:34:17.470926,0 days 00:00:27.139399,0.3174221372830746,6,0.0014899357990069537,275,1,SUBSPACE,0.0024144657818475066,COMPLETE
107,0.8806238203575696,2026-08-05 01:34:17.540403,2026-08-05 01:34:47.438679,0 days 00:00:29.898276,0.295377799496699,5,0.0006331082413480452,300,1,SUBSPACE,0.0030921034097760947,COMPLETE
108,0.8739914738655443,2026-08-05 01:34:47.520961,2026-08-05 01:35:17.692887,0 days 00:00:30.171926,0.29240616930701674,6,0.0005157844427315317,300,1,SUBSPACE,0.0013956540475231535,COMPLETE
109,0.8805729397597953,2026-08-05 01:35:17.768892,2026-08-05 01:35:47.735804,0 days 00:00:29.966912,0.2990325794750419,5,0.0006369352404526952,300,1,SUBSPACE,0.0030086794557333137,COMPLETE
110,0.8699010372373289,2026-08-05 01:35:47.817237,2026-08-05 01:36:17.406136,0 days 00:00:29.588899,0.34697792493496454,5,0.00035406819889136315,300,1,SUBSPACE,0.0032593092887637674,COMPLETE
111,0.8794529608873577,2026-08-05 01:36:17.470615,2026-08-05 01:36:47.184440,0 days 00:00:29.713825,0.259615374543457,5,0.0008468753644736284,300,1,SUBSPACE,0.0018775813590363923,COMPLETE
112,0.8803597258262645,2026-08-05 01:36:47.254484,2026-08-05 01:37:16.886065,0 days 00:00:29.631581,0.27607173283995584,5,0.0006648100064550366,300,1,SUBSPACE,0.005117811725120119,COMPLETE
113,0.8802025411224259,2026-08-05 01:37:16.949114,2026-08-05 01:37:46.679269,0 days 00:00:29.730155,0.29924203715628434,5,0.0006356018417654801,300,1,SUBSPACE,0.00524298230981772,COMPLETE
114,0.8727570136481146,2026-08-05 01:37:46.751307,2026-08-05 01:38:16.774881,0 days 00:00:30.023574,0.31516948929338967,7,0.0006478860979343341,300,1,SUBSPACE,0.002049400221636873,COMPLETE
115,0.871966244357705,2026-08-05 01:38:16.836984,2026-08-05 01:38:47.087722,0 days 00:00:30.250738,0.30186958002306913,6,0.0008692397328119101,300,1,SUBSPACE,0.00503877670277974,COMPLETE
