number,value,datetime_start,datetime_complete,duration,params_epsilon,params_k,params_lr,params_n_epochs,params_proportion,params_samples,params_wd,state
0,0.8645855290734159,2026-08-03 10:04:00.006673,2026-08-03 10:05:51.932680,0 days 00:01:51.926007,0.3660515335854786,93,0.002281167485681001,250,2,MIXED,0.01476343771074142,COMPLETE
1,0.8610399388463672,2026-08-03 10:05:52.037712,2026-08-03 10:06:39.831137,0 days 00:00:47.793425,0.1353982885353253,59,0.0016943642458979154,225,1,SUBSPACE,0.027713354390133626,COMPLETE
2,0.7510996872054679,2026-08-03 10:06:39.930185,2026-08-03 10:08:12.425966,0 days 00:01:32.495781,0.24751720505560543,86,0.026356970435992628,250,2,MIXED,0.6668829342382537,COMPLETE
3,0.8555109138882226,2026-08-03 10:08:12.523991,2026-08-03 10:08:49.501863,0 days 00:00:36.977872,0.3324791783025361,23,0.008442123802485935,225,1,UNIFORM,0.008214380427751513,COMPLETE
4,0.8584320053497314,2026-08-03 10:08:49.607069,2026-08-03 10:09:08.749721,0 days 00:00:19.142652,0.16069334497735088,25,0.0027108160847900417,75,2,UNIFORM,0.4765928163155595,COMPLETE
5,0.8628555887490885,2026-08-03 10:09:08.850832,2026-08-03 10:10:13.240829,0 days 00:01:04.389997,0.08987234528249519,136,0.037377310329363846,200,1,SUBSPACE,0.1637283697057387,COMPLETE
6,0.8720328737119334,2026-08-03 10:10:13.343096,2026-08-03 10:11:08.345862,0 days 00:00:55.002766,0.07069115155698626,98,0.017000681801169464,200,1,MIXED,0.7016532513549357,COMPLETE
7,0.8570866981157217,2026-08-03 10:11:08.446713,2026-08-03 10:11:44.778909,0 days 00:00:36.332196,0.1982118667365726,24,0.00012922628152774743,150,2,MIXED,0.0004985200134952847,COMPLETE
8,0.8573738100603057,2026-08-03 10:11:44.880110,2026-08-03 10:12:30.944814,0 days 00:00:46.064704,0.14191753444830602,70,0.001876980219849124,175,1,UNIFORM,0.0011292163044994239,COMPLETE
9,0.8574870799624937,2026-08-03 10:12:31.043721,2026-08-03 10:12:44.160852,0 days 00:00:13.117131,0.48790344490591686,30,0.0031024288227061185,75,1,MIXED,0.0029471125596792465,COMPLETE
10,0.8678658133263554,2026-08-03 10:12:44.266403,2026-08-03 10:13:48.372776,0 days 00:01:04.106373,0.020857664635959623,7,0.0001470974178222028,300,2,MIXED,0.00010254881785987903,COMPLETE
11,0.8699049744264424,2026-08-03 10:13:48.476726,2026-08-03 10:14:51.435134,0 days 00:01:02.958408,0.022795211103365215,5,0.00012743244238860694,300,2,MIXED,0.00011674832354952176,COMPLETE
12,0.8778977711875289,2026-08-03 10:14:51.541106,2026-08-03 10:15:32.913084,0 days 00:00:41.371978,0.018818250299811927,5,0.00037819112453006367,300,1,MIXED,0.00010135148803833408,COMPLETE
13,0.8547374076577723,2026-08-03 10:15:33.013625,2026-08-03 10:15:48.444582,0 days 00:00:15.430957,0.07244181790320466,11,0.0005793182382424497,100,1,MIXED,0.0925856112835083,COMPLETE
14,0.8559706564323979,2026-08-03 10:15:48.546606,2026-08-03 10:16:10.491693,0 days 00:00:21.945087,0.06616392789075656,13,0.012321404170357448,150,1,MIXED,0.04927648725114828,COMPLETE
15,0.8368365230622365,2026-08-03 10:16:10.592781,2026-08-03 10:17:04.079706,0 days 00:00:53.486925,0.09033082202673717,43,0.0004764231807821211,275,1,SUBSPACE,0.0038065833001435364,COMPLETE
16,0.8515673647000104,2026-08-03 10:17:04.186128,2026-08-03 10:17:22.653068,0 days 00:00:18.466940,0.2148713953268988,14,0.09730580688096313,125,1,MIXED,0.00035766673051521345,COMPLETE
17,0.873843677843438,2026-08-03 10:17:22.753114,2026-08-03 10:17:51.362143,0 days 00:00:28.609029,0.02422056339917706,8,0.00048542045969652474,200,1,MIXED,0.0017026073963747148,COMPLETE
18,0.8659259905362089,2026-08-03 10:17:51.464623,2026-08-03 10:17:58.602005,0 days 00:00:07.137382,0.013402112576939976,5,0.0004129466512834764,50,1,UNIFORM,0.0004051836033141419,COMPLETE
19,0.8738824440131707,2026-08-03 10:17:58.704475,2026-08-03 10:18:38.379030,0 days 00:00:39.674555,0.28509515746240693,7,0.0008163605305250651,275,1,SUBSPACE,0.0014330257707686623,COMPLETE
20,0.8702793102529252,2026-08-03 10:18:38.481648,2026-08-03 10:19:17.885416,0 days 00:00:39.403768,0.491496542276628,8,0.0010497176514718842,275,1,SUBSPACE,0.00020584953266268924,COMPLETE
21,0.8700882051505702,2026-08-03 10:19:17.987480,2026-08-03 10:19:57.490441,0 days 00:00:39.502961,0.3276664361226125,8,0.0002777440005371037,275,1,SUBSPACE,0.0012389432757502472,COMPLETE
22,0.8740305428959784,2026-08-03 10:19:57.594058,2026-08-03 10:20:40.339520,0 days 00:00:42.745462,0.41196815156593797,6,0.0009022558658525323,300,1,SUBSPACE,0.0010707818612762225,COMPLETE
23,0.8757005168015003,2026-08-03 10:20:40.439308,2026-08-03 10:21:22.745520,0 days 00:00:42.306212,0.42802083772590227,5,0.0008131121425398905,300,1,SUBSPACE,0.005230302379381986,COMPLETE
24,0.8673878991401178,2026-08-03 10:21:22.849262,2026-08-03 10:22:04.884708,0 days 00:00:42.035446,0.42545904215623864,5,0.005098762851615316,300,1,SUBSPACE,0.006442246339986088,COMPLETE
25,0.8650419401498798,2026-08-03 10:22:04.988516,2026-08-03 10:22:50.111231,0 days 00:00:45.122715,0.42870349095068216,11,0.001158944471054391,300,1,SUBSPACE,0.000659614138847597,COMPLETE
26,0.8672558518744654,2026-08-03 10:22:50.215124,2026-08-03 10:23:26.294111,0 days 00:00:36.078987,0.431557516014007,6,0.0002478770250589356,250,1,SUBSPACE,0.0002454016188149843,COMPLETE
27,0.8658893443913832,2026-08-03 10:23:26.392347,2026-08-03 10:24:10.805115,0 days 00:00:44.412768,0.36702124995345026,10,0.00026370934317857366,300,1,SUBSPACE,0.003339690540778789,COMPLETE
28,0.8605059954304377,2026-08-03 10:24:10.910831,2026-08-03 10:24:49.069629,0 days 00:00:38.158798,0.3980784680788142,15,0.0008627711418832373,250,1,SUBSPACE,0.015201541910132208,COMPLETE
29,0.867107147270256,2026-08-03 10:24:49.174170,2026-08-03 10:25:45.270172,0 days 00:00:56.096002,0.4662129737404325,6,0.004147157178654805,275,2,SUBSPACE,0.01126910931779176,COMPLETE
30,0.8594287199168466,2026-08-03 10:25:45.347460,2026-08-03 10:26:21.445533,0 days 00:00:36.098073,0.3070726891586105,17,0.001503611500418764,250,1,UNIFORM,0.00018903779857874228,COMPLETE
31,0.8740190341893389,2026-08-03 10:26:21.524053,2026-08-03 10:26:57.968738,0 days 00:00:36.444685,0.26308760579832824,6,0.0007454310029047261,275,1,SUBSPACE,0.0008232797648253176,COMPLETE
32,0.8752356256254074,2026-08-03 10:26:58.047402,2026-08-03 10:27:37.778776,0 days 00:00:39.731374,0.38199902863174257,5,0.0006510879609526786,300,1,SUBSPACE,0.0007735596214944924,COMPLETE
33,0.8692232349884064,2026-08-03 10:27:37.857519,2026-08-03 10:28:11.326673,0 days 00:00:33.469154,0.38342088741683944,5,0.00032243274268914954,300,1,SUBSPACE,0.0019882813360359236,COMPLETE
34,0.8661549532261934,2026-08-03 10:28:11.405219,2026-08-03 10:28:36.006593,0 days 00:00:24.601374,0.3464088904605956,9,0.001331865211472831,225,1,SUBSPACE,0.0046764180455749794,COMPLETE
35,0.8673203612037865,2026-08-03 10:28:36.081428,2026-08-03 10:29:07.514330,0 days 00:00:31.432902,0.4640474217630818,6,0.0002065399924416979,300,1,SUBSPACE,0.023423477103394826,COMPLETE
36,0.8694534091211952,2026-08-03 10:29:07.585526,2026-08-03 10:29:29.360100,0 days 00:00:21.774574,0.40139262420459365,5,0.0006403945892632439,225,1,SUBSPACE,0.0008442964457601054,COMPLETE
37,0.8660253288461491,2026-08-03 10:29:29.422847,2026-08-03 10:29:55.731996,0 days 00:00:26.309149,0.45715425730407394,6,0.002368117366163576,275,1,UNIFORM,0.0022249760258671136,COMPLETE
38,0.8754997201567123,2026-08-03 10:29:55.794678,2026-08-03 10:30:25.321756,0 days 00:00:29.527078,0.19358126882644183,7,0.00037766244827174537,300,1,SUBSPACE,0.009110285610300046,COMPLETE
39,0.8673818419260971,2026-08-03 10:30:25.392543,2026-08-03 10:30:50.931096,0 days 00:00:25.538553,0.17752690145186129,9,0.000190632668465822,250,1,SUBSPACE,0.027192272508372715,COMPLETE
40,0.8583063181588009,2026-08-03 10:30:50.989797,2026-08-03 10:31:36.723635,0 days 00:00:45.733838,0.22407287204515747,19,0.00035517654855822756,275,2,MIXED,0.005868185527011072,COMPLETE
41,0.8758383184204726,2026-08-03 10:31:36.801946,2026-08-03 10:32:05.684928,0 days 00:00:28.882982,0.11599762764384744,7,0.001806920308081376,300,1,SUBSPACE,0.01219955320507512,COMPLETE
42,0.8749309477601636,2026-08-03 10:32:05.756589,2026-08-03 10:32:34.666006,0 days 00:00:28.909417,0.13549883568239962,7,0.001808923067680691,300,1,SUBSPACE,0.01081393830482983,COMPLETE
43,0.8682301547497039,2026-08-03 10:32:34.744245,2026-08-03 10:33:03.664396,0 days 00:00:28.920151,0.10724406012759527,7,0.0001001123528095418,300,1,SUBSPACE,0.04272394948211483,COMPLETE
44,0.8789553607555526,2026-08-03 10:33:03.743851,2026-08-03 10:33:30.043567,0 days 00:00:26.299716,0.17242426613677928,5,0.0005403611785426752,275,1,SUBSPACE,0.020516890072473405,COMPLETE
45,0.8571978479930028,2026-08-03 10:33:30.122586,2026-08-03 10:33:55.137976,0 days 00:00:25.015390,0.1145138894059399,12,0.006648236151108531,250,1,UNIFORM,0.21417224774332322,COMPLETE
46,0.8712684533025142,2026-08-03 10:33:55.200581,2026-08-03 10:34:22.560981,0 days 00:00:27.360400,0.1703825106928824,9,0.003192377760780487,275,1,MIXED,0.01978754731762798,COMPLETE
47,0.8647505881554813,2026-08-03 10:34:22.629749,2026-08-03 10:34:47.253702,0 days 00:00:24.623953,0.05315008296206839,7,0.0005275490529925677,250,1,SUBSPACE,0.05484842706584993,COMPLETE
48,0.8680672156925455,2026-08-03 10:34:47.323866,2026-08-03 10:35:08.557141,0 days 00:00:21.233275,0.19374750116515066,5,0.00017756927732207097,225,1,MIXED,0.08869707664361413,COMPLETE
49,0.8747322711402826,2026-08-03 10:35:08.620036,2026-08-03 10:35:36.844418,0 days 00:00:28.224382,0.14757970561341888,10,0.0003941008727869575,275,1,SUBSPACE,0.007764191890671994,COMPLETE
50,0.8747131909161172,2026-08-03 10:35:36.920641,2026-08-03 10:36:06.426100,0 days 00:00:29.505459,0.22808999809478614,8,0.001254817792802037,300,1,MIXED,0.9795991829370584,COMPLETE
51,0.8800756424886911,2026-08-03 10:36:06.492879,2026-08-03 10:36:35.330762,0 days 00:00:28.837883,0.2528056754107896,5,0.000625516201628097,300,1,SUBSPACE,0.01426245536004528,COMPLETE
52,0.8781476312658851,2026-08-03 10:36:35.393762,2026-08-03 10:37:01.699798,0 days 00:00:26.306036,0.2634801268454277,5,0.001794159595556716,275,1,SUBSPACE,0.035534740742993245,COMPLETE
53,0.8780967506681108,2026-08-03 10:37:01.769487,2026-08-03 10:37:28.045262,0 days 00:00:26.275775,0.25570707654090175,5,0.0018645582992693973,275,1,SUBSPACE,0.0353408041072004,COMPLETE
54,0.8712599732028852,2026-08-03 10:37:28.133415,2026-08-03 10:37:54.518895,0 days 00:00:26.385480,0.24792961216545892,6,0.002062952809829331,275,1,SUBSPACE,0.26300720687724327,COMPLETE
55,0.8794220690958517,2026-08-03 10:37:54.594044,2026-08-03 10:38:20.934238,0 days 00:00:26.340194,0.281487628829974,5,0.0027979704105483617,275,1,SUBSPACE,0.034140830995902406,COMPLETE
56,0.8782496953221348,2026-08-03 10:38:20.996828,2026-08-03 10:38:45.984443,0 days 00:00:24.987615,0.2819409891799519,5,0.003471134161366588,250,1,MIXED,0.03641053748692861,COMPLETE
57,0.8391600703605981,2026-08-03 10:38:46.062285,2026-08-03 10:39:43.866815,0 days 00:00:57.804530,0.28420656195633986,144,0.0035801321988900943,225,1,UNIFORM,0.03799562332598226,COMPLETE
58,0.8644119898917212,2026-08-03 10:39:43.944799,2026-08-03 10:40:07.195261,0 days 00:00:23.250462,0.2787358130541745,5,0.01200847216835789,250,1,SUBSPACE,0.08467407639125259,COMPLETE
59,0.8763177469102151,2026-08-03 10:40:07.273488,2026-08-03 10:40:26.812095,0 days 00:00:19.538607,0.30802829408256294,5,0.002524969937569632,200,1,MIXED,0.12715736383306708,COMPLETE
60,0.850802338569189,2026-08-03 10:40:26.890681,2026-08-03 10:41:29.520834,0 days 00:01:02.630153,0.24416762968102995,104,0.004287874762417388,250,1,SUBSPACE,0.03371088590365249,COMPLETE
61,0.8680993189268554,2026-08-03 10:41:29.599025,2026-08-03 10:41:58.326306,0 days 00:00:28.727281,0.3051877850178938,6,0.006934061027017807,275,1,MIXED,0.06675155163739457,COMPLETE
62,0.8788578396098186,2026-08-03 10:41:58.396465,2026-08-03 10:42:27.448958,0 days 00:00:29.052493,0.2527107074513154,5,0.002709159385317831,275,1,MIXED,0.0320175526235983,COMPLETE
63,0.8779107941976735,2026-08-03 10:42:27.527462,2026-08-03 10:42:54.184409,0 days 00:00:26.656947,0.2616537929838414,5,0.002787077650889048,275,1,MIXED,0.018403927927312762,COMPLETE
64,0.8542077042916574,2026-08-03 10:42:54.262644,2026-08-03 10:43:34.911237,0 days 00:00:40.648593,0.327884347000985,51,0.005636427831612411,250,1,MIXED,0.031065915164644686,COMPLETE
65,0.8784359546532728,2026-08-03 10:43:34.989549,2026-08-03 10:44:10.510540,0 days 00:00:35.520991,0.21165916513855793,6,0.01100867420519149,275,1,MIXED,0.016285334074975615,COMPLETE
66,0.8725919545660491,2026-08-03 10:44:10.601056,2026-08-03 10:44:42.628615,0 days 00:00:32.027559,0.23475481399199177,6,0.04558736785493037,250,1,MIXED,0.014116772770144883,COMPLETE
67,0.8639546702331543,2026-08-03 10:44:42.711963,2026-08-03 10:45:18.532929,0 days 00:00:35.820966,0.2735602628940627,8,0.02034642131581819,275,1,MIXED,0.055610505173305264,COMPLETE
68,0.8682298518890028,2026-08-03 10:45:18.629272,2026-08-03 10:45:50.797843,0 days 00:00:32.168571,0.20123367353714403,6,0.03224170705901367,250,1,MIXED,0.020585228565078474,COMPLETE
69,0.8604505719221479,2026-08-03 10:45:50.872817,2026-08-03 10:46:26.384645,0 days 00:00:35.511828,0.22468276900049455,29,0.009595111214935819,225,1,MIXED,0.12537566859495303,COMPLETE
70,0.8643889724784424,2026-08-03 10:46:26.470979,2026-08-03 10:47:01.519897,0 days 00:00:35.048918,0.30319068515060843,5,0.008660884861833635,275,1,MIXED,0.016051339225697826,COMPLETE
71,0.8789620236909754,2026-08-03 10:47:01.599929,2026-08-03 10:47:37.494238,0 days 00:00:35.894309,0.25579604796894445,5,0.001001464640713931,275,1,SUBSPACE,0.026101439626561817,COMPLETE
72,0.8734227014689956,2026-08-03 10:47:37.576819,2026-08-03 10:48:14.399724,0 days 00:00:36.822905,0.29426202397827733,7,0.0014775096907164718,275,1,SUBSPACE,0.0285292896713564,COMPLETE
73,0.8788832799087056,2026-08-03 10:48:14.487983,2026-08-03 10:48:50.672165,0 days 00:00:36.184182,0.21645671639570477,5,0.0010231958049377941,275,1,MIXED,0.02413969659223295,COMPLETE
74,0.8728736150180142,2026-08-03 10:48:50.752181,2026-08-03 10:49:26.611475,0 days 00:00:35.859294,0.17681217431931928,6,0.0010083292700158134,275,1,MIXED,0.06813919317797014,COMPLETE
75,0.878652802915216,2026-08-03 10:49:26.702022,2026-08-03 10:49:59.371152,0 days 00:00:32.669130,0.2106683346302541,5,0.0004646893528547569,250,1,MIXED,0.008578011525477722,COMPLETE
76,0.8729426672578509,2026-08-03 10:49:59.451970,2026-08-03 10:50:38.823014,0 days 00:00:39.371044,0.20586613419110256,6,0.0007010806566300813,300,1,MIXED,0.008291964443702397,COMPLETE
77,0.86526090843673,2026-08-03 10:50:38.909654,2026-08-03 10:50:45.623731,0 days 00:00:06.714077,0.24074627091165865,5,0.0005526357642475069,50,1,MIXED,0.021296450334193896,COMPLETE
78,0.8734284558223153,2026-08-03 10:50:45.725895,2026-08-03 10:51:21.978437,0 days 00:00:36.252542,0.2108785274355689,6,0.0009915565730220573,275,1,MIXED,0.012033431599454377,COMPLETE
79,0.8662851833276396,2026-08-03 10:51:22.057108,2026-08-03 10:52:03.127059,0 days 00:00:41.069951,0.18290715812166977,8,0.00029899510734639,200,2,UNIFORM,0.006714818579468828,COMPLETE
80,0.7984268203745297,2026-08-03 10:52:03.214538,2026-08-03 10:52:41.383841,0 days 00:00:38.169303,0.15304519739112493,7,0.08633536254578732,300,1,MIXED,0.025088077412029394,COMPLETE
81,0.8772832668251235,2026-08-03 10:52:41.451775,2026-08-03 10:53:13.795809,0 days 00:00:32.344034,0.21445478115058836,5,0.0004842356237530582,250,1,MIXED,0.04459816303253267,COMPLETE
82,0.8804057606528223,2026-08-03 10:53:13.873757,2026-08-03 10:53:46.333149,0 days 00:00:32.459392,0.2669505098422009,5,0.0008235208584427255,250,1,MIXED,0.015679472392954665,COMPLETE
83,0.8739439247354813,2026-08-03 10:53:46.405602,2026-08-03 10:54:22.154608,0 days 00:00:35.749006,0.15893476368637746,6,0.00081891157055491,275,1,MIXED,0.01531393659343938,COMPLETE
84,0.8731543668878762,2026-08-03 10:54:22.227013,2026-08-03 10:54:51.388403,0 days 00:00:29.161390,0.25102657640609993,5,0.0006020195828570997,225,1,MIXED,0.004502716479760213,COMPLETE
85,0.8733472891544372,2026-08-03 10:54:51.467827,2026-08-03 10:55:23.874328,0 days 00:00:32.406501,0.232876901643076,5,0.00042304333954820965,250,1,MIXED,0.009406284178853322,COMPLETE
86,0.8747692201458093,2026-08-03 10:55:23.967513,2026-08-03 10:55:59.608603,0 days 00:00:35.641090,0.19236745895602073,6,0.0010898906423678018,275,1,MIXED,0.01797548636375324,COMPLETE
87,0.8752341113219021,2026-08-03 10:55:59.685444,2026-08-03 10:56:39.019803,0 days 00:00:39.334359,0.21922974759772995,7,0.0013667353702584793,300,1,SUBSPACE,0.02582940913424533,COMPLETE
88,0.8786328141089474,2026-08-03 10:56:39.107930,2026-08-03 10:57:12.311417,0 days 00:00:33.203487,0.26716313570085687,5,0.0007171969025173993,250,1,MIXED,0.013035103288768658,COMPLETE
89,0.8802288900034163,2026-08-03 10:57:12.399488,2026-08-03 10:57:45.844028,0 days 00:00:33.444540,0.26950814752347885,5,0.0006919630739853725,250,1,SUBSPACE,0.0119000429634521,COMPLETE
90,0.8766090989046135,2026-08-03 10:57:45.931141,2026-08-03 10:58:16.142371,0 days 00:00:30.211230,0.31542170521073837,5,0.0009085297955447064,225,1,SUBSPACE,0.010966628867291418,COMPLETE
91,0.880058682289433,2026-08-03 10:58:16.227987,2026-08-03 10:58:49.579693,0 days 00:00:33.351706,0.26083938772542203,5,0.0007028618115617667,250,1,SUBSPACE,0.002851456181734866,COMPLETE
92,0.8693198475520376,2026-08-03 10:58:49.669614,2026-08-03 10:59:22.513942,0 days 00:00:32.844328,0.345644765155645,5,0.000432874555722022,250,1,SUBSPACE,0.004028041646934047,COMPLETE
93,0.8799357208448118,2026-08-03 10:59:22.592709,2026-08-03 10:59:54.701837,0 days 00:00:32.109128,0.25522598988914924,5,0.0006067210204990445,250,1,SUBSPACE,0.0025335162957955426,COMPLETE
94,0.868385219428635,2026-08-03 10:59:54.779390,2026-08-03 11:00:11.189358,0 days 00:00:16.409968,0.29269813715426934,7,0.0005929271436809374,125,1,SUBSPACE,0.0033429532124367224,COMPLETE
95,0.8722133786897519,2026-08-03 11:00:11.271825,2026-08-03 11:00:43.496905,0 days 00:00:32.225080,0.2538234649570975,6,0.0011961664091378649,250,1,SUBSPACE,0.0027828594318767253,COMPLETE
96,0.8793854229510262,2026-08-03 11:00:43.581834,2026-08-03 11:01:19.418011,0 days 00:00:35.836177,0.24216776048003708,5,0.000760106611772207,275,1,SUBSPACE,0.0015370127202755067,COMPLETE
97,0.8723702605328894,2026-08-03 11:01:19.505495,2026-08-03 11:01:52.813594,0 days 00:00:33.308099,0.2708970866196711,6,0.0007914131696818476,250,1,SUBSPACE,0.0024595409280128424,COMPLETE
98,0.879592276809835,2026-08-03 11:01:52.888378,2026-08-03 11:02:21.834612,0 days 00:00:28.946234,0.2394045672052712,5,0.0006936560632107938,225,1,SUBSPACE,0.0015945147130652629,COMPLETE
99,0.8678318929278391,2026-08-03 11:02:21.904964,2026-08-03 11:02:48.263935,0 days 00:00:26.358971,0.2899276315093935,7,0.0002241625252977794,200,1,SUBSPACE,0.0012372378967947966,COMPLETE
100,0.8731089377827204,2026-08-03 11:02:48.361566,2026-08-03 11:03:19.012883,0 days 00:00:30.651317,0.2365049529603394,8,0.0006647879827175876,225,1,SUBSPACE,0.0015999706895558309,COMPLETE
101,0.870151200176386,2026-08-03 11:03:19.101937,2026-08-03 11:03:42.013608,0 days 00:00:22.911671,0.2728269412536842,5,0.0005327216911117514,175,1,SUBSPACE,0.000998764334890082,COMPLETE
102,0.8698474308932453,2026-08-03 11:03:42.097718,2026-08-03 11:04:11.255857,0 days 00:00:29.158139,0.2616179776852942,5,0.0003279250340063182,225,1,SUBSPACE,0.0005534053193158993,COMPLETE
103,0.872366020483075,2026-08-03 11:04:11.328073,2026-08-03 11:04:47.346871,0 days 00:00:36.018798,0.23140228096306595,6,0.0009266245424826285,275,1,SUBSPACE,0.001597507845883075,COMPLETE
104,0.8786176710738954,2026-08-03 11:04:47.430440,2026-08-03 11:05:17.078510,0 days 00:00:29.648070,0.2817133417427547,5,0.000754134229191364,225,1,SUBSPACE,0.0018937412464670965,COMPLETE
105,0.8786515914724119,2026-08-03 11:05:17.156134,2026-08-03 11:05:49.869190,0 days 00:00:32.713056,0.24481809408949,5,0.0010991495250228765,250,1,SUBSPACE,0.00602289974385051,COMPLETE
106,0.8740817263544536,2026-08-03 11:05:49.964726,2026-08-03 11:06:26.222360,0 days 00:00:36.257634,0.3174221372830746,6,0.0014899357990069537,275,1,SUBSPACE,0.0024144657818475066,COMPLETE
107,0.8806238203575696,2026-08-03 11:06:26.318275,2026-08-03 11:07:08.187474,0 days 00:00:41.869199,0.295377799496699,5,0.0006331082413480452,300,1,SUBSPACE,0.0030921034097760947,COMPLETE
108,0.8739914738655443,2026-08-03 11:07:08.263820,2026-08-03 11:07:48.217913,0 days 00:00:39.954093,0.29240616930701674,6,0.0005157844427315317,300,1,SUBSPACE,0.0013956540475231535,COMPLETE
109,0.8805729397597953,2026-08-03 11:07:48.306955,2026-08-03 11:08:27.969167,0 days 00:00:39.662212,0.2990325794750419,5,0.0006369352404526952,300,1,SUBSPACE,0.0030086794557333137,COMPLETE
110,0.8699010372373289,2026-08-03 11:08:28.055431,2026-08-03 11:09:08.041069,0 days 00:00:39.985638,0.34697792493496454,5,0.00035406819889136315,300,1,SUBSPACE,0.0032593092887637674,COMPLETE
111,0.8794529608873577,2026-08-03 11:09:08.113385,2026-08-03 11:09:47.082898,0 days 00:00:38.969513,0.259615374543457,5,0.0008468753644736284,300,1,SUBSPACE,0.0018775813590363923,COMPLETE
112,0.8803597258262645,2026-08-03 11:09:47.175304,2026-08-03 11:10:25.603731,0 days 00:00:38.428427,0.27607173283995584,5,0.0006648100064550366,300,1,SUBSPACE,0.005117811725120119,COMPLETE
113,0.8802025411224259,2026-08-03 11:10:25.687085,2026-08-03 11:11:04.568668,0 days 00:00:38.881583,0.29924203715628434,5,0.0006356018417654801,300,1,SUBSPACE,0.00524298230981772,COMPLETE
114,0.8727570136481146,2026-08-03 11:11:04.658645,2026-08-03 11:11:44.548268,0 days 00:00:39.889623,0.31516948929338967,7,0.0006478860979343341,300,1,SUBSPACE,0.002049400221636873,COMPLETE
115,0.871966244357705,2026-08-03 11:11:44.633605,2026-08-03 11:12:24.836396,0 days 00:00:40.202791,0.30186958002306913,6,0.0008692397328119101,300,1,SUBSPACE,0.00503877670277974,COMPLETE
