number,value,datetime_start,datetime_complete,duration,params_epsilon,params_k,params_lr,params_n_epochs,params_proportion,params_samples,params_wd,state
0,0.8811509383464695,2026-08-05 02:27:02.863414,2026-08-05 02:30:43.408602,0 days 00:03:40.545188,0.3660515335854786,93,0.002281167485681001,250,2,MIXED,0.01476343771074142,COMPLETE
1,0.8880203655671391,2026-08-05 02:30:43.486929,2026-08-05 02:31:43.021007,0 days 00:00:59.534078,0.1353982885353253,59,0.0016943642458979154,225,1,SUBSPACE,0.027713354390133626,COMPLETE
2,0.8144295916827727,2026-08-05 02:31:43.095721,2026-08-05 02:35:08.634550,0 days 00:03:25.538829,0.24751720505560543,86,0.026356970435992628,250,2,MIXED,0.6668829342382537,COMPLETE
3,0.883427425438817,2026-08-05 02:35:08.712790,2026-08-05 02:35:43.544857,0 days 00:00:34.832067,0.3324791783025361,23,0.008442123802485935,225,1,UNIFORM,0.008214380427751513,COMPLETE
4,0.8884070023925678,2026-08-05 02:35:43.628800,2026-08-05 02:36:05.084383,0 days 00:00:21.455583,0.16069334497735088,25,0.0027108160847900417,75,2,UNIFORM,0.4765928163155595,COMPLETE
5,0.8800125825364096,2026-08-05 02:36:05.151152,2026-08-05 02:38:55.630782,0 days 00:02:50.479630,0.08987234528249519,136,0.037377310329363846,200,1,SUBSPACE,0.1637283697057387,COMPLETE
6,0.8911047035874149,2026-08-05 02:38:55.708985,2026-08-05 02:41:04.885501,0 days 00:02:09.176516,0.07069115155698626,98,0.017000681801169464,200,1,MIXED,0.7016532513549357,COMPLETE
7,0.8869179342007888,2026-08-05 02:41:04.963926,2026-08-05 02:41:46.803540,0 days 00:00:41.839614,0.1982118667365726,24,0.00012922628152774743,150,2,MIXED,0.0004985200134952847,COMPLETE
8,0.8836391551289328,2026-08-05 02:41:46.873177,2026-08-05 02:43:13.313433,0 days 00:01:26.440256,0.14191753444830602,70,0.001876980219849124,175,1,UNIFORM,0.0011292163044994239,COMPLETE
9,0.8866231292345936,2026-08-05 02:43:13.385071,2026-08-05 02:43:27.805283,0 days 00:00:14.420212,0.48790344490591686,30,0.0031024288227061185,75,1,MIXED,0.0029471125596792465,COMPLETE
10,0.888494568224111,2026-08-05 02:43:27.870986,2026-08-05 02:44:17.950702,0 days 00:00:50.079716,0.020857664635959623,7,0.0001470974178222028,300,2,MIXED,0.00010254881785987903,COMPLETE
11,0.8890188405745036,2026-08-05 02:44:18.029073,2026-08-05 02:45:04.739675,0 days 00:00:46.710602,0.022795211103365215,5,0.00012743244238860694,300,2,MIXED,0.00011674832354952176,COMPLETE
12,0.8891434534886227,2026-08-05 02:45:04.809729,2026-08-05 02:45:36.566714,0 days 00:00:31.756985,0.018818250299811927,5,0.00037819112453006367,300,1,MIXED,0.00010135148803833408,COMPLETE
13,0.8874303065792026,2026-08-05 02:45:36.635900,2026-08-05 02:45:49.513919,0 days 00:00:12.878019,0.07244181790320466,11,0.0005793182382424497,100,1,MIXED,0.0925856112835083,COMPLETE
14,0.8867190025937448,2026-08-05 02:45:49.582328,2026-08-05 02:46:08.750702,0 days 00:00:19.168374,0.06616392789075656,13,0.012321404170357448,150,1,MIXED,0.04927648725114828,COMPLETE
15,0.8881077068709091,2026-08-05 02:46:08.813428,2026-08-05 02:47:19.093935,0 days 00:01:10.280507,0.09033082202673717,43,0.0004764231807821211,275,1,SUBSPACE,0.0038065833001435364,COMPLETE
16,0.8920232467075248,2026-08-05 02:47:19.172608,2026-08-05 02:47:35.257008,0 days 00:00:16.084400,0.2148713953268988,14,0.09730580688096313,125,1,MIXED,0.00035766673051521345,COMPLETE
17,0.8818319310825471,2026-08-05 02:47:35.324322,2026-08-05 02:47:51.458368,0 days 00:00:16.134046,0.25681334916292375,14,0.09659450568688238,125,1,MIXED,0.00042672976013364227,COMPLETE
18,0.7057042627944906,2026-08-05 02:47:51.521106,2026-08-05 02:48:35.085782,0 days 00:00:43.564676,0.33229150372463867,138,0.09393610349746763,50,1,UNIFORM,0.18860719731193873,COMPLETE
19,0.8739418006049677,2026-08-05 02:48:35.158049,2026-08-05 02:48:54.575526,0 days 00:00:19.417477,0.22736411333875053,8,0.03918109514985063,175,1,SUBSPACE,0.0020986754212625925,COMPLETE
20,0.8951360997549952,2026-08-05 02:48:54.645422,2026-08-05 02:49:26.462980,0 days 00:00:31.817558,0.4723278963892103,45,0.011446494410654779,125,1,MIXED,0.00039735001748631045,COMPLETE
21,0.8812461381223011,2026-08-05 02:49:26.536443,2026-08-05 02:49:58.407154,0 days 00:00:31.870711,0.49085821528025575,43,0.009945935534127384,125,1,MIXED,0.0003366151112641226,COMPLETE
22,0.8855375374512326,2026-08-05 02:49:58.474941,2026-08-05 02:50:27.919849,0 days 00:00:29.444908,0.41196815156593797,38,0.01644049936852422,125,1,MIXED,0.0010707818612762225,COMPLETE
23,0.8854908356744096,2026-08-05 02:50:27.993455,2026-08-05 02:50:52.558472,0 days 00:00:24.565017,0.42802083772590227,18,0.00485602929571509,175,1,MIXED,0.0002274912707806601,COMPLETE
24,0.5,2026-08-05 02:50:52.627244,2026-08-05 02:51:56.426771,0 days 00:01:03.799527,0.3196396876999559,60,0.05711072728617728,150,1,MIXED,0.006442246339986088,COMPLETE
25,0.897827514172193,2026-08-05 02:51:56.499672,2026-08-05 02:52:55.236611,0 days 00:00:58.736939,0.1857537893695545,89,0.020254048314594285,100,1,MIXED,0.0011532698732502457,COMPLETE
26,0.8887974561901408,2026-08-05 02:52:55.306218,2026-08-05 02:53:15.768494,0 days 00:00:20.462276,0.19650994390553234,33,0.005212851438115401,100,1,MIXED,0.000973148907518441,COMPLETE
27,0.866657670587221,2026-08-05 02:53:15.837860,2026-08-05 02:53:41.545282,0 days 00:00:25.707422,0.29440144340120566,58,0.022514225633122963,100,1,MIXED,0.0007190650470210085,COMPLETE
28,0.8531976796401808,2026-08-05 02:53:41.605839,2026-08-05 02:53:48.830517,0 days 00:00:07.224678,0.4401480101016593,17,0.05211376631100911,50,1,UNIFORM,0.00019394754702828113,COMPLETE
29,0.8697069822748795,2026-08-05 02:53:48.898857,2026-08-05 02:55:03.787402,0 days 00:01:14.888545,0.39169757101158686,103,0.006316397612307214,75,2,SUBSPACE,0.0013554498154597502,COMPLETE
30,0.6412973484168097,2026-08-05 02:55:03.866253,2026-08-05 02:56:11.731324,0 days 00:01:07.865071,0.2735572925020873,80,0.06110864645379587,125,1,MIXED,0.00022944537862142338,COMPLETE
31,0.8866651159281799,2026-08-05 02:56:11.809995,2026-08-05 02:57:22.155078,0 days 00:01:10.345083,0.19085530946267543,108,0.017565813176441295,100,1,MIXED,0.009162678661943665,COMPLETE
32,0.9015257111243633,2026-08-05 02:57:22.225602,2026-08-05 02:59:41.719979,0 days 00:02:19.494377,0.11713050515334827,107,0.02885170365318346,200,1,MIXED,0.030167250382175145,COMPLETE
33,0.8797808698744799,2026-08-05 02:59:41.782562,2026-08-05 03:01:18.571099,0 days 00:01:36.788537,0.12101588940657104,60,0.028313143434173745,225,1,MIXED,0.02463359775473354,COMPLETE
34,0.8767856693801597,2026-08-05 03:01:18.633695,2026-08-05 03:05:10.995245,0 days 00:03:52.361550,0.17001605070234344,150,0.034854725094914926,250,1,MIXED,0.0019760517454127935,COMPLETE
35,0.8808285164641726,2026-08-05 03:05:11.063245,2026-08-05 03:07:02.791923,0 days 00:01:51.728678,0.22362576291525532,116,0.011951816449993024,150,1,MIXED,0.004302846066549462,COMPLETE
36,0.6720962721204762,2026-08-05 03:07:02.870144,2026-08-05 03:08:50.661982,0 days 00:01:47.791838,0.36515888517405903,80,0.06879932678948864,200,1,SUBSPACE,0.017012667303491345,COMPLETE
37,0.8660415663775947,2026-08-05 03:08:50.740560,2026-08-05 03:09:11.192056,0 days 00:00:20.451496,0.11561184710363148,50,0.025630023830932283,75,1,UNIFORM,0.0006114498324109044,COMPLETE
38,0.9036939758300342,2026-08-05 03:09:11.268829,2026-08-05 03:11:23.019264,0 days 00:02:11.750435,0.15488508267718026,88,0.008604534511306569,225,1,MIXED,0.31032858233385535,COMPLETE
39,0.8894330943160346,2026-08-05 03:11:23.098069,2026-08-05 03:13:13.880931,0 days 00:01:50.782862,0.16351356498725544,70,0.00788735882397539,225,1,MIXED,0.36495827810061104,COMPLETE
40,0.8811841684569015,2026-08-05 03:13:13.959627,2026-08-05 03:16:48.726912,0 days 00:03:34.767285,0.1290691165101871,90,0.004075426919261575,250,2,MIXED,0.17306807156295775,COMPLETE
41,0.8841492822296148,2026-08-05 03:16:48.789482,2026-08-05 03:20:00.431001,0 days 00:03:11.641519,0.15332469398452037,121,0.0011429997797349036,250,1,MIXED,0.051088103916245305,COMPLETE
42,0.8750181867496281,2026-08-05 03:20:00.497958,2026-08-05 03:21:38.909261,0 days 00:01:38.411303,0.11072829119569978,70,0.01618340251909831,200,1,MIXED,0.8652232057622259,COMPLETE
43,0.8708720568899491,2026-08-05 03:21:38.987481,2026-08-05 03:23:57.955222,0 days 00:02:18.967741,0.1802702270048631,94,0.04386779283002666,225,1,MIXED,0.30580095611673774,COMPLETE
44,0.8873470067753502,2026-08-05 03:23:58.017808,2026-08-05 03:24:49.907180,0 days 00:00:51.889372,0.21888380017613407,30,0.008048077348084565,275,1,MIXED,0.10443006329847539,COMPLETE
45,0.8718965771190033,2026-08-05 03:24:50.022106,2026-08-05 03:27:13.529155,0 days 00:02:23.507049,0.047802854510137355,123,0.02011710210416529,175,1,UNIFORM,0.00026942476959191427,COMPLETE
46,0.5537833827893175,2026-08-05 03:27:13.607748,2026-08-05 03:28:21.978137,0 days 00:01:08.370389,0.09354954840826366,81,0.030896486910214294,125,1,MIXED,0.04963664563192436,COMPLETE
47,0.8981295040271301,2026-08-05 03:28:22.056598,2026-08-05 03:29:03.656696,0 days 00:00:41.600098,0.13982204199102782,51,0.012368692494016675,150,1,MIXED,0.0001547002872927012,COMPLETE
48,0.8784783842622197,2026-08-05 03:29:03.716971,2026-08-05 03:29:50.088929,0 days 00:00:46.371958,0.14590971201838032,47,0.01232924811946418,175,1,SUBSPACE,0.0001545798547615299,COMPLETE
49,0.8850426782391275,2026-08-05 03:29:50.162786,2026-08-05 03:30:27.704429,0 days 00:00:37.541643,0.14093056121146635,54,0.0032313061053873497,150,1,MIXED,0.5207435034827627,COMPLETE
50,0.8744950370381015,2026-08-05 03:30:27.767213,2026-08-05 03:31:16.342516,0 days 00:00:48.575303,0.05061149297878019,68,0.012882848352801303,100,1,MIXED,0.00014368523553985328,COMPLETE
51,0.8859697534146184,2026-08-05 03:31:16.421497,2026-08-05 03:31:39.489565,0 days 00:00:23.068068,0.2420025250589357,22,0.006637613638937451,150,1,MIXED,0.0003933641403228216,COMPLETE
52,0.8920809503452338,2026-08-05 03:31:39.552333,2026-08-05 03:32:25.709131,0 days 00:00:46.156798,0.09548083915182268,35,0.010067364835570403,200,1,MIXED,0.0007129680741030128,COMPLETE
53,0.8799344468713401,2026-08-05 03:32:25.787540,2026-08-05 03:33:12.464275,0 days 00:00:46.676735,0.10224758260825204,36,0.010229355932224725,200,1,MIXED,0.0006227910683059235,COMPLETE
54,0.8824570164031011,2026-08-05 03:33:12.542857,2026-08-05 03:34:00.702665,0 days 00:00:48.159808,0.07506820629656158,39,0.02222139497922375,200,1,MIXED,0.0017410102599117034,COMPLETE
55,0.891341804915901,2026-08-05 03:34:00.781187,2026-08-05 03:34:59.166493,0 days 00:00:58.385306,0.04196929150314081,46,0.014255701426738333,225,1,MIXED,0.0008683709073730735,COMPLETE
56,0.8857564520300903,2026-08-05 03:34:59.248849,2026-08-05 03:35:43.022876,0 days 00:00:43.774027,0.13303356923198714,53,0.002454685138452276,175,1,MIXED,0.00029512267895485993,COMPLETE
57,0.8808161674366471,2026-08-05 03:35:43.095030,2026-08-05 03:36:27.144647,0 days 00:00:44.049617,0.4639519647241564,25,0.008698399933312227,275,1,UNIFORM,0.0004826094590705857,COMPLETE
58,0.8845287341663014,2026-08-05 03:36:27.205144,2026-08-05 03:37:58.599181,0 days 00:01:31.394037,0.07342842192603116,64,0.006225918025305237,200,1,MIXED,0.08508589219690024,COMPLETE
59,0.8877055776291305,2026-08-05 03:37:58.677564,2026-08-05 03:38:38.176271,0 days 00:00:39.498707,0.3656180403948378,28,0.0036757013910327908,225,1,MIXED,0.0028791095135903867,COMPLETE
60,0.8821644567146377,2026-08-05 03:38:38.244682,2026-08-05 03:40:28.031140,0 days 00:01:49.786458,0.1785200369210672,95,0.0017693905415761628,175,1,SUBSPACE,0.012394452562334554,COMPLETE
61,0.8408322615874293,2026-08-05 03:40:28.103375,2026-08-05 03:40:46.950404,0 days 00:00:18.847029,0.21301869769475618,20,0.08132044152094757,125,1,MIXED,0.00016962700416587654,COMPLETE
62,0.6949210919593911,2026-08-05 03:40:47.022905,2026-08-05 03:41:00.929613,0 days 00:00:13.906708,0.15773122028938544,7,0.04447862680006497,125,1,MIXED,0.0003307608704997383,COMPLETE
63,0.8834366310775177,2026-08-05 03:41:00.998124,2026-08-05 03:41:14.805174,0 days 00:00:13.807050,0.1948752768571851,15,0.010781213862743926,100,1,MIXED,0.001283183200547211,COMPLETE
64,0.8861496001609415,2026-08-05 03:41:14.868378,2026-08-05 03:41:33.283770,0 days 00:00:18.415392,0.30232627438171067,10,0.01932671245991367,150,1,MIXED,0.000510526304841771,COMPLETE
65,0.8779720741336821,2026-08-05 03:41:33.356668,2026-08-05 03:42:12.484086,0 days 00:00:39.127418,0.23972865220581835,77,0.004913473148826159,75,1,MIXED,0.00011906910222394739,COMPLETE
66,0.8866788121223442,2026-08-05 03:42:12.557243,2026-08-05 03:43:24.530498,0 days 00:01:11.973255,0.09242920756073764,111,0.015216222365312395,100,1,MIXED,0.02946426220123971,COMPLETE
67,0.8861147983560974,2026-08-05 03:43:24.626427,2026-08-05 03:43:40.253548,0 days 00:00:15.627121,0.11037734226988344,11,0.02661415378500831,125,1,MIXED,0.00020658948179569516,COMPLETE
68,0.8746138122301177,2026-08-05 03:43:40.330997,2026-08-05 03:45:07.057705,0 days 00:01:26.726708,0.20371019302981747,87,0.03539409247503357,150,1,MIXED,0.0007803635996261593,COMPLETE
69,0.8872345183609831,2026-08-05 03:45:07.120312,2026-08-05 03:45:39.173890,0 days 00:00:32.053578,0.169546663562489,42,0.0002142632462849272,125,1,UNIFORM,0.005369709889176689,COMPLETE
70,0.8814522546180873,2026-08-05 03:45:39.247498,2026-08-05 03:46:31.941922,0 days 00:00:52.694424,0.2702987862843164,33,0.008677900632327701,250,1,MIXED,0.002773995009708328,COMPLETE
71,0.8807553204101135,2026-08-05 03:46:32.006111,2026-08-05 03:47:31.353560,0 days 00:00:59.347449,0.034891791238288124,47,0.015714042116546815,225,1,MIXED,0.0008399350432836501,COMPLETE
72,0.8881126464819191,2026-08-05 03:47:31.418800,2026-08-05 03:48:23.500307,0 days 00:00:52.081507,0.06174718673277048,58,0.022968076307622248,200,1,MIXED,0.00043596066799863936,COMPLETE
73,0.8807973071036994,2026-08-05 03:48:23.567692,2026-08-05 03:51:24.663613,0 days 00:03:01.095921,0.017897863911981365,126,0.014525524066330129,225,1,MIXED,0.0006116790231475302,COMPLETE
74,0.8809614369058995,2026-08-05 03:51:24.740220,2026-08-05 03:53:37.776862,0 days 00:02:13.036642,0.03393358364902897,100,0.00690474881655069,200,1,MIXED,0.001686071902070778,COMPLETE
75,0.8880012807064183,2026-08-05 03:53:37.855408,2026-08-05 03:57:07.152192,0 days 00:03:29.296784,0.1365681964843166,148,0.010520128066267054,225,1,MIXED,0.0009947381448447664,COMPLETE
76,0.8827423912028222,2026-08-05 03:57:07.230607,2026-08-05 03:59:16.863518,0 days 00:02:09.632911,0.08416959906288912,74,0.01282660226056775,250,1,SUBSPACE,0.22110138971667326,COMPLETE
77,0.5452818631853485,2026-08-05 03:59:16.941749,2026-08-05 03:59:38.772372,0 days 00:00:21.830623,0.12509408703194053,28,0.031756284214299844,75,2,MIXED,0.0002657712493140133,COMPLETE
78,0.8840994370639671,2026-08-05 03:59:38.850288,2026-08-05 04:00:05.551237,0 days 00:00:26.700949,0.38666061082292014,47,0.005492572721180274,100,1,MIXED,0.0003505112374163112,COMPLETE
79,0.8749012077797975,2026-08-05 04:00:05.629891,2026-08-05 04:00:45.036442,0 days 00:00:39.406551,0.15007685994045744,35,0.01927366056122109,175,1,MIXED,0.0012864341504667883,COMPLETE
80,0.8698827875212852,2026-08-05 04:00:45.100900,2026-08-05 04:01:10.333431,0 days 00:00:25.232531,0.17860425977535827,5,0.07334239165676953,250,1,MIXED,0.0005481541903058258,COMPLETE
81,0.880136746394982,2026-08-05 04:01:10.396295,2026-08-05 04:02:06.073748,0 days 00:00:55.677453,0.05896417783753185,40,0.009596744931667619,225,1,MIXED,0.9064206412821979,COMPLETE
82,0.8852640626234902,2026-08-05 04:02:06.136553,2026-08-05 04:04:53.278049,0 days 00:02:47.141496,0.03934951344770834,132,0.04948395432465098,200,1,MIXED,0.6828770784982768,COMPLETE
83,0.8827428402583686,2026-08-05 04:04:53.351522,2026-08-05 04:06:47.442552,0 days 00:01:54.091030,0.010469175577343247,85,0.013993314723167347,200,1,MIXED,0.03335046306892003,COMPLETE
84,0.8817014804463252,2026-08-05 04:06:47.562467,2026-08-05 04:08:46.094468,0 days 00:01:58.532001,0.10784769451035975,102,0.018196204690732628,175,1,MIXED,0.28530092442976107,COMPLETE
85,0.9079795374368628,2026-08-05 04:08:46.172771,2026-08-05 04:10:31.581406,0 days 00:01:45.408635,0.3454837248787005,66,0.024100269523110982,225,1,MIXED,0.47375220931686796,COMPLETE
86,0.8786712536193877,2026-08-05 04:10:31.644117,2026-08-05 04:11:27.743757,0 days 00:00:56.099640,0.46881433268002554,53,0.027861117400936636,225,1,MIXED,0.4595099392796548,COMPLETE
87,0.8858384046673038,2026-08-05 04:11:27.812777,2026-08-05 04:12:23.388793,0 days 00:00:55.576016,0.3308376027471226,61,0.0240061698166553,125,1,UNIFORM,0.11422849806943201,COMPLETE
88,0.883282380497338,2026-08-05 04:12:23.485278,2026-08-05 04:14:09.134375,0 days 00:01:45.649097,0.3450346768214294,66,0.007931201335770792,225,1,MIXED,0.47887643180502837,COMPLETE
89,0.919617485504487,2026-08-05 04:14:09.207512,2026-08-05 04:15:06.693164,0 days 00:00:57.485652,0.4366346617918619,45,0.01143181997226426,225,1,SUBSPACE,0.13595850048358726,COMPLETE
90,0.9093949605190363,2026-08-05 04:15:06.756400,2026-08-05 04:15:41.805052,0 days 00:00:35.048652,0.43790645466363254,52,0.01133987645603247,125,1,SUBSPACE,0.13606222434344226,COMPLETE
91,0.8814219433687069,2026-08-05 04:15:41.872417,2026-08-05 04:16:14.378627,0 days 00:00:32.506210,0.4423860227464679,57,0.01088378989540675,125,1,SUBSPACE,0.1296105726985197,COMPLETE
92,0.9236690891716542,2026-08-05 04:16:14.437573,2026-08-05 04:17:31.999920,0 days 00:01:17.562347,0.4988983246822969,74,0.009210924781360551,150,1,SUBSPACE,0.06671334022345986,COMPLETE
93,0.9082927536804593,2026-08-05 04:17:32.062681,2026-08-05 04:18:49.239880,0 days 00:01:17.177199,0.4989860037255819,73,0.00723532808088257,150,1,SUBSPACE,0.07626797872971541,COMPLETE
94,0.9066231651590376,2026-08-05 04:18:49.318121,2026-08-05 04:20:07.171749,0 days 00:01:17.853628,0.49879981785793664,76,0.007552580080375831,150,1,SUBSPACE,0.14818272706473531,COMPLETE
95,0.8795298478240565,2026-08-05 04:20:07.250148,2026-08-05 04:21:24.940700,0 days 00:01:17.690552,0.4937156192937746,74,0.0055227450137846235,150,1,SUBSPACE,0.08135237300851145,COMPLETE
96,0.879050256500528,2026-08-05 04:21:25.014031,2026-08-05 04:22:50.563966,0 days 00:01:25.549935,0.499301049644669,85,0.004120800922483735,150,1,SUBSPACE,0.23570355672198803,COMPLETE
97,0.8803996684173846,2026-08-05 04:22:50.642450,2026-08-05 04:23:59.896569,0 days 00:01:09.254119,0.42786529054754513,64,0.0072168261676709726,150,1,SUBSPACE,0.07125932896503138,COMPLETE
98,0.8768263089071067,2026-08-05 04:23:59.974849,2026-08-05 04:25:18.991614,0 days 00:01:19.016765,0.47899777418335543,73,0.00896412566994649,150,1,SUBSPACE,0.1395929553105086,COMPLETE
99,0.8757364510960547,2026-08-05 04:25:19.070593,2026-08-05 04:27:23.111895,0 days 00:02:04.041302,0.4509545939814423,109,0.004291418142006259,175,1,SUBSPACE,0.05648819816803631,COMPLETE
100,0.8821671510479161,2026-08-05 04:27:23.174626,2026-08-05 04:28:31.692441,0 days 00:01:08.517815,0.4831940003392782,50,0.005802379773769666,250,1,SUBSPACE,0.0639635513950548,COMPLETE
101,0.8771842061775674,2026-08-05 04:28:31.764480,2026-08-05 04:29:49.931157,0 days 00:01:18.166677,0.465311218726075,94,0.011621290387605182,125,1,SUBSPACE,0.17732264152350166,COMPLETE
102,0.8906695687629776,2026-08-05 04:29:49.994289,2026-08-05 04:32:15.036434,0 days 00:02:25.042145,0.4212256833541892,78,0.007639340793665527,275,1,SUBSPACE,0.3492343647219389,COMPLETE
103,0.8928225655800721,2026-08-05 04:32:15.097589,2026-08-05 04:32:56.344968,0 days 00:00:41.247379,0.45358564980235155,51,0.021054262877676262,150,1,SUBSPACE,0.04354075535127907,COMPLETE
104,0.8792783767180865,2026-08-05 04:32:56.407741,2026-08-05 04:33:22.236081,0 days 00:00:25.828340,0.40057090867066525,44,0.017583779307800907,100,1,SUBSPACE,0.14665726869725343,COMPLETE
105,0.878973468002098,2026-08-05 04:33:22.310702,2026-08-05 04:34:22.006693,0 days 00:00:59.695991,0.4744147222148223,67,0.012324654559235596,125,1,SUBSPACE,0.10627120768672547,COMPLETE
106,0.8852357721240688,2026-08-05 04:34:22.093185,2026-08-05 04:35:01.022007,0 days 00:00:38.928822,0.48662118197989285,56,0.0010873002649219906,150,1,SUBSPACE,0.21587281251273244,COMPLETE
107,0.8737309690259446,2026-08-05 04:35:01.099355,2026-08-05 04:36:08.239934,0 days 00:01:07.140579,0.49976065149472404,62,0.006510954444496935,150,1,SUBSPACE,0.09356227974678966,COMPLETE
108,0.8783259299042254,2026-08-05 04:36:08.327495,2026-08-05 04:37:08.648373,0 days 00:01:00.320878,0.4489428976638816,90,0.009233621729342924,100,1,SUBSPACE,0.04061384126223536,COMPLETE
109,0.9047602582249012,2026-08-05 04:37:08.719742,2026-08-05 04:38:46.278895,0 days 00:01:37.559153,0.4558966687948062,83,0.014134404647326619,175,1,SUBSPACE,0.02122481579462445,COMPLETE
110,0.8769787632651008,2026-08-05 04:38:46.343900,2026-08-05 04:40:21.806024,0 days 00:01:35.462124,0.4067611125498567,81,0.013656275969209118,175,1,SUBSPACE,0.021522659656816875,COMPLETE
111,0.9088210675307692,2026-08-05 04:40:21.885829,2026-08-05 04:41:50.238979,0 days 00:01:28.353150,0.4604063053461723,72,0.016606024173962376,175,1,SUBSPACE,0.2587037770090756,COMPLETE
112,0.8778391536919552,2026-08-05 04:41:50.318087,2026-08-05 04:43:14.713525,0 days 00:01:24.395438,0.4567690564851482,68,0.015241480084205802,175,1,SUBSPACE,0.26466899018084883,COMPLETE
113,0.9046881848097083,2026-08-05 04:43:14.793149,2026-08-05 04:44:52.130776,0 days 00:01:37.337627,0.4396647722901954,83,0.016904991777664604,175,1,SUBSPACE,0.01016637092217792,COMPLETE
114,0.5548961424332344,2026-08-05 04:44:52.209287,2026-08-05 04:46:19.432902,0 days 00:01:27.223615,0.436525926621459,71,0.030776034464695273,175,1,SUBSPACE,0.01292225074948552,COMPLETE
115,0.8728577805160187,2026-08-05 04:46:19.512161,2026-08-05 04:47:55.254233,0 days 00:01:35.742072,0.41866815548679026,81,0.01671072110705634,175,1,SUBSPACE,0.37747815945258184,COMPLETE
