number,value,datetime_start,datetime_complete,duration,params_contamination,params_leaf_size,params_metric,params_n_neighbors,params_p,state
150,0.8152298349288035,2026-08-03 16:55:35.708663,2026-08-03 16:55:35.771258,0 days 00:00:00.062595,0.3082538227709957,20,euclidean,6,,COMPLETE
151,0.8305615521974362,2026-08-03 16:55:35.829360,2026-08-03 16:55:35.891499,0 days 00:00:00.062139,0.16559151638552222,50,euclidean,5,,COMPLETE
152,0.8305615521974362,2026-08-03 16:55:35.954099,2026-08-03 16:55:36.016802,0 days 00:00:00.062703,0.20158801987844902,50,euclidean,5,,COMPLETE
153,0.8305615521974362,2026-08-03 16:55:36.079372,2026-08-03 16:55:36.141932,0 days 00:00:00.062560,0.1275448806702839,50,euclidean,5,,COMPLETE
154,0.8305615521974362,2026-08-03 16:55:36.211016,2026-08-03 16:55:36.266488,0 days 00:00:00.055472,0.14449339659519878,50,euclidean,5,,COMPLETE
155,0.7751822615698845,2026-08-03 16:55:36.335433,2026-08-03 16:55:36.794110,0 days 00:00:00.458677,0.17919652603415212,10,manhattan,6,,COMPLETE
156,0.8305615521974362,2026-08-03 16:55:36.869202,2026-08-03 16:55:36.937045,0 days 00:00:00.067843,0.1539679499025908,30,euclidean,5,,COMPLETE
157,0.8305615521974362,2026-08-03 16:55:37.001534,2026-08-03 16:55:37.062510,0 days 00:00:00.060976,0.21790770898840808,10,euclidean,5,,COMPLETE
158,0.8152298349288035,2026-08-03 16:55:37.125098,2026-08-03 16:55:37.192088,0 days 00:00:00.066990,0.08342482260667876,40,minkowski,6,2.0,COMPLETE
159,0.8305615521974362,2026-08-03 16:55:37.254380,2026-08-03 16:55:37.313390,0 days 00:00:00.059010,0.1939460275400872,30,euclidean,5,,COMPLETE
160,0.8152298349288035,2026-08-03 16:55:37.377892,2026-08-03 16:55:37.440878,0 days 00:00:00.062986,0.1668730879579538,10,euclidean,6,,COMPLETE
161,0.8305615521974362,2026-08-03 16:55:37.507510,2026-08-03 16:55:37.576721,0 days 00:00:00.069211,0.20249745203809366,20,euclidean,5,,COMPLETE
162,0.8305615521974362,2026-08-03 16:55:37.639553,2026-08-03 16:55:37.702616,0 days 00:00:00.063063,0.13613760190023344,20,euclidean,5,,COMPLETE
163,0.8305615521974362,2026-08-03 16:55:37.765568,2026-08-03 16:55:37.830297,0 days 00:00:00.064729,0.22991725133782714,20,euclidean,5,,COMPLETE
164,0.8305615521974362,2026-08-03 16:55:37.893711,2026-08-03 16:55:37.954424,0 days 00:00:00.060713,0.18392826134397552,20,euclidean,5,,COMPLETE
165,0.8152298349288035,2026-08-03 16:55:38.017254,2026-08-03 16:55:38.080011,0 days 00:00:00.062757,0.15063234172053663,50,euclidean,6,,COMPLETE
166,0.8305615521974362,2026-08-03 16:55:38.154302,2026-08-03 16:55:38.206256,0 days 00:00:00.051954,0.20839622618219802,20,euclidean,5,,COMPLETE
167,0.8305615521974362,2026-08-03 16:55:38.268924,2026-08-03 16:55:38.332106,0 days 00:00:00.063182,0.28599977341583566,40,euclidean,5,,COMPLETE
168,0.8152298349288035,2026-08-03 16:55:38.394661,2026-08-03 16:55:38.458400,0 days 00:00:00.063739,0.11403940042818271,10,euclidean,6,,COMPLETE
169,0.8305615521974362,2026-08-03 16:55:38.520335,2026-08-03 16:55:38.583345,0 days 00:00:00.063010,0.1959638730235337,20,euclidean,5,,COMPLETE
170,0.8124289791656066,2026-08-03 16:55:38.645902,2026-08-03 16:55:39.119338,0 days 00:00:00.473436,0.25913471270823407,30,minkowski,5,1.0,COMPLETE
171,0.8305615521974362,2026-08-03 16:55:39.172487,2026-08-03 16:55:39.235044,0 days 00:00:00.062557,0.29175423315769805,10,euclidean,5,,COMPLETE
172,0.8305615521974362,2026-08-03 16:55:39.311005,2026-08-03 16:55:39.360927,0 days 00:00:00.049922,0.3344075459983281,10,euclidean,5,,COMPLETE
173,0.8305615521974362,2026-08-03 16:55:39.423472,2026-08-03 16:55:39.486225,0 days 00:00:00.062753,0.3014307203069876,10,euclidean,5,,COMPLETE
174,0.8152298349288035,2026-08-03 16:55:39.561464,2026-08-03 16:55:39.627573,0 days 00:00:00.066109,0.17222211325856135,10,euclidean,6,,COMPLETE
175,0.8305615521974362,2026-08-03 16:55:39.686522,2026-08-03 16:55:39.749258,0 days 00:00:00.062736,0.12451356534573166,10,euclidean,5,,COMPLETE
176,0.8244652691462478,2026-08-03 16:55:39.817390,2026-08-03 16:55:39.888705,0 days 00:00:00.071315,0.26756367368489853,10,euclidean,35,,COMPLETE
177,0.8305615521974362,2026-08-03 16:55:39.966939,2026-08-03 16:55:40.041853,0 days 00:00:00.074914,0.10187497650817832,60,euclidean,5,,COMPLETE
178,0.8305615521974362,2026-08-03 16:55:40.095537,2026-08-03 16:55:40.158074,0 days 00:00:00.062537,0.2777528798580013,20,euclidean,5,,COMPLETE
179,0.7751822615698845,2026-08-03 16:55:40.235092,2026-08-03 16:55:40.692642,0 days 00:00:00.457550,0.14243776704530273,20,manhattan,6,,COMPLETE
180,0.8305615521974362,2026-08-03 16:55:40.764420,2026-08-03 16:55:40.818056,0 days 00:00:00.053636,0.15907638197009638,10,euclidean,5,,COMPLETE
181,0.8305615521974362,2026-08-03 16:55:40.889729,2026-08-03 16:55:40.958753,0 days 00:00:00.069024,0.3860720013174922,10,euclidean,5,,COMPLETE
182,0.8305615521974362,2026-08-03 16:55:41.021491,2026-08-03 16:55:41.087891,0 days 00:00:00.066400,0.3138882920143611,10,euclidean,5,,COMPLETE
183,0.8305615521974362,2026-08-03 16:55:41.148899,2026-08-03 16:55:41.211427,0 days 00:00:00.062528,0.35777887172463274,10,euclidean,5,,COMPLETE
184,0.8305615521974362,2026-08-03 16:55:41.274089,2026-08-03 16:55:41.336702,0 days 00:00:00.062613,0.4560044048094603,10,euclidean,5,,COMPLETE
185,0.8152298349288035,2026-08-03 16:55:41.399236,2026-08-03 16:55:41.461985,0 days 00:00:00.062749,0.42285999007254277,50,euclidean,6,,COMPLETE
186,0.8305615521974362,2026-08-03 16:55:41.539248,2026-08-03 16:55:41.600910,0 days 00:00:00.061662,0.22113373594375307,10,euclidean,5,,COMPLETE
187,0.8305615521974362,2026-08-03 16:55:41.664386,2026-08-03 16:55:41.726973,0 days 00:00:00.062587,0.18637937926750733,10,euclidean,5,,COMPLETE
188,0.8152298349288035,2026-08-03 16:55:41.789517,2026-08-03 16:55:41.867742,0 days 00:00:00.078225,0.13368182006379517,20,minkowski,6,2.0,COMPLETE
189,0.8305615521974362,2026-08-03 16:55:41.930634,2026-08-03 16:55:41.993816,0 days 00:00:00.063182,0.1734203273692439,30,euclidean,5,,COMPLETE
190,0.8305615521974362,2026-08-03 16:55:42.069844,2026-08-03 16:55:42.135233,0 days 00:00:00.065389,0.24807525736531694,10,euclidean,5,,COMPLETE
191,0.8305615521974362,2026-08-03 16:55:42.197866,2026-08-03 16:55:42.260610,0 days 00:00:00.062744,0.12046826357595088,10,euclidean,5,,COMPLETE
192,0.8305615521974362,2026-08-03 16:55:42.323254,2026-08-03 16:55:42.385818,0 days 00:00:00.062564,0.10408693712055654,10,euclidean,5,,COMPLETE
193,0.8305615521974362,2026-08-03 16:55:42.448474,2026-08-03 16:55:42.495983,0 days 00:00:00.047509,0.11875731411667337,10,euclidean,5,,COMPLETE
194,0.8152298349288035,2026-08-03 16:55:42.573790,2026-08-03 16:55:42.633613,0 days 00:00:00.059823,0.3442317957652937,10,euclidean,6,,COMPLETE
195,0.8305615521974362,2026-08-03 16:55:42.700513,2026-08-03 16:55:42.762834,0 days 00:00:00.062321,0.062432167305622094,10,euclidean,5,,COMPLETE
196,0.8305615521974362,2026-08-03 16:55:42.825796,2026-08-03 16:55:42.888676,0 days 00:00:00.062880,0.1441075790811865,20,euclidean,5,,COMPLETE
197,0.8152298349288035,2026-08-03 16:55:42.951306,2026-08-03 16:55:43.013842,0 days 00:00:00.062536,0.09111863099695307,40,euclidean,6,,COMPLETE
198,0.8305615521974362,2026-08-03 16:55:43.076287,2026-08-03 16:55:43.139218,0 days 00:00:00.062931,0.1302973858279636,10,euclidean,5,,COMPLETE
199,0.8305615521974362,2026-08-03 16:55:43.201830,2026-08-03 16:55:43.259995,0 days 00:00:00.058165,0.15887630661116012,10,euclidean,5,,COMPLETE
