number,value,datetime_start,datetime_complete,duration,params_epsilon,params_k,params_lr,params_n_epochs,params_proportion,params_samples,params_wd,state
0,0.8645855290734159,2026-08-04 00:46:09.228875,2026-08-04 00:47:22.888249,0 days 00:01:13.659374,0.3660515335854786,93,0.002281167485681001,250,2,MIXED,0.01476343771074142,COMPLETE
1,0.8610399388463672,2026-08-04 00:47:22.950839,2026-08-04 00:47:57.948655,0 days 00:00:34.997816,0.1353982885353253,59,0.0016943642458979154,225,1,SUBSPACE,0.027713354390133626,COMPLETE
2,0.7510996872054679,2026-08-04 00:47:58.011328,2026-08-04 00:49:16.003429,0 days 00:01:17.992101,0.24751720505560543,86,0.026356970435992628,250,2,MIXED,0.6668829342382537,COMPLETE
3,0.8555109138882226,2026-08-04 00:49:16.074207,2026-08-04 00:49:41.794735,0 days 00:00:25.720528,0.3324791783025361,23,0.008442123802485935,225,1,UNIFORM,0.008214380427751513,COMPLETE
4,0.8584320053497314,2026-08-04 00:49:41.873511,2026-08-04 00:49:55.172036,0 days 00:00:13.298525,0.16069334497735088,25,0.0027108160847900417,75,2,UNIFORM,0.4765928163155595,COMPLETE
5,0.8628555887490885,2026-08-04 00:49:55.234762,2026-08-04 00:50:44.317434,0 days 00:00:49.082672,0.08987234528249519,136,0.037377310329363846,200,1,SUBSPACE,0.1637283697057387,COMPLETE
6,0.8720328737119334,2026-08-04 00:50:44.390697,2026-08-04 00:51:32.275482,0 days 00:00:47.884785,0.07069115155698626,98,0.017000681801169464,200,1,MIXED,0.7016532513549357,COMPLETE
7,0.8570866981157217,2026-08-04 00:51:32.353935,2026-08-04 00:51:58.876677,0 days 00:00:26.522742,0.1982118667365726,24,0.00012922628152774743,150,2,MIXED,0.0004985200134952847,COMPLETE
8,0.8573738100603057,2026-08-04 00:51:58.939316,2026-08-04 00:52:29.279619,0 days 00:00:30.340303,0.14191753444830602,70,0.001876980219849124,175,1,UNIFORM,0.0011292163044994239,COMPLETE
9,0.8574870799624937,2026-08-04 00:52:29.351488,2026-08-04 00:52:38.687799,0 days 00:00:09.336311,0.48790344490591686,30,0.0031024288227061185,75,1,MIXED,0.0029471125596792465,COMPLETE
10,0.8678658133263554,2026-08-04 00:52:38.766398,2026-08-04 00:53:21.634575,0 days 00:00:42.868177,0.020857664635959623,7,0.0001470974178222028,300,2,MIXED,0.00010254881785987903,COMPLETE
11,0.8699049744264424,2026-08-04 00:53:21.697312,2026-08-04 00:54:03.332732,0 days 00:00:41.635420,0.022795211103365215,5,0.00012743244238860694,300,2,MIXED,0.00011674832354952176,COMPLETE
12,0.8778977711875289,2026-08-04 00:54:03.403152,2026-08-04 00:54:31.295304,0 days 00:00:27.892152,0.018818250299811927,5,0.00037819112453006367,300,1,MIXED,0.00010135148803833408,COMPLETE
13,0.8547374076577723,2026-08-04 00:54:31.366935,2026-08-04 00:54:41.961192,0 days 00:00:10.594257,0.07244181790320466,11,0.0005793182382424497,100,1,MIXED,0.0925856112835083,COMPLETE
14,0.8559706564323979,2026-08-04 00:54:42.032325,2026-08-04 00:54:57.237497,0 days 00:00:15.205172,0.06616392789075656,13,0.012321404170357448,150,1,MIXED,0.04927648725114828,COMPLETE
15,0.8368365230622365,2026-08-04 00:54:57.319459,2026-08-04 00:55:36.472993,0 days 00:00:39.153534,0.09033082202673717,43,0.0004764231807821211,275,1,SUBSPACE,0.0038065833001435364,COMPLETE
16,0.8515673647000104,2026-08-04 00:55:36.535728,2026-08-04 00:55:49.335557,0 days 00:00:12.799829,0.2148713953268988,14,0.09730580688096313,125,1,MIXED,0.00035766673051521345,COMPLETE
17,0.873843677843438,2026-08-04 00:55:49.405959,2026-08-04 00:56:09.642383,0 days 00:00:20.236424,0.02422056339917706,8,0.00048542045969652474,200,1,MIXED,0.0017026073963747148,COMPLETE
18,0.8659259905362089,2026-08-04 00:56:09.720955,2026-08-04 00:56:14.695776,0 days 00:00:04.974821,0.013402112576939976,5,0.0004129466512834764,50,1,UNIFORM,0.0004051836033141419,COMPLETE
19,0.8738824440131707,2026-08-04 00:56:14.758671,2026-08-04 00:56:41.382125,0 days 00:00:26.623454,0.28509515746240693,7,0.0008163605305250651,275,1,SUBSPACE,0.0014330257707686623,COMPLETE
20,0.8702793102529252,2026-08-04 00:56:41.453993,2026-08-04 00:57:08.355804,0 days 00:00:26.901811,0.491496542276628,8,0.0010497176514718842,275,1,SUBSPACE,0.00020584953266268924,COMPLETE
21,0.8700882051505702,2026-08-04 00:57:08.428218,2026-08-04 00:57:36.414507,0 days 00:00:27.986289,0.3276664361226125,8,0.0002777440005371037,275,1,SUBSPACE,0.0012389432757502472,COMPLETE
22,0.8740305428959784,2026-08-04 00:57:36.496817,2026-08-04 00:58:06.166358,0 days 00:00:29.669541,0.41196815156593797,6,0.0009022558658525323,300,1,SUBSPACE,0.0010707818612762225,COMPLETE
23,0.8757005168015003,2026-08-04 00:58:06.244985,2026-08-04 00:58:35.926585,0 days 00:00:29.681600,0.42802083772590227,5,0.0008131121425398905,300,1,SUBSPACE,0.005230302379381986,COMPLETE
24,0.8673878991401178,2026-08-04 00:58:36.000274,2026-08-04 00:59:05.034837,0 days 00:00:29.034563,0.42545904215623864,5,0.005098762851615316,300,1,SUBSPACE,0.006442246339986088,COMPLETE
25,0.8650419401498798,2026-08-04 00:59:05.106217,2026-08-04 00:59:35.854751,0 days 00:00:30.748534,0.42870349095068216,11,0.001158944471054391,300,1,SUBSPACE,0.000659614138847597,COMPLETE
26,0.8672558518744654,2026-08-04 00:59:35.933201,2026-08-04 01:00:00.834564,0 days 00:00:24.901363,0.431557516014007,6,0.0002478770250589356,250,1,SUBSPACE,0.0002454016188149843,COMPLETE
27,0.8658893443913832,2026-08-04 01:00:00.905728,2026-08-04 01:00:32.024625,0 days 00:00:31.118897,0.36702124995345026,10,0.00026370934317857366,300,1,SUBSPACE,0.003339690540778789,COMPLETE
28,0.8605059954304377,2026-08-04 01:00:32.093922,2026-08-04 01:00:58.573252,0 days 00:00:26.479330,0.3980784680788142,15,0.0008627711418832373,250,1,SUBSPACE,0.015201541910132208,COMPLETE
29,0.867107147270256,2026-08-04 01:00:58.651858,2026-08-04 01:01:39.083270,0 days 00:00:40.431412,0.4662129737404325,6,0.004147157178654805,275,2,SUBSPACE,0.01126910931779176,COMPLETE
30,0.8594287199168466,2026-08-04 01:01:39.153913,2026-08-04 01:02:05.823470,0 days 00:00:26.669557,0.3070726891586105,17,0.001503611500418764,250,1,UNIFORM,0.00018903779857874228,COMPLETE
31,0.8740190341893389,2026-08-04 01:02:05.896115,2026-08-04 01:02:33.138384,0 days 00:00:27.242269,0.26308760579832824,6,0.0007454310029047261,275,1,SUBSPACE,0.0008232797648253176,COMPLETE
32,0.8752356256254074,2026-08-04 01:02:33.201053,2026-08-04 01:03:02.632429,0 days 00:00:29.431376,0.38199902863174257,5,0.0006510879609526786,300,1,SUBSPACE,0.0007735596214944924,COMPLETE
33,0.8692232349884064,2026-08-04 01:03:02.711353,2026-08-04 01:03:31.887634,0 days 00:00:29.176281,0.38342088741683944,5,0.00032243274268914954,300,1,SUBSPACE,0.0019882813360359236,COMPLETE
34,0.8661549532261934,2026-08-04 01:03:31.950480,2026-08-04 01:03:55.119215,0 days 00:00:23.168735,0.3464088904605956,9,0.001331865211472831,225,1,SUBSPACE,0.0046764180455749794,COMPLETE
35,0.8673203612037865,2026-08-04 01:03:55.197861,2026-08-04 01:04:25.063737,0 days 00:00:29.865876,0.4640474217630818,6,0.0002065399924416979,300,1,SUBSPACE,0.023423477103394826,COMPLETE
36,0.8694534091211952,2026-08-04 01:04:25.145625,2026-08-04 01:04:47.106349,0 days 00:00:21.960724,0.40139262420459365,5,0.0006403945892632439,225,1,SUBSPACE,0.0008442964457601054,COMPLETE
37,0.8660253288461491,2026-08-04 01:04:47.179262,2026-08-04 01:05:12.969003,0 days 00:00:25.789741,0.45715425730407394,6,0.002368117366163576,275,1,UNIFORM,0.0022249760258671136,COMPLETE
38,0.8754997201567123,2026-08-04 01:05:13.051242,2026-08-04 01:05:42.253750,0 days 00:00:29.202508,0.19358126882644183,7,0.00037766244827174537,300,1,SUBSPACE,0.009110285610300046,COMPLETE
39,0.8673818419260971,2026-08-04 01:05:42.316392,2026-08-04 01:06:07.502761,0 days 00:00:25.186369,0.17752690145186129,9,0.000190632668465822,250,1,SUBSPACE,0.027192272508372715,COMPLETE
40,0.8583063181588009,2026-08-04 01:06:07.565475,2026-08-04 01:06:52.872078,0 days 00:00:45.306603,0.22407287204515747,19,0.00035517654855822756,275,2,MIXED,0.005868185527011072,COMPLETE
41,0.8758383184204726,2026-08-04 01:06:52.941456,2026-08-04 01:07:22.177127,0 days 00:00:29.235671,0.11599762764384744,7,0.001806920308081376,300,1,SUBSPACE,0.01219955320507512,COMPLETE
42,0.8749309477601636,2026-08-04 01:07:22.255398,2026-08-04 01:07:51.517326,0 days 00:00:29.261928,0.13549883568239962,7,0.001808923067680691,300,1,SUBSPACE,0.01081393830482983,COMPLETE
43,0.8682301547497039,2026-08-04 01:07:51.579914,2026-08-04 01:08:21.055200,0 days 00:00:29.475286,0.10724406012759527,7,0.0001001123528095418,300,1,SUBSPACE,0.04272394948211483,COMPLETE
44,0.8789553607555526,2026-08-04 01:08:21.135910,2026-08-04 01:08:47.824054,0 days 00:00:26.688144,0.17242426613677928,5,0.0005403611785426752,275,1,SUBSPACE,0.020516890072473405,COMPLETE
45,0.8571978479930028,2026-08-04 01:08:47.896212,2026-08-04 01:09:12.728789,0 days 00:00:24.832577,0.1145138894059399,12,0.006648236151108531,250,1,UNIFORM,0.21417224774332322,COMPLETE
46,0.8712684533025142,2026-08-04 01:09:12.798462,2026-08-04 01:09:40.512513,0 days 00:00:27.714051,0.1703825106928824,9,0.003192377760780487,275,1,MIXED,0.01978754731762798,COMPLETE
47,0.8647505881554813,2026-08-04 01:09:40.583927,2026-08-04 01:10:05.461849,0 days 00:00:24.877922,0.05315008296206839,7,0.0005275490529925677,250,1,SUBSPACE,0.05484842706584993,COMPLETE
48,0.8680672156925455,2026-08-04 01:10:05.540157,2026-08-04 01:10:27.229057,0 days 00:00:21.688900,0.19374750116515066,5,0.00017756927732207097,225,1,MIXED,0.08869707664361413,COMPLETE
49,0.8747322711402826,2026-08-04 01:10:27.302688,2026-08-04 01:10:56.189938,0 days 00:00:28.887250,0.14757970561341888,10,0.0003941008727869575,275,1,SUBSPACE,0.007764191890671994,COMPLETE
50,0.8747131909161172,2026-08-04 01:10:56.252677,2026-08-04 01:11:26.308804,0 days 00:00:30.056127,0.22808999809478614,8,0.001254817792802037,300,1,MIXED,0.9795991829370584,COMPLETE
51,0.8800756424886911,2026-08-04 01:11:26.382176,2026-08-04 01:11:55.708673,0 days 00:00:29.326497,0.2528056754107896,5,0.000625516201628097,300,1,SUBSPACE,0.01426245536004528,COMPLETE
52,0.8781476312658851,2026-08-04 01:11:55.780317,2026-08-04 01:12:22.385126,0 days 00:00:26.604809,0.2634801268454277,5,0.001794159595556716,275,1,SUBSPACE,0.035534740742993245,COMPLETE
53,0.8780967506681108,2026-08-04 01:12:22.457236,2026-08-04 01:12:49.109715,0 days 00:00:26.652479,0.25570707654090175,5,0.0018645582992693973,275,1,SUBSPACE,0.0353408041072004,COMPLETE
54,0.8712599732028852,2026-08-04 01:12:49.172411,2026-08-04 01:13:15.208784,0 days 00:00:26.036373,0.24792961216545892,6,0.002062952809829331,275,1,SUBSPACE,0.26300720687724327,COMPLETE
55,0.8794220690958517,2026-08-04 01:13:15.278418,2026-08-04 01:13:41.569340,0 days 00:00:26.290922,0.281487628829974,5,0.0027979704105483617,275,1,SUBSPACE,0.034140830995902406,COMPLETE
56,0.8782496953221348,2026-08-04 01:13:41.639750,2026-08-04 01:14:06.305072,0 days 00:00:24.665322,0.2819409891799519,5,0.003471134161366588,250,1,MIXED,0.03641053748692861,COMPLETE
57,0.8391600703605981,2026-08-04 01:14:06.387779,2026-08-04 01:15:03.405544,0 days 00:00:57.017765,0.28420656195633986,144,0.0035801321988900943,225,1,UNIFORM,0.03799562332598226,COMPLETE
58,0.8644119898917212,2026-08-04 01:15:03.468131,2026-08-04 01:15:27.223494,0 days 00:00:23.755363,0.2787358130541745,5,0.01200847216835789,250,1,SUBSPACE,0.08467407639125259,COMPLETE
59,0.8763177469102151,2026-08-04 01:15:27.301761,2026-08-04 01:15:47.178833,0 days 00:00:19.877072,0.30802829408256294,5,0.002524969937569632,200,1,MIXED,0.12715736383306708,COMPLETE
60,0.850802338569189,2026-08-04 01:15:47.241726,2026-08-04 01:16:49.194045,0 days 00:01:01.952319,0.24416762968102995,104,0.004287874762417388,250,1,SUBSPACE,0.03371088590365249,COMPLETE
61,0.8680993189268554,2026-08-04 01:16:49.256656,2026-08-04 01:17:15.835459,0 days 00:00:26.578803,0.3051877850178938,6,0.006934061027017807,275,1,MIXED,0.06675155163739457,COMPLETE
62,0.8788578396098186,2026-08-04 01:17:15.910242,2026-08-04 01:17:42.453390,0 days 00:00:26.543148,0.2527107074513154,5,0.002709159385317831,275,1,MIXED,0.0320175526235983,COMPLETE
63,0.8779107941976735,2026-08-04 01:17:42.524021,2026-08-04 01:18:09.230370,0 days 00:00:26.706349,0.2616537929838414,5,0.002787077650889048,275,1,MIXED,0.018403927927312762,COMPLETE
64,0.8542077042916574,2026-08-04 01:18:09.308858,2026-08-04 01:18:45.886542,0 days 00:00:36.577684,0.327884347000985,51,0.005636427831612411,250,1,MIXED,0.031065915164644686,COMPLETE
65,0.8784359546532728,2026-08-04 01:18:45.958733,2026-08-04 01:19:11.989646,0 days 00:00:26.030913,0.21165916513855793,6,0.01100867420519149,275,1,MIXED,0.016285334074975615,COMPLETE
66,0.8725919545660491,2026-08-04 01:19:12.052420,2026-08-04 01:19:35.829316,0 days 00:00:23.776896,0.23475481399199177,6,0.04558736785493037,250,1,MIXED,0.014116772770144883,COMPLETE
67,0.8639546702331543,2026-08-04 01:19:35.901458,2026-08-04 01:20:02.508972,0 days 00:00:26.607514,0.2735602628940627,8,0.02034642131581819,275,1,MIXED,0.055610505173305264,COMPLETE
68,0.8682298518890028,2026-08-04 01:20:02.580384,2026-08-04 01:20:26.448580,0 days 00:00:23.868196,0.20123367353714403,6,0.03224170705901367,250,1,MIXED,0.020585228565078474,COMPLETE
69,0.8604505719221479,2026-08-04 01:20:26.526941,2026-08-04 01:20:54.310685,0 days 00:00:27.783744,0.22468276900049455,29,0.009595111214935819,225,1,MIXED,0.12537566859495303,COMPLETE
70,0.8643889724784424,2026-08-04 01:20:54.381830,2026-08-04 01:21:20.387968,0 days 00:00:26.006138,0.30319068515060843,5,0.008660884861833635,275,1,MIXED,0.016051339225697826,COMPLETE
71,0.8789620236909754,2026-08-04 01:21:20.459109,2026-08-04 01:21:47.137258,0 days 00:00:26.678149,0.25579604796894445,5,0.001001464640713931,275,1,SUBSPACE,0.026101439626561817,COMPLETE
72,0.8734227014689956,2026-08-04 01:21:47.209151,2026-08-04 01:22:13.857755,0 days 00:00:26.648604,0.29426202397827733,7,0.0014775096907164718,275,1,SUBSPACE,0.0285292896713564,COMPLETE
73,0.8788832799087056,2026-08-04 01:22:13.928872,2026-08-04 01:22:40.186267,0 days 00:00:26.257395,0.21645671639570477,5,0.0010231958049377941,275,1,MIXED,0.02413969659223295,COMPLETE
74,0.8728736150180142,2026-08-04 01:22:40.257691,2026-08-04 01:23:06.403691,0 days 00:00:26.146000,0.17681217431931928,6,0.0010083292700158134,275,1,MIXED,0.06813919317797014,COMPLETE
75,0.878652802915216,2026-08-04 01:23:06.481925,2026-08-04 01:23:31.034925,0 days 00:00:24.553000,0.2106683346302541,5,0.0004646893528547569,250,1,MIXED,0.008578011525477722,COMPLETE
76,0.8729426672578509,2026-08-04 01:23:31.107555,2026-08-04 01:23:59.716005,0 days 00:00:28.608450,0.20586613419110256,6,0.0007010806566300813,300,1,MIXED,0.008291964443702397,COMPLETE
77,0.86526090843673,2026-08-04 01:23:59.794242,2026-08-04 01:24:04.861039,0 days 00:00:05.066797,0.24074627091165865,5,0.0005526357642475069,50,1,MIXED,0.021296450334193896,COMPLETE
78,0.8734284558223153,2026-08-04 01:24:04.939350,2026-08-04 01:24:31.399719,0 days 00:00:26.460369,0.2108785274355689,6,0.0009915565730220573,275,1,MIXED,0.012033431599454377,COMPLETE
79,0.8662851833276396,2026-08-04 01:24:31.462358,2026-08-04 01:25:01.141747,0 days 00:00:29.679389,0.18290715812166977,8,0.00029899510734639,200,2,UNIFORM,0.006714818579468828,COMPLETE
80,0.7984268203745297,2026-08-04 01:25:01.210398,2026-08-04 01:25:28.506632,0 days 00:00:27.296234,0.15304519739112493,7,0.08633536254578732,300,1,MIXED,0.025088077412029394,COMPLETE
81,0.8772832668251235,2026-08-04 01:25:28.584929,2026-08-04 01:25:53.223620,0 days 00:00:24.638691,0.21445478115058836,5,0.0004842356237530582,250,1,MIXED,0.04459816303253267,COMPLETE
82,0.8804057606528223,2026-08-04 01:25:53.294506,2026-08-04 01:26:18.028240,0 days 00:00:24.733734,0.2669505098422009,5,0.0008235208584427255,250,1,MIXED,0.015679472392954665,COMPLETE
83,0.8739439247354813,2026-08-04 01:26:18.106495,2026-08-04 01:26:44.677251,0 days 00:00:26.570756,0.15893476368637746,6,0.00081891157055491,275,1,MIXED,0.01531393659343938,COMPLETE
84,0.8731543668878762,2026-08-04 01:26:44.750030,2026-08-04 01:27:06.452230,0 days 00:00:21.702200,0.25102657640609993,5,0.0006020195828570997,225,1,MIXED,0.004502716479760213,COMPLETE
85,0.8733472891544372,2026-08-04 01:27:06.521629,2026-08-04 01:27:30.597939,0 days 00:00:24.076310,0.232876901643076,5,0.00042304333954820965,250,1,MIXED,0.009406284178853322,COMPLETE
86,0.8747692201458093,2026-08-04 01:27:30.671326,2026-08-04 01:27:57.078849,0 days 00:00:26.407523,0.19236745895602073,6,0.0010898906423678018,275,1,MIXED,0.01797548636375324,COMPLETE
87,0.8752341113219021,2026-08-04 01:27:57.151215,2026-08-04 01:28:25.738753,0 days 00:00:28.587538,0.21922974759772995,7,0.0013667353702584793,300,1,SUBSPACE,0.02582940913424533,COMPLETE
88,0.8786328141089474,2026-08-04 01:28:25.809391,2026-08-04 01:28:49.857110,0 days 00:00:24.047719,0.26716313570085687,5,0.0007171969025173993,250,1,MIXED,0.013035103288768658,COMPLETE
89,0.8802288900034163,2026-08-04 01:28:49.935465,2026-08-04 01:29:14.352540,0 days 00:00:24.417075,0.26950814752347885,5,0.0006919630739853725,250,1,SUBSPACE,0.0119000429634521,COMPLETE
90,0.8766090989046135,2026-08-04 01:29:14.427327,2026-08-04 01:29:36.587877,0 days 00:00:22.160550,0.31542170521073837,5,0.0009085297955447064,225,1,SUBSPACE,0.010966628867291418,COMPLETE
91,0.880058682289433,2026-08-04 01:29:36.666525,2026-08-04 01:30:01.263106,0 days 00:00:24.596581,0.26083938772542203,5,0.0007028618115617667,250,1,SUBSPACE,0.002851456181734866,COMPLETE
92,0.8693198475520376,2026-08-04 01:30:01.324340,2026-08-04 01:30:25.612528,0 days 00:00:24.288188,0.345644765155645,5,0.000432874555722022,250,1,SUBSPACE,0.004028041646934047,COMPLETE
93,0.8799357208448118,2026-08-04 01:30:25.679797,2026-08-04 01:30:50.183507,0 days 00:00:24.503710,0.25522598988914924,5,0.0006067210204990445,250,1,SUBSPACE,0.0025335162957955426,COMPLETE
94,0.868385219428635,2026-08-04 01:30:50.262031,2026-08-04 01:31:02.731902,0 days 00:00:12.469871,0.29269813715426934,7,0.0005929271436809374,125,1,SUBSPACE,0.0033429532124367224,COMPLETE
95,0.8722133786897519,2026-08-04 01:31:02.827022,2026-08-04 01:31:27.455176,0 days 00:00:24.628154,0.2538234649570975,6,0.0011961664091378649,250,1,SUBSPACE,0.0027828594318767253,COMPLETE
96,0.8793854229510262,2026-08-04 01:31:27.517805,2026-08-04 01:31:54.415043,0 days 00:00:26.897238,0.24216776048003708,5,0.000760106611772207,275,1,SUBSPACE,0.0015370127202755067,COMPLETE
97,0.8723702605328894,2026-08-04 01:31:54.484419,2026-08-04 01:32:18.655708,0 days 00:00:24.171289,0.2708970866196711,6,0.0007914131696818476,250,1,SUBSPACE,0.0024595409280128424,COMPLETE
98,0.879592276809835,2026-08-04 01:32:18.728094,2026-08-04 01:32:40.376734,0 days 00:00:21.648640,0.2394045672052712,5,0.0006936560632107938,225,1,SUBSPACE,0.0015945147130652629,COMPLETE
99,0.8678318929278391,2026-08-04 01:32:40.448735,2026-08-04 01:32:59.906299,0 days 00:00:19.457564,0.2899276315093935,7,0.0002241625252977794,200,1,SUBSPACE,0.0012372378967947966,COMPLETE
100,0.8731089377827204,2026-08-04 01:32:59.995346,2026-08-04 01:33:22.328450,0 days 00:00:22.333104,0.2365049529603394,8,0.0006647879827175876,225,1,SUBSPACE,0.0015999706895558309,COMPLETE
101,0.870151200176386,2026-08-04 01:33:22.410549,2026-08-04 01:33:39.217702,0 days 00:00:16.807153,0.2728269412536842,5,0.0005327216911117514,175,1,SUBSPACE,0.000998764334890082,COMPLETE
102,0.8698474308932453,2026-08-04 01:33:39.296093,2026-08-04 01:34:01.378816,0 days 00:00:22.082723,0.2616179776852942,5,0.0003279250340063182,225,1,SUBSPACE,0.0005534053193158993,COMPLETE
103,0.872366020483075,2026-08-04 01:34:01.441603,2026-08-04 01:34:27.712675,0 days 00:00:26.271072,0.23140228096306595,6,0.0009266245424826285,275,1,SUBSPACE,0.001597507845883075,COMPLETE
104,0.8786176710738954,2026-08-04 01:34:27.782731,2026-08-04 01:34:49.510770,0 days 00:00:21.728039,0.2817133417427547,5,0.000754134229191364,225,1,SUBSPACE,0.0018937412464670965,COMPLETE
105,0.8786515914724119,2026-08-04 01:34:49.581806,2026-08-04 01:35:14.048911,0 days 00:00:24.467105,0.24481809408949,5,0.0010991495250228765,250,1,SUBSPACE,0.00602289974385051,COMPLETE
106,0.8740817263544536,2026-08-04 01:35:14.117062,2026-08-04 01:35:40.548285,0 days 00:00:26.431223,0.3174221372830746,6,0.0014899357990069537,275,1,SUBSPACE,0.0024144657818475066,COMPLETE
107,0.8806238203575696,2026-08-04 01:35:40.620920,2026-08-04 01:36:10.246004,0 days 00:00:29.625084,0.295377799496699,5,0.0006331082413480452,300,1,SUBSPACE,0.0030921034097760947,COMPLETE
108,0.8739914738655443,2026-08-04 01:36:10.324325,2026-08-04 01:36:39.303978,0 days 00:00:28.979653,0.29240616930701674,6,0.0005157844427315317,300,1,SUBSPACE,0.0013956540475231535,COMPLETE
109,0.8805729397597953,2026-08-04 01:36:39.382184,2026-08-04 01:37:08.858492,0 days 00:00:29.476308,0.2990325794750419,5,0.0006369352404526952,300,1,SUBSPACE,0.0030086794557333137,COMPLETE
110,0.8699010372373289,2026-08-04 01:37:08.935123,2026-08-04 01:37:38.291897,0 days 00:00:29.356774,0.34697792493496454,5,0.00035406819889136315,300,1,SUBSPACE,0.0032593092887637674,COMPLETE
111,0.8794529608873577,2026-08-04 01:37:38.370321,2026-08-04 01:38:07.503773,0 days 00:00:29.133452,0.259615374543457,5,0.0008468753644736284,300,1,SUBSPACE,0.0018775813590363923,COMPLETE
112,0.8803597258262645,2026-08-04 01:38:07.571887,2026-08-04 01:38:36.952325,0 days 00:00:29.380438,0.27607173283995584,5,0.0006648100064550366,300,1,SUBSPACE,0.005117811725120119,COMPLETE
113,0.8802025411224259,2026-08-04 01:38:37.024233,2026-08-04 01:39:06.438755,0 days 00:00:29.414522,0.29924203715628434,5,0.0006356018417654801,300,1,SUBSPACE,0.00524298230981772,COMPLETE
114,0.8727570136481146,2026-08-04 01:39:06.506645,2026-08-04 01:39:35.662995,0 days 00:00:29.156350,0.31516948929338967,7,0.0006478860979343341,300,1,SUBSPACE,0.002049400221636873,COMPLETE
115,0.871966244357705,2026-08-04 01:39:35.741631,2026-08-04 01:40:05.395611,0 days 00:00:29.653980,0.30186958002306913,6,0.0008692397328119101,300,1,SUBSPACE,0.00503877670277974,COMPLETE
