number,value,datetime_start,datetime_complete,duration,params_epsilon,params_k,params_lr,params_n_epochs,params_proportion,params_samples,params_wd,state
0,0.8645855290734159,2026-08-06 01:27:22.919628,2026-08-06 01:28:40.395172,0 days 00:01:17.475544,0.3660515335854786,93,0.002281167485681001,250,2,MIXED,0.01476343771074142,COMPLETE
1,0.8610399388463672,2026-08-06 01:28:40.458321,2026-08-06 01:29:16.121329,0 days 00:00:35.663008,0.1353982885353253,59,0.0016943642458979154,225,1,SUBSPACE,0.027713354390133626,COMPLETE
2,0.7510996872054679,2026-08-06 01:29:16.174478,2026-08-06 01:30:34.172187,0 days 00:01:17.997709,0.24751720505560543,86,0.026356970435992628,250,2,MIXED,0.6668829342382537,COMPLETE
3,0.8555109138882226,2026-08-06 01:30:34.235047,2026-08-06 01:30:59.922433,0 days 00:00:25.687386,0.3324791783025361,23,0.008442123802485935,225,1,UNIFORM,0.008214380427751513,COMPLETE
4,0.8584320053497314,2026-08-06 01:31:00.001582,2026-08-06 01:31:13.736407,0 days 00:00:13.734825,0.16069334497735088,25,0.0027108160847900417,75,2,UNIFORM,0.4765928163155595,COMPLETE
5,0.8628555887490885,2026-08-06 01:31:13.815013,2026-08-06 01:32:03.258858,0 days 00:00:49.443845,0.08987234528249519,136,0.037377310329363846,200,1,SUBSPACE,0.1637283697057387,COMPLETE
6,0.8720328737119334,2026-08-06 01:32:03.337841,2026-08-06 01:32:51.710176,0 days 00:00:48.372335,0.07069115155698626,98,0.017000681801169464,200,1,MIXED,0.7016532513549357,COMPLETE
7,0.8570866981157217,2026-08-06 01:32:51.780122,2026-08-06 01:33:18.926786,0 days 00:00:27.146664,0.1982118667365726,24,0.00012922628152774743,150,2,MIXED,0.0004985200134952847,COMPLETE
8,0.8573738100603057,2026-08-06 01:33:19.002635,2026-08-06 01:33:49.875960,0 days 00:00:30.873325,0.14191753444830602,70,0.001876980219849124,175,1,UNIFORM,0.0011292163044994239,COMPLETE
9,0.8574870799624937,2026-08-06 01:33:49.944755,2026-08-06 01:33:59.507819,0 days 00:00:09.563064,0.48790344490591686,30,0.0031024288227061185,75,1,MIXED,0.0029471125596792465,COMPLETE
10,0.8678658133263554,2026-08-06 01:33:59.570953,2026-08-06 01:34:42.981535,0 days 00:00:43.410582,0.020857664635959623,7,0.0001470974178222028,300,2,MIXED,0.00010254881785987903,COMPLETE
11,0.8699049744264424,2026-08-06 01:34:43.054867,2026-08-06 01:35:25.155904,0 days 00:00:42.101037,0.022795211103365215,5,0.00012743244238860694,300,2,MIXED,0.00011674832354952176,COMPLETE
12,0.8778977711875289,2026-08-06 01:35:25.234538,2026-08-06 01:35:53.669484,0 days 00:00:28.434946,0.018818250299811927,5,0.00037819112453006367,300,1,MIXED,0.00010135148803833408,COMPLETE
13,0.8547374076577723,2026-08-06 01:35:53.732323,2026-08-06 01:36:04.517769,0 days 00:00:10.785446,0.07244181790320466,11,0.0005793182382424497,100,1,MIXED,0.0925856112835083,COMPLETE
14,0.8559706564323979,2026-08-06 01:36:04.596541,2026-08-06 01:36:20.382616,0 days 00:00:15.786075,0.06616392789075656,13,0.012321404170357448,150,1,MIXED,0.04927648725114828,COMPLETE
15,0.8368365230622365,2026-08-06 01:36:20.450571,2026-08-06 01:37:00.462513,0 days 00:00:40.011942,0.09033082202673717,43,0.0004764231807821211,275,1,SUBSPACE,0.0038065833001435364,COMPLETE
16,0.8515673647000104,2026-08-06 01:37:00.544855,2026-08-06 01:37:13.389810,0 days 00:00:12.844955,0.2148713953268988,14,0.09730580688096313,125,1,MIXED,0.00035766673051521345,COMPLETE
17,0.873843677843438,2026-08-06 01:37:13.452647,2026-08-06 01:37:33.460144,0 days 00:00:20.007497,0.02422056339917706,8,0.00048542045969652474,200,1,MIXED,0.0017026073963747148,COMPLETE
18,0.8659259905362089,2026-08-06 01:37:33.535853,2026-08-06 01:37:38.577731,0 days 00:00:05.041878,0.013402112576939976,5,0.0004129466512834764,50,1,UNIFORM,0.0004051836033141419,COMPLETE
19,0.8738824440131707,2026-08-06 01:37:38.649076,2026-08-06 01:38:06.324933,0 days 00:00:27.675857,0.28509515746240693,7,0.0008163605305250651,275,1,SUBSPACE,0.0014330257707686623,COMPLETE
20,0.8702793102529252,2026-08-06 01:38:06.397595,2026-08-06 01:38:34.086122,0 days 00:00:27.688527,0.491496542276628,8,0.0010497176514718842,275,1,SUBSPACE,0.00020584953266268924,COMPLETE
21,0.8700882051505702,2026-08-06 01:38:34.163270,2026-08-06 01:39:01.848063,0 days 00:00:27.684793,0.3276664361226125,8,0.0002777440005371037,275,1,SUBSPACE,0.0012389432757502472,COMPLETE
22,0.8740305428959784,2026-08-06 01:39:01.926843,2026-08-06 01:39:31.596523,0 days 00:00:29.669680,0.41196815156593797,6,0.0009022558658525323,300,1,SUBSPACE,0.0010707818612762225,COMPLETE
23,0.8757005168015003,2026-08-06 01:39:31.674875,2026-08-06 01:40:01.010900,0 days 00:00:29.336025,0.42802083772590227,5,0.0008131121425398905,300,1,SUBSPACE,0.005230302379381986,COMPLETE
24,0.8673878991401178,2026-08-06 01:40:01.085949,2026-08-06 01:40:29.943330,0 days 00:00:28.857381,0.42545904215623864,5,0.005098762851615316,300,1,SUBSPACE,0.006442246339986088,COMPLETE
25,0.8650419401498798,2026-08-06 01:40:30.015975,2026-08-06 01:41:01.243827,0 days 00:00:31.227852,0.42870349095068216,11,0.001158944471054391,300,1,SUBSPACE,0.000659614138847597,COMPLETE
26,0.8672558518744654,2026-08-06 01:41:01.325074,2026-08-06 01:41:26.084929,0 days 00:00:24.759855,0.431557516014007,6,0.0002478770250589356,250,1,SUBSPACE,0.0002454016188149843,COMPLETE
27,0.8658893443913832,2026-08-06 01:41:26.159319,2026-08-06 01:41:57.525476,0 days 00:00:31.366157,0.36702124995345026,10,0.00026370934317857366,300,1,SUBSPACE,0.003339690540778789,COMPLETE
28,0.8605059954304377,2026-08-06 01:41:57.608006,2026-08-06 01:42:24.931832,0 days 00:00:27.323826,0.3980784680788142,15,0.0008627711418832373,250,1,SUBSPACE,0.015201541910132208,COMPLETE
29,0.867107147270256,2026-08-06 01:42:24.995014,2026-08-06 01:43:05.806324,0 days 00:00:40.811310,0.4662129737404325,6,0.004147157178654805,275,2,SUBSPACE,0.01126910931779176,COMPLETE
30,0.8594287199168466,2026-08-06 01:43:05.884983,2026-08-06 01:43:32.825968,0 days 00:00:26.940985,0.3070726891586105,17,0.001503611500418764,250,1,UNIFORM,0.00018903779857874228,COMPLETE
31,0.8740190341893389,2026-08-06 01:43:32.896027,2026-08-06 01:43:59.983915,0 days 00:00:27.087888,0.26308760579832824,6,0.0007454310029047261,275,1,SUBSPACE,0.0008232797648253176,COMPLETE
32,0.8752356256254074,2026-08-06 01:44:00.063962,2026-08-06 01:44:29.172079,0 days 00:00:29.108117,0.38199902863174257,5,0.0006510879609526786,300,1,SUBSPACE,0.0007735596214944924,COMPLETE
33,0.8692232349884064,2026-08-06 01:44:29.240658,2026-08-06 01:44:58.204039,0 days 00:00:28.963381,0.38342088741683944,5,0.00032243274268914954,300,1,SUBSPACE,0.0019882813360359236,COMPLETE
34,0.8661549532261934,2026-08-06 01:44:58.268093,2026-08-06 01:45:21.626483,0 days 00:00:23.358390,0.3464088904605956,9,0.001331865211472831,225,1,SUBSPACE,0.0046764180455749794,COMPLETE
35,0.8673203612037865,2026-08-06 01:45:21.705261,2026-08-06 01:45:51.228392,0 days 00:00:29.523131,0.4640474217630818,6,0.0002065399924416979,300,1,SUBSPACE,0.023423477103394826,COMPLETE
36,0.8694534091211952,2026-08-06 01:45:51.291869,2026-08-06 01:46:13.068527,0 days 00:00:21.776658,0.40139262420459365,5,0.0006403945892632439,225,1,SUBSPACE,0.0008442964457601054,COMPLETE
37,0.8660253288461491,2026-08-06 01:46:13.144176,2026-08-06 01:46:39.494424,0 days 00:00:26.350248,0.45715425730407394,6,0.002368117366163576,275,1,UNIFORM,0.0022249760258671136,COMPLETE
38,0.8754997201567123,2026-08-06 01:46:39.565020,2026-08-06 01:47:09.541835,0 days 00:00:29.976815,0.19358126882644183,7,0.00037766244827174537,300,1,SUBSPACE,0.009110285610300046,COMPLETE
39,0.8673818419260971,2026-08-06 01:47:09.598808,2026-08-06 01:47:35.306701,0 days 00:00:25.707893,0.17752690145186129,9,0.000190632668465822,250,1,SUBSPACE,0.027192272508372715,COMPLETE
40,0.8583063181588009,2026-08-06 01:47:35.385056,2026-08-06 01:48:21.186773,0 days 00:00:45.801717,0.22407287204515747,19,0.00035517654855822756,275,2,MIXED,0.005868185527011072,COMPLETE
41,0.8758383184204726,2026-08-06 01:48:21.249805,2026-08-06 01:48:50.632485,0 days 00:00:29.382680,0.11599762764384744,7,0.001806920308081376,300,1,SUBSPACE,0.01219955320507512,COMPLETE
42,0.8749309477601636,2026-08-06 01:48:50.695257,2026-08-06 01:49:20.083489,0 days 00:00:29.388232,0.13549883568239962,7,0.001808923067680691,300,1,SUBSPACE,0.01081393830482983,COMPLETE
43,0.8682301547497039,2026-08-06 01:49:20.146179,2026-08-06 01:49:49.631149,0 days 00:00:29.484970,0.10724406012759527,7,0.0001001123528095418,300,1,SUBSPACE,0.04272394948211483,COMPLETE
44,0.8789553607555526,2026-08-06 01:49:49.702828,2026-08-06 01:50:16.005894,0 days 00:00:26.303066,0.17242426613677928,5,0.0005403611785426752,275,1,SUBSPACE,0.020516890072473405,COMPLETE
45,0.8571978479930028,2026-08-06 01:50:16.077289,2026-08-06 01:50:41.416462,0 days 00:00:25.339173,0.1145138894059399,12,0.006648236151108531,250,1,UNIFORM,0.21417224774332322,COMPLETE
46,0.8712684533025142,2026-08-06 01:50:41.479495,2026-08-06 01:51:08.938383,0 days 00:00:27.458888,0.1703825106928824,9,0.003192377760780487,275,1,MIXED,0.01978754731762798,COMPLETE
47,0.8647505881554813,2026-08-06 01:51:09.017151,2026-08-06 01:51:34.030404,0 days 00:00:25.013253,0.05315008296206839,7,0.0005275490529925677,250,1,SUBSPACE,0.05484842706584993,COMPLETE
48,0.8680672156925455,2026-08-06 01:51:34.109049,2026-08-06 01:51:55.611257,0 days 00:00:21.502208,0.19374750116515066,5,0.00017756927732207097,225,1,MIXED,0.08869707664361413,COMPLETE
49,0.8747322711402826,2026-08-06 01:51:55.683886,2026-08-06 01:52:24.487082,0 days 00:00:28.803196,0.14757970561341888,10,0.0003941008727869575,275,1,SUBSPACE,0.007764191890671994,COMPLETE
50,0.8747131909161172,2026-08-06 01:52:24.565856,2026-08-06 01:52:54.190399,0 days 00:00:29.624543,0.22808999809478614,8,0.001254817792802037,300,1,MIXED,0.9795991829370584,COMPLETE
51,0.8800756424886911,2026-08-06 01:52:54.253222,2026-08-06 01:53:23.485174,0 days 00:00:29.231952,0.2528056754107896,5,0.000625516201628097,300,1,SUBSPACE,0.01426245536004528,COMPLETE
52,0.8781476312658851,2026-08-06 01:53:23.548219,2026-08-06 01:53:49.803787,0 days 00:00:26.255568,0.2634801268454277,5,0.001794159595556716,275,1,SUBSPACE,0.035534740742993245,COMPLETE
53,0.8780967506681108,2026-08-06 01:53:49.882122,2026-08-06 01:54:16.364828,0 days 00:00:26.482706,0.25570707654090175,5,0.0018645582992693973,275,1,SUBSPACE,0.0353408041072004,COMPLETE
54,0.8712599732028852,2026-08-06 01:54:16.429463,2026-08-06 01:54:43.292160,0 days 00:00:26.862697,0.24792961216545892,6,0.002062952809829331,275,1,SUBSPACE,0.26300720687724327,COMPLETE
55,0.8794220690958517,2026-08-06 01:54:43.370949,2026-08-06 01:55:10.034220,0 days 00:00:26.663271,0.281487628829974,5,0.0027979704105483617,275,1,SUBSPACE,0.034140830995902406,COMPLETE
56,0.8782496953221348,2026-08-06 01:55:10.097352,2026-08-06 01:55:34.648463,0 days 00:00:24.551111,0.2819409891799519,5,0.003471134161366588,250,1,MIXED,0.03641053748692861,COMPLETE
57,0.8391600703605981,2026-08-06 01:55:34.722592,2026-08-06 01:56:32.824401,0 days 00:00:58.101809,0.28420656195633986,144,0.0035801321988900943,225,1,UNIFORM,0.03799562332598226,COMPLETE
58,0.8644119898917212,2026-08-06 01:56:32.887191,2026-08-06 01:56:56.281002,0 days 00:00:23.393811,0.2787358130541745,5,0.01200847216835789,250,1,SUBSPACE,0.08467407639125259,COMPLETE
59,0.8763177469102151,2026-08-06 01:56:56.353141,2026-08-06 01:57:16.235329,0 days 00:00:19.882188,0.30802829408256294,5,0.002524969937569632,200,1,MIXED,0.12715736383306708,COMPLETE
60,0.850802338569189,2026-08-06 01:57:16.320568,2026-08-06 01:58:18.624397,0 days 00:01:02.303829,0.24416762968102995,104,0.004287874762417388,250,1,SUBSPACE,0.03371088590365249,COMPLETE
61,0.8680993189268554,2026-08-06 01:58:18.694996,2026-08-06 01:58:45.181345,0 days 00:00:26.486349,0.3051877850178938,6,0.006934061027017807,275,1,MIXED,0.06675155163739457,COMPLETE
62,0.8788578396098186,2026-08-06 01:58:45.243382,2026-08-06 01:59:11.633633,0 days 00:00:26.390251,0.2527107074513154,5,0.002709159385317831,275,1,MIXED,0.0320175526235983,COMPLETE
63,0.8779107941976735,2026-08-06 01:59:11.711576,2026-08-06 01:59:37.983100,0 days 00:00:26.271524,0.2616537929838414,5,0.002787077650889048,275,1,MIXED,0.018403927927312762,COMPLETE
64,0.8542077042916574,2026-08-06 01:59:38.046106,2026-08-06 02:00:15.223155,0 days 00:00:37.177049,0.327884347000985,51,0.005636427831612411,250,1,MIXED,0.031065915164644686,COMPLETE
65,0.8784359546532728,2026-08-06 02:00:15.292368,2026-08-06 02:00:41.157138,0 days 00:00:25.864770,0.21165916513855793,6,0.01100867420519149,275,1,MIXED,0.016285334074975615,COMPLETE
66,0.8725919545660491,2026-08-06 02:00:41.235872,2026-08-06 02:01:04.685470,0 days 00:00:23.449598,0.23475481399199177,6,0.04558736785493037,250,1,MIXED,0.014116772770144883,COMPLETE
67,0.8639546702331543,2026-08-06 02:01:04.764151,2026-08-06 02:01:31.391215,0 days 00:00:26.627064,0.2735602628940627,8,0.02034642131581819,275,1,MIXED,0.055610505173305264,COMPLETE
68,0.8682298518890028,2026-08-06 02:01:31.453870,2026-08-06 02:01:55.170674,0 days 00:00:23.716804,0.20123367353714403,6,0.03224170705901367,250,1,MIXED,0.020585228565078474,COMPLETE
69,0.8604505719221479,2026-08-06 02:01:55.246669,2026-08-06 02:02:23.607264,0 days 00:00:28.360595,0.22468276900049455,29,0.009595111214935819,225,1,MIXED,0.12537566859495303,COMPLETE
70,0.8643889724784424,2026-08-06 02:02:23.678967,2026-08-06 02:02:49.451150,0 days 00:00:25.772183,0.30319068515060843,5,0.008660884861833635,275,1,MIXED,0.016051339225697826,COMPLETE
71,0.8789620236909754,2026-08-06 02:02:49.526666,2026-08-06 02:03:15.936853,0 days 00:00:26.410187,0.25579604796894445,5,0.001001464640713931,275,1,SUBSPACE,0.026101439626561817,COMPLETE
72,0.8734227014689956,2026-08-06 02:03:16.004054,2026-08-06 02:03:43.489703,0 days 00:00:27.485649,0.29426202397827733,7,0.0014775096907164718,275,1,SUBSPACE,0.0285292896713564,COMPLETE
73,0.8788832799087056,2026-08-06 02:03:43.550875,2026-08-06 02:04:10.298853,0 days 00:00:26.747978,0.21645671639570477,5,0.0010231958049377941,275,1,MIXED,0.02413969659223295,COMPLETE
74,0.8728736150180142,2026-08-06 02:04:10.369275,2026-08-06 02:04:37.156163,0 days 00:00:26.786888,0.17681217431931928,6,0.0010083292700158134,275,1,MIXED,0.06813919317797014,COMPLETE
75,0.878652802915216,2026-08-06 02:04:37.234695,2026-08-06 02:05:01.824753,0 days 00:00:24.590058,0.2106683346302541,5,0.0004646893528547569,250,1,MIXED,0.008578011525477722,COMPLETE
76,0.8729426672578509,2026-08-06 02:05:01.897544,2026-08-06 02:05:31.366634,0 days 00:00:29.469090,0.20586613419110256,6,0.0007010806566300813,300,1,MIXED,0.008291964443702397,COMPLETE
77,0.86526090843673,2026-08-06 02:05:31.436531,2026-08-06 02:05:36.428195,0 days 00:00:04.991664,0.24074627091165865,5,0.0005526357642475069,50,1,MIXED,0.021296450334193896,COMPLETE
78,0.8734284558223153,2026-08-06 02:05:36.503759,2026-08-06 02:06:03.746859,0 days 00:00:27.243100,0.2108785274355689,6,0.0009915565730220573,275,1,MIXED,0.012033431599454377,COMPLETE
79,0.8662851833276396,2026-08-06 02:06:03.827107,2026-08-06 02:06:34.066439,0 days 00:00:30.239332,0.18290715812166977,8,0.00029899510734639,200,2,UNIFORM,0.006714818579468828,COMPLETE
80,0.7984268203745297,2026-08-06 02:06:34.141101,2026-08-06 02:07:02.036092,0 days 00:00:27.894991,0.15304519739112493,7,0.08633536254578732,300,1,MIXED,0.025088077412029394,COMPLETE
81,0.8772832668251235,2026-08-06 02:07:02.108668,2026-08-06 02:07:26.531206,0 days 00:00:24.422538,0.21445478115058836,5,0.0004842356237530582,250,1,MIXED,0.04459816303253267,COMPLETE
82,0.8804057606528223,2026-08-06 02:07:26.602356,2026-08-06 02:07:50.911991,0 days 00:00:24.309635,0.2669505098422009,5,0.0008235208584427255,250,1,MIXED,0.015679472392954665,COMPLETE
83,0.8739439247354813,2026-08-06 02:07:50.974907,2026-08-06 02:08:18.239584,0 days 00:00:27.264677,0.15893476368637746,6,0.00081891157055491,275,1,MIXED,0.01531393659343938,COMPLETE
84,0.8731543668878762,2026-08-06 02:08:18.318163,2026-08-06 02:08:40.463697,0 days 00:00:22.145534,0.25102657640609993,5,0.0006020195828570997,225,1,MIXED,0.004502716479760213,COMPLETE
85,0.8733472891544372,2026-08-06 02:08:40.526877,2026-08-06 02:09:04.974421,0 days 00:00:24.447544,0.232876901643076,5,0.00042304333954820965,250,1,MIXED,0.009406284178853322,COMPLETE
86,0.8747692201458093,2026-08-06 02:09:05.044834,2026-08-06 02:09:32.027759,0 days 00:00:26.982925,0.19236745895602073,6,0.0010898906423678018,275,1,MIXED,0.01797548636375324,COMPLETE
87,0.8752341113219021,2026-08-06 02:09:32.106148,2026-08-06 02:10:01.582006,0 days 00:00:29.475858,0.21922974759772995,7,0.0013667353702584793,300,1,SUBSPACE,0.02582940913424533,COMPLETE
88,0.8786328141089474,2026-08-06 02:10:01.656367,2026-08-06 02:10:26.241809,0 days 00:00:24.585442,0.26716313570085687,5,0.0007171969025173993,250,1,MIXED,0.013035103288768658,COMPLETE
89,0.8802288900034163,2026-08-06 02:10:26.319491,2026-08-06 02:10:50.679158,0 days 00:00:24.359667,0.26950814752347885,5,0.0006919630739853725,250,1,SUBSPACE,0.0119000429634521,COMPLETE
90,0.8766090989046135,2026-08-06 02:10:50.753441,2026-08-06 02:11:13.105187,0 days 00:00:22.351746,0.31542170521073837,5,0.0009085297955447064,225,1,SUBSPACE,0.010966628867291418,COMPLETE
91,0.880058682289433,2026-08-06 02:11:13.180751,2026-08-06 02:11:37.608177,0 days 00:00:24.427426,0.26083938772542203,5,0.0007028618115617667,250,1,SUBSPACE,0.002851456181734866,COMPLETE
92,0.8693198475520376,2026-08-06 02:11:37.677909,2026-08-06 02:12:02.108281,0 days 00:00:24.430372,0.345644765155645,5,0.000432874555722022,250,1,SUBSPACE,0.004028041646934047,COMPLETE
93,0.8799357208448118,2026-08-06 02:12:02.173221,2026-08-06 02:12:26.646424,0 days 00:00:24.473203,0.25522598988914924,5,0.0006067210204990445,250,1,SUBSPACE,0.0025335162957955426,COMPLETE
94,0.868385219428635,2026-08-06 02:12:26.725326,2026-08-06 02:12:39.565110,0 days 00:00:12.839784,0.29269813715426934,7,0.0005929271436809374,125,1,SUBSPACE,0.0033429532124367224,COMPLETE
95,0.8722133786897519,2026-08-06 02:12:39.643868,2026-08-06 02:13:04.239544,0 days 00:00:24.595676,0.2538234649570975,6,0.0011961664091378649,250,1,SUBSPACE,0.0027828594318767253,COMPLETE
96,0.8793854229510262,2026-08-06 02:13:04.313449,2026-08-06 02:13:30.888029,0 days 00:00:26.574580,0.24216776048003708,5,0.000760106611772207,275,1,SUBSPACE,0.0015370127202755067,COMPLETE
97,0.8723702605328894,2026-08-06 02:13:30.966815,2026-08-06 02:13:55.841114,0 days 00:00:24.874299,0.2708970866196711,6,0.0007914131696818476,250,1,SUBSPACE,0.0024595409280128424,COMPLETE
98,0.879592276809835,2026-08-06 02:13:55.912231,2026-08-06 02:14:18.023453,0 days 00:00:22.111222,0.2394045672052712,5,0.0006936560632107938,225,1,SUBSPACE,0.0015945147130652629,COMPLETE
99,0.8678318929278391,2026-08-06 02:14:18.099752,2026-08-06 02:14:38.122078,0 days 00:00:20.022326,0.2899276315093935,7,0.0002241625252977794,200,1,SUBSPACE,0.0012372378967947966,COMPLETE
100,0.8731089377827204,2026-08-06 02:14:38.199865,2026-08-06 02:15:01.041175,0 days 00:00:22.841310,0.2365049529603394,8,0.0006647879827175876,225,1,SUBSPACE,0.0015999706895558309,COMPLETE
101,0.870151200176386,2026-08-06 02:15:01.119749,2026-08-06 02:15:18.335537,0 days 00:00:17.215788,0.2728269412536842,5,0.0005327216911117514,175,1,SUBSPACE,0.000998764334890082,COMPLETE
102,0.8698474308932453,2026-08-06 02:15:18.407058,2026-08-06 02:15:40.382426,0 days 00:00:21.975368,0.2616179776852942,5,0.0003279250340063182,225,1,SUBSPACE,0.0005534053193158993,COMPLETE
103,0.872366020483075,2026-08-06 02:15:40.476534,2026-08-06 02:16:07.553809,0 days 00:00:27.077275,0.23140228096306595,6,0.0009266245424826285,275,1,SUBSPACE,0.001597507845883075,COMPLETE
104,0.8786176710738954,2026-08-06 02:16:07.623704,2026-08-06 02:16:29.727294,0 days 00:00:22.103590,0.2817133417427547,5,0.000754134229191364,225,1,SUBSPACE,0.0018937412464670965,COMPLETE
105,0.8786515914724119,2026-08-06 02:16:29.799921,2026-08-06 02:16:54.107418,0 days 00:00:24.307497,0.24481809408949,5,0.0010991495250228765,250,1,SUBSPACE,0.00602289974385051,COMPLETE
106,0.8740817263544536,2026-08-06 02:16:54.186232,2026-08-06 02:17:21.409470,0 days 00:00:27.223238,0.3174221372830746,6,0.0014899357990069537,275,1,SUBSPACE,0.0024144657818475066,COMPLETE
107,0.8806238203575696,2026-08-06 02:17:21.472282,2026-08-06 02:17:50.925824,0 days 00:00:29.453542,0.295377799496699,5,0.0006331082413480452,300,1,SUBSPACE,0.0030921034097760947,COMPLETE
108,0.8739914738655443,2026-08-06 02:17:51.008212,2026-08-06 02:18:20.856255,0 days 00:00:29.848043,0.29240616930701674,6,0.0005157844427315317,300,1,SUBSPACE,0.0013956540475231535,COMPLETE
109,0.8805729397597953,2026-08-06 02:18:20.940064,2026-08-06 02:18:50.334786,0 days 00:00:29.394722,0.2990325794750419,5,0.0006369352404526952,300,1,SUBSPACE,0.0030086794557333137,COMPLETE
110,0.8699010372373289,2026-08-06 02:18:50.413668,2026-08-06 02:19:19.836396,0 days 00:00:29.422728,0.34697792493496454,5,0.00035406819889136315,300,1,SUBSPACE,0.0032593092887637674,COMPLETE
111,0.8794529608873577,2026-08-06 02:19:19.912130,2026-08-06 02:19:48.976124,0 days 00:00:29.063994,0.259615374543457,5,0.0008468753644736284,300,1,SUBSPACE,0.0018775813590363923,COMPLETE
112,0.8803597258262645,2026-08-06 02:19:49.054672,2026-08-06 02:20:18.168057,0 days 00:00:29.113385,0.27607173283995584,5,0.0006648100064550366,300,1,SUBSPACE,0.005117811725120119,COMPLETE
113,0.8802025411224259,2026-08-06 02:20:18.240379,2026-08-06 02:20:47.283668,0 days 00:00:29.043289,0.29924203715628434,5,0.0006356018417654801,300,1,SUBSPACE,0.00524298230981772,COMPLETE
114,0.8727570136481146,2026-08-06 02:20:47.362185,2026-08-06 02:21:17.816292,0 days 00:00:30.454107,0.31516948929338967,7,0.0006478860979343341,300,1,SUBSPACE,0.002049400221636873,COMPLETE
115,0.871966244357705,2026-08-06 02:21:17.910880,2026-08-06 02:21:47.658198,0 days 00:00:29.747318,0.30186958002306913,6,0.0008692397328119101,300,1,SUBSPACE,0.00503877670277974,COMPLETE
