number,value,datetime_start,datetime_complete,duration,params_epsilon,params_k,params_lr,params_n_epochs,params_proportion,params_samples,params_wd,state
0,0.8811509383464695,2026-08-03 18:59:13.357805,2026-08-03 19:03:02.306428,0 days 00:03:48.948623,0.3660515335854786,93,0.002281167485681001,250,2,MIXED,0.01476343771074142,COMPLETE
1,0.8880203655671391,2026-08-03 19:03:02.384823,2026-08-03 19:04:01.784915,0 days 00:00:59.400092,0.1353982885353253,59,0.0016943642458979154,225,1,SUBSPACE,0.027713354390133626,COMPLETE
2,0.8144295916827727,2026-08-03 19:04:01.873822,2026-08-03 19:07:29.322158,0 days 00:03:27.448336,0.24751720505560543,86,0.026356970435992628,250,2,MIXED,0.6668829342382537,COMPLETE
3,0.883427425438817,2026-08-03 19:07:29.390255,2026-08-03 19:08:04.384939,0 days 00:00:34.994684,0.3324791783025361,23,0.008442123802485935,225,1,UNIFORM,0.008214380427751513,COMPLETE
4,0.8884070023925678,2026-08-03 19:08:04.452197,2026-08-03 19:08:25.556803,0 days 00:00:21.104606,0.16069334497735088,25,0.0027108160847900417,75,2,UNIFORM,0.4765928163155595,COMPLETE
5,0.8800125825364096,2026-08-03 19:08:25.624205,2026-08-03 19:11:18.343382,0 days 00:02:52.719177,0.08987234528249519,136,0.037377310329363846,200,1,SUBSPACE,0.1637283697057387,COMPLETE
6,0.8911047035874149,2026-08-03 19:11:18.408458,2026-08-03 19:13:28.951605,0 days 00:02:10.543147,0.07069115155698626,98,0.017000681801169464,200,1,MIXED,0.7016532513549357,COMPLETE
7,0.8869179342007888,2026-08-03 19:13:29.029777,2026-08-03 19:14:09.548155,0 days 00:00:40.518378,0.1982118667365726,24,0.00012922628152774743,150,2,MIXED,0.0004985200134952847,COMPLETE
8,0.8836391551289328,2026-08-03 19:14:09.607874,2026-08-03 19:15:35.877702,0 days 00:01:26.269828,0.14191753444830602,70,0.001876980219849124,175,1,UNIFORM,0.0011292163044994239,COMPLETE
9,0.8866231292345936,2026-08-03 19:15:35.952925,2026-08-03 19:15:49.725191,0 days 00:00:13.772266,0.48790344490591686,30,0.0031024288227061185,75,1,MIXED,0.0029471125596792465,COMPLETE
10,0.888494568224111,2026-08-03 19:15:49.787098,2026-08-03 19:16:38.598508,0 days 00:00:48.811410,0.020857664635959623,7,0.0001470974178222028,300,2,MIXED,0.00010254881785987903,COMPLETE
11,0.8890188405745036,2026-08-03 19:16:38.677179,2026-08-03 19:17:24.260935,0 days 00:00:45.583756,0.022795211103365215,5,0.00012743244238860694,300,2,MIXED,0.00011674832354952176,COMPLETE
12,0.8891434534886227,2026-08-03 19:17:24.323627,2026-08-03 19:17:55.376006,0 days 00:00:31.052379,0.018818250299811927,5,0.00037819112453006367,300,1,MIXED,0.00010135148803833408,COMPLETE
13,0.8874303065792026,2026-08-03 19:17:55.454382,2026-08-03 19:18:08.065374,0 days 00:00:12.610992,0.07244181790320466,11,0.0005793182382424497,100,1,MIXED,0.0925856112835083,COMPLETE
14,0.8867190025937448,2026-08-03 19:18:08.147213,2026-08-03 19:18:26.882863,0 days 00:00:18.735650,0.06616392789075656,13,0.012321404170357448,150,1,MIXED,0.04927648725114828,COMPLETE
15,0.8881077068709091,2026-08-03 19:18:26.945636,2026-08-03 19:19:36.019952,0 days 00:01:09.074316,0.09033082202673717,43,0.0004764231807821211,275,1,SUBSPACE,0.0038065833001435364,COMPLETE
16,0.8920232467075248,2026-08-03 19:19:36.120341,2026-08-03 19:19:51.887752,0 days 00:00:15.767411,0.2148713953268988,14,0.09730580688096313,125,1,MIXED,0.00035766673051521345,COMPLETE
17,0.8818319310825471,2026-08-03 19:19:51.945723,2026-08-03 19:20:07.792858,0 days 00:00:15.847135,0.25681334916292375,14,0.09659450568688238,125,1,MIXED,0.00042672976013364227,COMPLETE
18,0.7057042627944906,2026-08-03 19:20:07.874279,2026-08-03 19:20:51.974827,0 days 00:00:44.100548,0.33229150372463867,138,0.09393610349746763,50,1,UNIFORM,0.18860719731193873,COMPLETE
19,0.8739418006049677,2026-08-03 19:20:52.037509,2026-08-03 19:21:11.074008,0 days 00:00:19.036499,0.22736411333875053,8,0.03918109514985063,175,1,SUBSPACE,0.0020986754212625925,COMPLETE
20,0.8951360997549952,2026-08-03 19:21:11.136602,2026-08-03 19:21:43.059180,0 days 00:00:31.922578,0.4723278963892103,45,0.011446494410654779,125,1,MIXED,0.00039735001748631045,COMPLETE
21,0.8812461381223011,2026-08-03 19:21:43.126547,2026-08-03 19:22:14.725182,0 days 00:00:31.598635,0.49085821528025575,43,0.009945935534127384,125,1,MIXED,0.0003366151112641226,COMPLETE
22,0.8855375374512326,2026-08-03 19:22:14.788127,2026-08-03 19:22:43.751357,0 days 00:00:28.963230,0.41196815156593797,38,0.01644049936852422,125,1,MIXED,0.0010707818612762225,COMPLETE
23,0.8854908356744096,2026-08-03 19:22:43.814025,2026-08-03 19:23:07.979200,0 days 00:00:24.165175,0.42802083772590227,18,0.00485602929571509,175,1,MIXED,0.0002274912707806601,COMPLETE
24,0.5,2026-08-03 19:23:08.046626,2026-08-03 19:24:11.818485,0 days 00:01:03.771859,0.3196396876999559,60,0.05711072728617728,150,1,MIXED,0.006442246339986088,COMPLETE
25,0.897827514172193,2026-08-03 19:24:11.881546,2026-08-03 19:25:10.750886,0 days 00:00:58.869340,0.1857537893695545,89,0.020254048314594285,100,1,MIXED,0.0011532698732502457,COMPLETE
26,0.8887974561901408,2026-08-03 19:25:10.829469,2026-08-03 19:25:30.065042,0 days 00:00:19.235573,0.19650994390553234,33,0.005212851438115401,100,1,MIXED,0.000973148907518441,COMPLETE
27,0.866657670587221,2026-08-03 19:25:30.140967,2026-08-03 19:25:55.363670,0 days 00:00:25.222703,0.29440144340120566,58,0.022514225633122963,100,1,MIXED,0.0007190650470210085,COMPLETE
28,0.8531976796401808,2026-08-03 19:25:55.414377,2026-08-03 19:26:02.508100,0 days 00:00:07.093723,0.4401480101016593,17,0.05211376631100911,50,1,UNIFORM,0.00019394754702828113,COMPLETE
29,0.8697069822748795,2026-08-03 19:26:02.570695,2026-08-03 19:27:17.582967,0 days 00:01:15.012272,0.39169757101158686,103,0.006316397612307214,75,2,SUBSPACE,0.0013554498154597502,COMPLETE
30,0.6412973484168097,2026-08-03 19:27:17.653479,2026-08-03 19:28:25.619775,0 days 00:01:07.966296,0.2735572925020873,80,0.06110864645379587,125,1,MIXED,0.00022944537862142338,COMPLETE
31,0.8866651159281799,2026-08-03 19:28:25.686420,2026-08-03 19:29:36.756050,0 days 00:01:11.069630,0.19085530946267543,108,0.017565813176441295,100,1,MIXED,0.009162678661943665,COMPLETE
32,0.9015257111243633,2026-08-03 19:29:36.834927,2026-08-03 19:31:58.007457,0 days 00:02:21.172530,0.11713050515334827,107,0.02885170365318346,200,1,MIXED,0.030167250382175145,COMPLETE
33,0.8797808698744799,2026-08-03 19:31:58.085584,2026-08-03 19:33:35.629976,0 days 00:01:37.544392,0.12101588940657104,60,0.028313143434173745,225,1,MIXED,0.02463359775473354,COMPLETE
34,0.8767856693801597,2026-08-03 19:33:35.692865,2026-08-03 19:37:31.229375,0 days 00:03:55.536510,0.17001605070234344,150,0.034854725094914926,250,1,MIXED,0.0019760517454127935,COMPLETE
35,0.8808285164641726,2026-08-03 19:37:31.308034,2026-08-03 19:39:24.072284,0 days 00:01:52.764250,0.22362576291525532,116,0.011951816449993024,150,1,MIXED,0.004302846066549462,COMPLETE
36,0.6720962721204762,2026-08-03 19:39:24.138541,2026-08-03 19:41:12.153679,0 days 00:01:48.015138,0.36515888517405903,80,0.06879932678948864,200,1,SUBSPACE,0.017012667303491345,COMPLETE
37,0.8660415663775947,2026-08-03 19:41:12.226706,2026-08-03 19:41:33.094655,0 days 00:00:20.867949,0.11561184710363148,50,0.025630023830932283,75,1,UNIFORM,0.0006114498324109044,COMPLETE
38,0.9036939758300342,2026-08-03 19:41:33.158746,2026-08-03 19:43:45.595708,0 days 00:02:12.436962,0.15488508267718026,88,0.008604534511306569,225,1,MIXED,0.31032858233385535,COMPLETE
39,0.8894330943160346,2026-08-03 19:43:45.674177,2026-08-03 19:45:36.898927,0 days 00:01:51.224750,0.16351356498725544,70,0.00788735882397539,225,1,MIXED,0.36495827810061104,COMPLETE
40,0.8811841684569015,2026-08-03 19:45:36.961370,2026-08-03 19:49:13.493300,0 days 00:03:36.531930,0.1290691165101871,90,0.004075426919261575,250,2,MIXED,0.17306807156295775,COMPLETE
41,0.8841492822296148,2026-08-03 19:49:13.571514,2026-08-03 19:52:27.934564,0 days 00:03:14.363050,0.15332469398452037,121,0.0011429997797349036,250,1,MIXED,0.051088103916245305,COMPLETE
42,0.8750181867496281,2026-08-03 19:52:27.997217,2026-08-03 19:54:06.814379,0 days 00:01:38.817162,0.11072829119569978,70,0.01618340251909831,200,1,MIXED,0.8652232057622259,COMPLETE
43,0.8708720568899491,2026-08-03 19:54:06.877065,2026-08-03 19:56:26.848414,0 days 00:02:19.971349,0.1802702270048631,94,0.04386779283002666,225,1,MIXED,0.30580095611673774,COMPLETE
44,0.8873470067753502,2026-08-03 19:56:26.910975,2026-08-03 19:57:14.919304,0 days 00:00:48.008329,0.21888380017613407,30,0.008048077348084565,275,1,MIXED,0.10443006329847539,COMPLETE
45,0.8718965771190033,2026-08-03 19:57:14.982404,2026-08-03 19:59:32.615187,0 days 00:02:17.632783,0.047802854510137355,123,0.02011710210416529,175,1,UNIFORM,0.00026942476959191427,COMPLETE
46,0.5537833827893175,2026-08-03 19:59:32.687965,2026-08-03 20:00:41.311596,0 days 00:01:08.623631,0.09354954840826366,81,0.030896486910214294,125,1,MIXED,0.04963664563192436,COMPLETE
47,0.8981295040271301,2026-08-03 20:00:41.389890,2026-08-03 20:01:22.444158,0 days 00:00:41.054268,0.13982204199102782,51,0.012368692494016675,150,1,MIXED,0.0001547002872927012,COMPLETE
48,0.8784783842622197,2026-08-03 20:01:22.506740,2026-08-03 20:02:07.959487,0 days 00:00:45.452747,0.14590971201838032,47,0.01232924811946418,175,1,SUBSPACE,0.0001545798547615299,COMPLETE
49,0.8850426782391275,2026-08-03 20:02:08.037261,2026-08-03 20:02:44.968101,0 days 00:00:36.930840,0.14093056121146635,54,0.0032313061053873497,150,1,MIXED,0.5207435034827627,COMPLETE
50,0.8744950370381015,2026-08-03 20:02:45.046479,2026-08-03 20:03:33.928047,0 days 00:00:48.881568,0.05061149297878019,68,0.012882848352801303,100,1,MIXED,0.00014368523553985328,COMPLETE
51,0.8859697534146184,2026-08-03 20:03:33.990633,2026-08-03 20:03:56.508652,0 days 00:00:22.518019,0.2420025250589357,22,0.006637613638937451,150,1,MIXED,0.0003933641403228216,COMPLETE
52,0.8920809503452338,2026-08-03 20:03:56.586968,2026-08-03 20:04:41.176617,0 days 00:00:44.589649,0.09548083915182268,35,0.010067364835570403,200,1,MIXED,0.0007129680741030128,COMPLETE
53,0.8799344468713401,2026-08-03 20:04:41.260027,2026-08-03 20:05:25.612635,0 days 00:00:44.352608,0.10224758260825204,36,0.010229355932224725,200,1,MIXED,0.0006227910683059235,COMPLETE
54,0.8824570164031011,2026-08-03 20:05:25.697557,2026-08-03 20:06:13.240535,0 days 00:00:47.542978,0.07506820629656158,39,0.02222139497922375,200,1,MIXED,0.0017410102599117034,COMPLETE
55,0.891341804915901,2026-08-03 20:06:13.307425,2026-08-03 20:07:12.532827,0 days 00:00:59.225402,0.04196929150314081,46,0.014255701426738333,225,1,MIXED,0.0008683709073730735,COMPLETE
56,0.8857564520300903,2026-08-03 20:07:12.609947,2026-08-03 20:08:05.604419,0 days 00:00:52.994472,0.13303356923198714,53,0.002454685138452276,175,1,MIXED,0.00029512267895485993,COMPLETE
57,0.8808161674366471,2026-08-03 20:08:05.688845,2026-08-03 20:09:01.636844,0 days 00:00:55.947999,0.4639519647241564,25,0.008698399933312227,275,1,UNIFORM,0.0004826094590705857,COMPLETE
58,0.8845287341663014,2026-08-03 20:09:01.715117,2026-08-03 20:10:42.447169,0 days 00:01:40.732052,0.07342842192603116,64,0.006225918025305237,200,1,MIXED,0.08508589219690024,COMPLETE
59,0.8877055776291305,2026-08-03 20:10:42.530217,2026-08-03 20:11:31.953950,0 days 00:00:49.423733,0.3656180403948378,28,0.0036757013910327908,225,1,MIXED,0.0028791095135903867,COMPLETE
60,0.8821644567146377,2026-08-03 20:11:32.043515,2026-08-03 20:13:31.791691,0 days 00:01:59.748176,0.1785200369210672,95,0.0017693905415761628,175,1,SUBSPACE,0.012394452562334554,COMPLETE
61,0.8408322615874293,2026-08-03 20:13:31.866164,2026-08-03 20:13:51.267757,0 days 00:00:19.401593,0.21301869769475618,20,0.08132044152094757,125,1,MIXED,0.00016962700416587654,COMPLETE
62,0.6949210919593911,2026-08-03 20:13:51.329945,2026-08-03 20:14:04.747202,0 days 00:00:13.417257,0.15773122028938544,7,0.04447862680006497,125,1,MIXED,0.0003307608704997383,COMPLETE
63,0.8834366310775177,2026-08-03 20:14:04.809881,2026-08-03 20:14:17.997271,0 days 00:00:13.187390,0.1948752768571851,15,0.010781213862743926,100,1,MIXED,0.001283183200547211,COMPLETE
64,0.8861496001609415,2026-08-03 20:14:18.074907,2026-08-03 20:14:35.624198,0 days 00:00:17.549291,0.30232627438171067,10,0.01932671245991367,150,1,MIXED,0.000510526304841771,COMPLETE
65,0.8779720741336821,2026-08-03 20:14:35.702601,2026-08-03 20:15:15.238259,0 days 00:00:39.535658,0.23972865220581835,77,0.004913473148826159,75,1,MIXED,0.00011906910222394739,COMPLETE
66,0.8866788121223442,2026-08-03 20:15:15.316583,2026-08-03 20:16:27.983826,0 days 00:01:12.667243,0.09242920756073764,111,0.015216222365312395,100,1,MIXED,0.02946426220123971,COMPLETE
67,0.8861147983560974,2026-08-03 20:16:28.069313,2026-08-03 20:16:43.516795,0 days 00:00:15.447482,0.11037734226988344,11,0.02661415378500831,125,1,MIXED,0.00020658948179569516,COMPLETE
68,0.8746138122301177,2026-08-03 20:16:43.585193,2026-08-03 20:18:10.966944,0 days 00:01:27.381751,0.20371019302981747,87,0.03539409247503357,150,1,MIXED,0.0007803635996261593,COMPLETE
69,0.8872345183609831,2026-08-03 20:18:11.045668,2026-08-03 20:18:42.372789,0 days 00:00:31.327121,0.169546663562489,42,0.0002142632462849272,125,1,UNIFORM,0.005369709889176689,COMPLETE
70,0.8814522546180873,2026-08-03 20:18:42.435642,2026-08-03 20:19:29.827297,0 days 00:00:47.391655,0.2702987862843164,33,0.008677900632327701,250,1,MIXED,0.002773995009708328,COMPLETE
71,0.8807553204101135,2026-08-03 20:19:29.893972,2026-08-03 20:20:28.582523,0 days 00:00:58.688551,0.034891791238288124,47,0.015714042116546815,225,1,MIXED,0.0008399350432836501,COMPLETE
72,0.8881126464819191,2026-08-03 20:20:28.645131,2026-08-03 20:21:19.767502,0 days 00:00:51.122371,0.06174718673277048,58,0.022968076307622248,200,1,MIXED,0.00043596066799863936,COMPLETE
73,0.8807973071036994,2026-08-03 20:21:19.833903,2026-08-03 20:24:21.518619,0 days 00:03:01.684716,0.017897863911981365,126,0.014525524066330129,225,1,MIXED,0.0006116790231475302,COMPLETE
74,0.8809614369058995,2026-08-03 20:24:21.596807,2026-08-03 20:26:34.719002,0 days 00:02:13.122195,0.03393358364902897,100,0.00690474881655069,200,1,MIXED,0.001686071902070778,COMPLETE
75,0.8880012807064183,2026-08-03 20:26:34.797187,2026-08-03 20:30:04.927334,0 days 00:03:30.130147,0.1365681964843166,148,0.010520128066267054,225,1,MIXED,0.0009947381448447664,COMPLETE
76,0.8827423912028222,2026-08-03 20:30:05.005626,2026-08-03 20:32:14.081761,0 days 00:02:09.076135,0.08416959906288912,74,0.01282660226056775,250,1,SUBSPACE,0.22110138971667326,COMPLETE
77,0.5452818631853485,2026-08-03 20:32:14.144329,2026-08-03 20:32:35.850705,0 days 00:00:21.706376,0.12509408703194053,28,0.031756284214299844,75,2,MIXED,0.0002657712493140133,COMPLETE
78,0.8840994370639671,2026-08-03 20:32:35.927782,2026-08-03 20:33:02.474518,0 days 00:00:26.546736,0.38666061082292014,47,0.005492572721180274,100,1,MIXED,0.0003505112374163112,COMPLETE
79,0.8749012077797975,2026-08-03 20:33:02.552716,2026-08-03 20:33:37.182553,0 days 00:00:34.629837,0.15007685994045744,35,0.01927366056122109,175,1,MIXED,0.0012864341504667883,COMPLETE
80,0.8698827875212852,2026-08-03 20:33:37.253478,2026-08-03 20:34:01.613519,0 days 00:00:24.360041,0.17860425977535827,5,0.07334239165676953,250,1,MIXED,0.0005481541903058258,COMPLETE
81,0.880136746394982,2026-08-03 20:34:01.676231,2026-08-03 20:34:55.709280,0 days 00:00:54.033049,0.05896417783753185,40,0.009596744931667619,225,1,MIXED,0.9064206412821979,COMPLETE
82,0.8852640626234902,2026-08-03 20:34:55.771849,2026-08-03 20:38:03.410335,0 days 00:03:07.638486,0.03934951344770834,132,0.04948395432465098,200,1,MIXED,0.6828770784982768,COMPLETE
83,0.8827428402583686,2026-08-03 20:38:03.516031,2026-08-03 20:40:08.652344,0 days 00:02:05.136313,0.010469175577343247,85,0.013993314723167347,200,1,MIXED,0.03335046306892003,COMPLETE
84,0.8817014804463252,2026-08-03 20:40:08.734968,2026-08-03 20:42:17.681294,0 days 00:02:08.946326,0.10784769451035975,102,0.018196204690732628,175,1,MIXED,0.28530092442976107,COMPLETE
85,0.9079795374368628,2026-08-03 20:42:17.751714,2026-08-03 20:44:13.215931,0 days 00:01:55.464217,0.3454837248787005,66,0.024100269523110982,225,1,MIXED,0.47375220931686796,COMPLETE
86,0.8786712536193877,2026-08-03 20:44:13.298592,2026-08-03 20:45:18.184384,0 days 00:01:04.885792,0.46881433268002554,53,0.027861117400936636,225,1,MIXED,0.4595099392796548,COMPLETE
87,0.8858384046673038,2026-08-03 20:45:18.266285,2026-08-03 20:46:18.548864,0 days 00:01:00.282579,0.3308376027471226,61,0.0240061698166553,125,1,UNIFORM,0.11422849806943201,COMPLETE
88,0.883282380497338,2026-08-03 20:46:18.629806,2026-08-03 20:48:13.258705,0 days 00:01:54.628899,0.3450346768214294,66,0.007931201335770792,225,1,MIXED,0.47887643180502837,COMPLETE
89,0.919617485504487,2026-08-03 20:48:13.342759,2026-08-03 20:49:14.478180,0 days 00:01:01.135421,0.4366346617918619,45,0.01143181997226426,225,1,SUBSPACE,0.13595850048358726,COMPLETE
90,0.9093949605190363,2026-08-03 20:49:14.560965,2026-08-03 20:49:49.962459,0 days 00:00:35.401494,0.43790645466363254,52,0.01133987645603247,125,1,SUBSPACE,0.13606222434344226,COMPLETE
91,0.8814219433687069,2026-08-03 20:49:50.040174,2026-08-03 20:50:27.615684,0 days 00:00:37.575510,0.4423860227464679,57,0.01088378989540675,125,1,SUBSPACE,0.1296105726985197,COMPLETE
92,0.9236690891716542,2026-08-03 20:50:27.692725,2026-08-03 20:51:52.850250,0 days 00:01:25.157525,0.4988983246822969,74,0.009210924781360551,150,1,SUBSPACE,0.06671334022345986,COMPLETE
93,0.9082927536804593,2026-08-03 20:51:52.932890,2026-08-03 20:53:17.075169,0 days 00:01:24.142279,0.4989860037255819,73,0.00723532808088257,150,1,SUBSPACE,0.07626797872971541,COMPLETE
94,0.9066231651590376,2026-08-03 20:53:17.153945,2026-08-03 20:54:42.958190,0 days 00:01:25.804245,0.49879981785793664,76,0.007552580080375831,150,1,SUBSPACE,0.14818272706473531,COMPLETE
95,0.8795298478240565,2026-08-03 20:54:43.039315,2026-08-03 20:56:07.919886,0 days 00:01:24.880571,0.4937156192937746,74,0.0055227450137846235,150,1,SUBSPACE,0.08135237300851145,COMPLETE
96,0.879050256500528,2026-08-03 20:56:07.998658,2026-08-03 20:57:42.135942,0 days 00:01:34.137284,0.499301049644669,85,0.004120800922483735,150,1,SUBSPACE,0.23570355672198803,COMPLETE
97,0.8803996684173846,2026-08-03 20:57:42.216879,2026-08-03 20:58:57.532316,0 days 00:01:15.315437,0.42786529054754513,64,0.0072168261676709726,150,1,SUBSPACE,0.07125932896503138,COMPLETE
98,0.8768263089071067,2026-08-03 20:58:57.611311,2026-08-03 21:00:21.647570,0 days 00:01:24.036259,0.47899777418335543,73,0.00896412566994649,150,1,SUBSPACE,0.1395929553105086,COMPLETE
99,0.8757364510960547,2026-08-03 21:00:21.728092,2026-08-03 21:02:36.565722,0 days 00:02:14.837630,0.4509545939814423,109,0.004291418142006259,175,1,SUBSPACE,0.05648819816803631,COMPLETE
100,0.8821671510479161,2026-08-03 21:02:36.647397,2026-08-03 21:03:44.530941,0 days 00:01:07.883544,0.4831940003392782,50,0.005802379773769666,250,1,SUBSPACE,0.0639635513950548,COMPLETE
101,0.8771842061775674,2026-08-03 21:03:44.610012,2026-08-03 21:05:09.841051,0 days 00:01:25.231039,0.465311218726075,94,0.011621290387605182,125,1,SUBSPACE,0.17732264152350166,COMPLETE
102,0.8906695687629776,2026-08-03 21:05:09.921489,2026-08-03 21:07:49.904232,0 days 00:02:39.982743,0.4212256833541892,78,0.007639340793665527,275,1,SUBSPACE,0.3492343647219389,COMPLETE
103,0.8928225655800721,2026-08-03 21:07:49.985141,2026-08-03 21:08:31.764721,0 days 00:00:41.779580,0.45358564980235155,51,0.021054262877676262,150,1,SUBSPACE,0.04354075535127907,COMPLETE
104,0.8792783767180865,2026-08-03 21:08:31.844623,2026-08-03 21:08:59.111725,0 days 00:00:27.267102,0.40057090867066525,44,0.017583779307800907,100,1,SUBSPACE,0.14665726869725343,COMPLETE
105,0.878973468002098,2026-08-03 21:08:59.190111,2026-08-03 21:10:04.304693,0 days 00:01:05.114582,0.4744147222148223,67,0.012324654559235596,125,1,SUBSPACE,0.10627120768672547,COMPLETE
106,0.8852357721240688,2026-08-03 21:10:04.385546,2026-08-03 21:10:48.964763,0 days 00:00:44.579217,0.48662118197989285,56,0.0010873002649219906,150,1,SUBSPACE,0.21587281251273244,COMPLETE
107,0.8737309690259446,2026-08-03 21:10:49.044867,2026-08-03 21:12:02.393416,0 days 00:01:13.348549,0.49976065149472404,62,0.006510954444496935,150,1,SUBSPACE,0.09356227974678966,COMPLETE
108,0.8783259299042254,2026-08-03 21:12:02.474197,2026-08-03 21:13:09.011261,0 days 00:01:06.537064,0.4489428976638816,90,0.009233621729342924,100,1,SUBSPACE,0.04061384126223536,COMPLETE
109,0.9047602582249012,2026-08-03 21:13:09.093519,2026-08-03 21:14:56.950566,0 days 00:01:47.857047,0.4558966687948062,83,0.014134404647326619,175,1,SUBSPACE,0.02122481579462445,COMPLETE
110,0.8769787632651008,2026-08-03 21:14:57.031976,2026-08-03 21:16:42.078914,0 days 00:01:45.046938,0.4067611125498567,81,0.013656275969209118,175,1,SUBSPACE,0.021522659656816875,COMPLETE
111,0.9088210675307692,2026-08-03 21:16:42.159569,2026-08-03 21:18:18.296406,0 days 00:01:36.136837,0.4604063053461723,72,0.016606024173962376,175,1,SUBSPACE,0.2587037770090756,COMPLETE
112,0.8778391536919552,2026-08-03 21:18:18.377813,2026-08-03 21:19:50.227775,0 days 00:01:31.849962,0.4567690564851482,68,0.015241480084205802,175,1,SUBSPACE,0.26466899018084883,COMPLETE
113,0.9046881848097083,2026-08-03 21:19:50.308189,2026-08-03 21:21:36.759015,0 days 00:01:46.450826,0.4396647722901954,83,0.016904991777664604,175,1,SUBSPACE,0.01016637092217792,COMPLETE
114,0.5548961424332344,2026-08-03 21:21:36.830437,2026-08-03 21:23:03.529388,0 days 00:01:26.698951,0.436525926621459,71,0.030776034464695273,175,1,SUBSPACE,0.01292225074948552,COMPLETE
115,0.8728577805160187,2026-08-03 21:23:03.607536,2026-08-03 21:24:39.948489,0 days 00:01:36.340953,0.41866815548679026,81,0.01671072110705634,175,1,SUBSPACE,0.37747815945258184,COMPLETE
