number,value,datetime_start,datetime_complete,duration,params_contamination,params_leaf_size,params_metric,params_n_neighbors,params_p,state
0,0.8074729666538253,2026-08-03 16:55:05.863813,2026-08-03 16:55:07.340614,0 days 00:00:01.476801,0.2757254682642995,30,minkowski,48,2.0,COMPLETE
1,0.752030681000458,2026-08-03 16:55:07.413416,2026-08-03 16:55:07.878661,0 days 00:00:00.465245,0.03860487984774338,50,minkowski,10,1.0,COMPLETE
2,0.8058829479733773,2026-08-03 16:55:07.957224,2026-08-03 16:55:08.450554,0 days 00:00:00.493330,0.40648517584940247,60,minkowski,38,1.0,COMPLETE
3,0.7442716927005726,2026-08-03 16:55:08.523008,2026-08-03 16:55:08.990185,0 days 00:00:00.467177,0.3695652622191061,40,manhattan,20,,COMPLETE
4,0.8211044239468323,2026-08-03 16:55:09.064429,2026-08-03 16:55:09.115659,0 days 00:00:00.051230,0.24453541449540095,40,euclidean,7,,COMPLETE
5,0.7529201828794058,2026-08-03 16:55:09.178280,2026-08-03 16:55:09.650028,0 days 00:00:00.471748,0.21965777027202094,50,manhattan,21,,COMPLETE
6,0.738173592485178,2026-08-03 16:55:09.728415,2026-08-03 16:55:10.201171,0 days 00:00:00.472756,0.06573318968051038,60,manhattan,12,,COMPLETE
7,0.7718789599036661,2026-08-03 16:55:10.263910,2026-08-03 16:55:10.721331,0 days 00:00:00.457421,0.4037301823363769,60,minkowski,9,1.0,COMPLETE
8,0.8124289791656066,2026-08-03 16:55:10.783854,2026-08-03 16:55:11.248745,0 days 00:00:00.464891,0.33026349906138686,30,manhattan,5,,COMPLETE
9,0.752167574037327,2026-08-03 16:55:11.311520,2026-08-03 16:55:11.374067,0 days 00:00:00.062547,0.24317566187629008,40,euclidean,16,,COMPLETE
10,0.7710539673540393,2026-08-03 16:55:11.438965,2026-08-03 16:55:11.548459,0 days 00:00:00.109494,0.4896162581121494,10,euclidean,90,,COMPLETE
11,0.8305615521974362,2026-08-03 16:55:11.626819,2026-08-03 16:55:11.693504,0 days 00:00:00.066685,0.17842167096072603,20,euclidean,5,,COMPLETE
12,0.8305615521974362,2026-08-03 16:55:11.757175,2026-08-03 16:55:11.829717,0 days 00:00:00.072542,0.11663456491733873,10,euclidean,5,,COMPLETE
13,0.8305615521974362,2026-08-03 16:55:11.906298,2026-08-03 16:55:11.966785,0 days 00:00:00.060487,0.146971342102369,10,euclidean,5,,COMPLETE
14,0.8305615521974362,2026-08-03 16:55:12.029340,2026-08-03 16:55:12.095777,0 days 00:00:00.066437,0.1195185861750207,20,euclidean,5,,COMPLETE
15,0.8211044239468323,2026-08-03 16:55:12.154664,2026-08-03 16:55:12.217199,0 days 00:00:00.062535,0.15887375099808954,20,euclidean,7,,COMPLETE
16,0.8227189743440643,2026-08-03 16:55:12.287757,2026-08-03 16:55:12.360005,0 days 00:00:00.072248,0.08585817870466608,20,euclidean,8,,COMPLETE
17,0.7626395884971084,2026-08-03 16:55:12.423412,2026-08-03 16:55:12.479459,0 days 00:00:00.056047,0.17807334281637954,10,euclidean,13,,COMPLETE
18,0.8152298349288035,2026-08-03 16:55:12.556375,2026-08-03 16:55:12.618225,0 days 00:00:00.061850,0.0913748048259786,20,euclidean,6,,COMPLETE
19,0.8305615521974362,2026-08-03 16:55:12.680937,2026-08-03 16:55:12.743645,0 days 00:00:00.062708,0.20491991161214063,30,euclidean,5,,COMPLETE
20,0.800187349629662,2026-08-03 16:55:12.809040,2026-08-03 16:55:12.876976,0 days 00:00:00.067936,0.030247262758632223,10,euclidean,9,,COMPLETE
21,0.8305615521974362,2026-08-03 16:55:12.944469,2026-08-03 16:55:13.009064,0 days 00:00:00.064595,0.140698643916274,10,euclidean,5,,COMPLETE
22,0.8211044239468323,2026-08-03 16:55:13.067564,2026-08-03 16:55:13.140380,0 days 00:00:00.072816,0.12206595260932704,10,euclidean,7,,COMPLETE
23,0.8152298349288035,2026-08-03 16:55:13.203139,2026-08-03 16:55:13.256516,0 days 00:00:00.053377,0.18329598117312595,20,euclidean,6,,COMPLETE
24,0.8305615521974362,2026-08-03 16:55:13.319438,2026-08-03 16:55:13.382036,0 days 00:00:00.062598,0.28328675442378976,10,euclidean,5,,COMPLETE
25,0.778894425182504,2026-08-03 16:55:13.444712,2026-08-03 16:55:13.518903,0 days 00:00:00.074191,0.12214183150050137,20,euclidean,10,,COMPLETE
26,0.8211044239468323,2026-08-03 16:55:13.572506,2026-08-03 16:55:13.635483,0 days 00:00:00.062977,0.06140405360860748,10,euclidean,7,,COMPLETE
27,0.8152298349288035,2026-08-03 16:55:13.698062,2026-08-03 16:55:13.760656,0 days 00:00:00.062594,0.017397617446996055,20,euclidean,6,,COMPLETE
28,0.7668551065948523,2026-08-03 16:55:13.835621,2026-08-03 16:55:13.900802,0 days 00:00:00.065181,0.16318047320862683,30,minkowski,12,2.0,COMPLETE
29,0.8090420879459018,2026-08-03 16:55:13.963419,2026-08-03 16:55:14.486979,0 days 00:00:00.523560,0.2749335816236882,10,manhattan,74,,COMPLETE
30,0.8152298349288035,2026-08-03 16:55:14.559668,2026-08-03 16:55:14.633423,0 days 00:00:00.073755,0.20213767880077058,20,minkowski,6,2.0,COMPLETE
31,0.8305615521974362,2026-08-03 16:55:14.698128,2026-08-03 16:55:14.758704,0 days 00:00:00.060576,0.1103717550383576,20,euclidean,5,,COMPLETE
32,0.8305615521974362,2026-08-03 16:55:14.821273,2026-08-03 16:55:14.881415,0 days 00:00:00.060142,0.14483717545870453,30,euclidean,5,,COMPLETE
33,0.8227189743440643,2026-08-03 16:55:14.944251,2026-08-03 16:55:14.994942,0 days 00:00:00.050691,0.06793637909443132,10,euclidean,8,,COMPLETE
34,0.811998614109432,2026-08-03 16:55:15.069277,2026-08-03 16:55:15.160725,0 days 00:00:00.091448,0.10297702950520286,20,euclidean,43,,COMPLETE
35,0.7751822615698845,2026-08-03 16:55:15.231758,2026-08-03 16:55:15.691082,0 days 00:00:00.459324,0.13507942238754628,20,minkowski,6,1.0,COMPLETE
36,0.778894425182504,2026-08-03 16:55:15.760015,2026-08-03 16:55:15.816709,0 days 00:00:00.056694,0.18476372756412146,10,euclidean,10,,COMPLETE
37,0.7995816282275865,2026-08-03 16:55:15.879346,2026-08-03 16:55:16.377604,0 days 00:00:00.498258,0.2319339489852528,30,manhattan,32,,COMPLETE
38,0.8227189743440643,2026-08-03 16:55:16.446253,2026-08-03 16:55:16.499759,0 days 00:00:00.053506,0.04716337117295455,30,euclidean,8,,COMPLETE
39,0.8305615521974362,2026-08-03 16:55:16.573324,2026-08-03 16:55:16.624503,0 days 00:00:00.051179,0.2685633977384988,50,minkowski,5,2.0,COMPLETE
40,0.7751822615698845,2026-08-03 16:55:16.698656,2026-08-03 16:55:17.146005,0 days 00:00:00.447349,0.30368977160378513,10,manhattan,6,,COMPLETE
41,0.8305615521974362,2026-08-03 16:55:17.210950,2026-08-03 16:55:17.288558,0 days 00:00:00.077608,0.21115880342518092,40,euclidean,5,,COMPLETE
42,0.8211044239468323,2026-08-03 16:55:17.351160,2026-08-03 16:55:17.413782,0 days 00:00:00.062622,0.1564120594006687,30,euclidean,7,,COMPLETE
43,0.8305615521974362,2026-08-03 16:55:17.476375,2026-08-03 16:55:17.539140,0 days 00:00:00.062765,0.197920308949892,40,euclidean,5,,COMPLETE
44,0.8152298349288035,2026-08-03 16:55:17.601770,2026-08-03 16:55:17.665069,0 days 00:00:00.063299,0.22343826511910164,30,euclidean,6,,COMPLETE
45,0.8305615521974362,2026-08-03 16:55:17.727600,2026-08-03 16:55:17.790066,0 days 00:00:00.062466,0.07884448113150684,20,euclidean,5,,COMPLETE
46,0.8227189743440643,2026-08-03 16:55:17.853906,2026-08-03 16:55:17.916323,0 days 00:00:00.062417,0.4787269269752773,20,euclidean,8,,COMPLETE
47,0.8211044239468323,2026-08-03 16:55:17.980254,2026-08-03 16:55:18.041238,0 days 00:00:00.060984,0.25244795376102985,30,euclidean,7,,COMPLETE
48,0.7718789599036661,2026-08-03 16:55:18.103765,2026-08-03 16:55:18.567989,0 days 00:00:00.464224,0.1663632272332905,40,manhattan,9,,COMPLETE
49,0.799826339674025,2026-08-03 16:55:18.634689,2026-08-03 16:55:18.709232,0 days 00:00:00.074543,0.09880711390682564,10,euclidean,25,,COMPLETE
50,0.8152298349288035,2026-08-03 16:55:18.771747,2026-08-03 16:55:18.847461,0 days 00:00:00.075714,0.12578415173669572,20,euclidean,6,,COMPLETE
51,0.8305615521974362,2026-08-03 16:55:18.914238,2026-08-03 16:55:18.974390,0 days 00:00:00.060152,0.14635287365169664,10,euclidean,5,,COMPLETE
52,0.8305615521974362,2026-08-03 16:55:19.038280,2026-08-03 16:55:19.095775,0 days 00:00:00.057495,0.1801315426478599,10,euclidean,5,,COMPLETE
53,0.8152298349288035,2026-08-03 16:55:19.158376,2026-08-03 16:55:19.221262,0 days 00:00:00.062886,0.13602857442107824,10,euclidean,6,,COMPLETE
54,0.8211044239468323,2026-08-03 16:55:19.284053,2026-08-03 16:55:19.330952,0 days 00:00:00.046899,0.11065291893453019,10,euclidean,7,,COMPLETE
55,0.8305615521974362,2026-08-03 16:55:19.406237,2026-08-03 16:55:19.468891,0 days 00:00:00.062654,0.16909032206084157,50,euclidean,5,,COMPLETE
56,0.8305615521974362,2026-08-03 16:55:19.531696,2026-08-03 16:55:19.593426,0 days 00:00:00.061730,0.19804933817359596,20,euclidean,5,,COMPLETE
57,0.7751822615698845,2026-08-03 16:55:19.654361,2026-08-03 16:55:20.106453,0 days 00:00:00.452092,0.08562259810532877,10,minkowski,6,1.0,COMPLETE
58,0.8211044239468323,2026-08-03 16:55:20.168975,2026-08-03 16:55:20.231881,0 days 00:00:00.062906,0.15000440162465276,10,euclidean,7,,COMPLETE
59,0.8227189743440643,2026-08-03 16:55:20.294680,2026-08-03 16:55:20.367026,0 days 00:00:00.072346,0.2437522987481859,20,euclidean,8,,COMPLETE
60,0.7688773074956813,2026-08-03 16:55:20.430816,2026-08-03 16:55:20.499821,0 days 00:00:00.069005,0.054074430008847776,10,euclidean,11,,COMPLETE
61,0.8305615521974362,2026-08-03 16:55:20.567238,2026-08-03 16:55:20.616511,0 days 00:00:00.049273,0.2925745252471895,10,euclidean,5,,COMPLETE
62,0.8305615521974362,2026-08-03 16:55:20.694935,2026-08-03 16:55:20.760785,0 days 00:00:00.065850,0.35807459940680547,10,euclidean,5,,COMPLETE
63,0.8152298349288035,2026-08-03 16:55:20.822753,2026-08-03 16:55:20.881558,0 days 00:00:00.058805,0.3264638404557063,20,euclidean,6,,COMPLETE
64,0.8305615521974362,2026-08-03 16:55:20.944201,2026-08-03 16:55:21.005559,0 days 00:00:00.061358,0.117907790289825,10,euclidean,5,,COMPLETE
65,0.8152298349288035,2026-08-03 16:55:21.066308,2026-08-03 16:55:21.132955,0 days 00:00:00.066647,0.13549883568239957,20,euclidean,6,,COMPLETE
66,0.7918168855743813,2026-08-03 16:55:21.191927,2026-08-03 16:55:21.659230,0 days 00:00:00.467303,0.43329829056533453,60,manhattan,7,,COMPLETE
67,0.8305615521974362,2026-08-03 16:55:21.723738,2026-08-03 16:55:21.784672,0 days 00:00:00.060934,0.19082368033689892,10,euclidean,5,,COMPLETE
68,0.8152298349288035,2026-08-03 16:55:21.846851,2026-08-03 16:55:21.907957,0 days 00:00:00.061106,0.25527691980733946,30,minkowski,6,2.0,COMPLETE
69,0.8305615521974362,2026-08-03 16:55:21.971244,2026-08-03 16:55:22.021071,0 days 00:00:00.049827,0.2120927678483086,10,euclidean,5,,COMPLETE
70,0.8016737899503551,2026-08-03 16:55:22.083572,2026-08-03 16:55:22.197014,0 days 00:00:00.113442,0.07783796273391844,20,euclidean,54,,COMPLETE
71,0.8305615521974362,2026-08-03 16:55:22.271215,2026-08-03 16:55:22.318144,0 days 00:00:00.046929,0.1039530741883256,20,euclidean,5,,COMPLETE
72,0.8152298349288035,2026-08-03 16:55:22.396444,2026-08-03 16:55:22.459183,0 days 00:00:00.062739,0.12209503147280644,20,euclidean,6,,COMPLETE
73,0.8305615521974362,2026-08-03 16:55:22.521749,2026-08-03 16:55:22.579510,0 days 00:00:00.057761,0.035365775919713724,30,euclidean,5,,COMPLETE
74,0.8152298349288035,2026-08-03 16:55:22.642073,2026-08-03 16:55:22.705204,0 days 00:00:00.063131,0.17235290482722765,10,euclidean,6,,COMPLETE
75,0.8211044239468323,2026-08-03 16:55:22.779572,2026-08-03 16:55:22.831004,0 days 00:00:00.051432,0.1547238205304186,20,euclidean,7,,COMPLETE
76,0.8305615521974362,2026-08-03 16:55:22.893929,2026-08-03 16:55:22.964497,0 days 00:00:00.070568,0.13311422471454454,10,euclidean,5,,COMPLETE
77,0.7718789599036661,2026-08-03 16:55:23.025262,2026-08-03 16:55:23.476176,0 days 00:00:00.450914,0.09039998725508819,30,manhattan,9,,COMPLETE
78,0.8211044239468323,2026-08-03 16:55:23.552890,2026-08-03 16:55:23.615369,0 days 00:00:00.062479,0.10962105648904463,20,euclidean,7,,COMPLETE
79,0.8124289791656066,2026-08-03 16:55:23.680450,2026-08-03 16:55:24.143109,0 days 00:00:00.462659,0.2954016172967594,10,minkowski,5,1.0,COMPLETE
80,0.8152298349288035,2026-08-03 16:55:24.208035,2026-08-03 16:55:24.270479,0 days 00:00:00.062444,0.07415004841577277,10,euclidean,6,,COMPLETE
81,0.8305615521974362,2026-08-03 16:55:24.333198,2026-08-03 16:55:24.396506,0 days 00:00:00.063308,0.14520551250160824,30,euclidean,5,,COMPLETE
82,0.8305615521974362,2026-08-03 16:55:24.459571,2026-08-03 16:55:24.506664,0 days 00:00:00.047093,0.16148816289185253,30,euclidean,5,,COMPLETE
83,0.8152298349288035,2026-08-03 16:55:24.569230,2026-08-03 16:55:24.651360,0 days 00:00:00.082130,0.23221347201912054,40,euclidean,6,,COMPLETE
84,0.8305615521974362,2026-08-03 16:55:24.711204,2026-08-03 16:55:24.776399,0 days 00:00:00.065195,0.18419694078080548,40,euclidean,5,,COMPLETE
85,0.8152298349288035,2026-08-03 16:55:24.842067,2026-08-03 16:55:24.901484,0 days 00:00:00.059417,0.1429516489711214,30,euclidean,6,,COMPLETE
86,0.8227189743440643,2026-08-03 16:55:24.966510,2026-08-03 16:55:25.026526,0 days 00:00:00.060016,0.11471672417470967,20,euclidean,8,,COMPLETE
87,0.8305615521974362,2026-08-03 16:55:25.088107,2026-08-03 16:55:25.150682,0 days 00:00:00.062575,0.09945678054843513,30,euclidean,5,,COMPLETE
88,0.8211044239468323,2026-08-03 16:55:25.209575,2026-08-03 16:55:25.288270,0 days 00:00:00.078695,0.21273570223382005,10,euclidean,7,,COMPLETE
89,0.8124289791656066,2026-08-03 16:55:25.350820,2026-08-03 16:55:25.805200,0 days 00:00:00.454380,0.13123533067751342,20,manhattan,5,,COMPLETE
90,0.8152298349288035,2026-08-03 16:55:25.867998,2026-08-03 16:55:25.930269,0 days 00:00:00.062271,0.1769176511972299,50,euclidean,6,,COMPLETE
91,0.8305615521974362,2026-08-03 16:55:26.017513,2026-08-03 16:55:26.087907,0 days 00:00:00.070394,0.30198882048851416,50,minkowski,5,2.0,COMPLETE
92,0.8305615521974362,2026-08-03 16:55:26.158075,2026-08-03 16:55:26.220582,0 days 00:00:00.062507,0.2748197842421299,50,minkowski,5,2.0,COMPLETE
93,0.8152298349288035,2026-08-03 16:55:26.279127,2026-08-03 16:55:26.341748,0 days 00:00:00.062621,0.25808111271017264,60,minkowski,6,2.0,COMPLETE
94,0.8124289791656066,2026-08-03 16:55:26.404413,2026-08-03 16:55:26.869814,0 days 00:00:00.465401,0.15450515837672454,40,minkowski,5,1.0,COMPLETE
95,0.8305615521974362,2026-08-03 16:55:26.932099,2026-08-03 16:55:27.010830,0 days 00:00:00.078731,0.28213010692982904,10,minkowski,5,2.0,COMPLETE
96,0.8152298349288035,2026-08-03 16:55:27.088973,2026-08-03 16:55:27.151040,0 days 00:00:00.062067,0.22386099457974878,10,euclidean,6,,COMPLETE
97,0.8211044239468323,2026-08-03 16:55:27.213802,2026-08-03 16:55:27.276987,0 days 00:00:00.063185,0.32311858591611997,20,euclidean,7,,COMPLETE
98,0.768346695547463,2026-08-03 16:55:27.341786,2026-08-03 16:55:27.467672,0 days 00:00:00.125886,0.2697040139531431,10,euclidean,98,,COMPLETE
99,0.8305615521974362,2026-08-03 16:55:27.537822,2026-08-03 16:55:27.592581,0 days 00:00:00.054759,0.36631680591875887,60,euclidean,5,,COMPLETE
100,0.8124289791656066,2026-08-03 16:55:27.668766,2026-08-03 16:55:28.129591,0 days 00:00:00.460825,0.19316434456588613,20,minkowski,5,1.0,COMPLETE
101,0.7578486350673925,2026-08-03 16:55:28.207787,2026-08-03 16:55:28.279722,0 days 00:00:00.071935,0.201449404349698,40,euclidean,17,,COMPLETE
102,0.8152298349288035,2026-08-03 16:55:28.347913,2026-08-03 16:55:28.413233,0 days 00:00:00.065320,0.3155014258964286,40,euclidean,6,,COMPLETE
103,0.8305615521974362,2026-08-03 16:55:28.486854,2026-08-03 16:55:28.539498,0 days 00:00:00.052644,0.23687337170704414,50,euclidean,5,,COMPLETE
104,0.8305615521974362,2026-08-03 16:55:28.617685,2026-08-03 16:55:28.664823,0 days 00:00:00.047138,0.1678935273139392,40,euclidean,5,,COMPLETE
105,0.8152298349288035,2026-08-03 16:55:28.727386,2026-08-03 16:55:28.789963,0 days 00:00:00.062577,0.12412518919185479,30,euclidean,6,,COMPLETE
106,0.8305615521974362,2026-08-03 16:55:28.852535,2026-08-03 16:55:28.929362,0 days 00:00:00.076827,0.1378576530180608,50,euclidean,5,,COMPLETE
107,0.8305615521974362,2026-08-03 16:55:28.995039,2026-08-03 16:55:29.055951,0 days 00:00:00.060912,0.21671639468509057,10,euclidean,5,,COMPLETE
108,0.8211044239468323,2026-08-03 16:55:29.119878,2026-08-03 16:55:29.166977,0 days 00:00:00.047099,0.20648877336045296,20,euclidean,7,,COMPLETE
109,0.7751822615698845,2026-08-03 16:55:29.245781,2026-08-03 16:55:29.704169,0 days 00:00:00.458388,0.1498642055027097,10,manhattan,6,,COMPLETE
110,0.8305615521974362,2026-08-03 16:55:29.757755,2026-08-03 16:55:29.835973,0 days 00:00:00.078218,0.09378759869998277,30,euclidean,5,,COMPLETE
111,0.8305615521974362,2026-08-03 16:55:29.898503,2026-08-03 16:55:29.961770,0 days 00:00:00.063267,0.34448790806896806,40,euclidean,5,,COMPLETE
112,0.8305615521974362,2026-08-03 16:55:30.018751,2026-08-03 16:55:30.097352,0 days 00:00:00.078601,0.18994645721107517,40,euclidean,5,,COMPLETE
113,0.8152298349288035,2026-08-03 16:55:30.159931,2026-08-03 16:55:30.222472,0 days 00:00:00.062541,0.26527530347719486,50,euclidean,6,,COMPLETE
114,0.8305615521974362,2026-08-03 16:55:30.298074,2026-08-03 16:55:30.348298,0 days 00:00:00.050224,0.16193812187482576,30,euclidean,5,,COMPLETE
115,0.8152298349288035,2026-08-03 16:55:30.411101,2026-08-03 16:55:30.474048,0 days 00:00:00.062947,0.17608727215400535,10,euclidean,6,,COMPLETE
116,0.8305615521974362,2026-08-03 16:55:30.538194,2026-08-03 16:55:30.600773,0 days 00:00:00.062579,0.11114940066851461,40,euclidean,5,,COMPLETE
117,0.8152298349288035,2026-08-03 16:55:30.663428,2026-08-03 16:55:30.726025,0 days 00:00:00.062597,0.20346572419253228,20,euclidean,6,,COMPLETE
118,0.8305615521974362,2026-08-03 16:55:30.788600,2026-08-03 16:55:30.856332,0 days 00:00:00.067732,0.39415344571874555,10,euclidean,5,,COMPLETE
119,0.8152298349288035,2026-08-03 16:55:30.912930,2026-08-03 16:55:30.975958,0 days 00:00:00.063028,0.2271655686606539,20,euclidean,6,,COMPLETE
120,0.8305615521974362,2026-08-03 16:55:31.041852,2026-08-03 16:55:31.104235,0 days 00:00:00.062383,0.2396604456830045,40,minkowski,5,2.0,COMPLETE
121,0.8305615521974362,2026-08-03 16:55:31.166800,2026-08-03 16:55:31.229286,0 days 00:00:00.062486,0.08433759306216423,20,euclidean,5,,COMPLETE
122,0.8305615521974362,2026-08-03 16:55:31.292166,2026-08-03 16:55:31.354525,0 days 00:00:00.062359,0.06712989727382451,20,euclidean,5,,COMPLETE
123,0.8152298349288035,2026-08-03 16:55:31.414969,2026-08-03 16:55:31.476230,0 days 00:00:00.061261,0.12724134558384492,20,euclidean,6,,COMPLETE
124,0.8305615521974362,2026-08-03 16:55:31.526883,2026-08-03 16:55:31.591632,0 days 00:00:00.064749,0.05209527117960315,10,euclidean,5,,COMPLETE
125,0.8305615521974362,2026-08-03 16:55:31.654546,2026-08-03 16:55:31.717069,0 days 00:00:00.062523,0.10334072133456225,20,euclidean,5,,COMPLETE
126,0.8152298349288035,2026-08-03 16:55:31.779609,2026-08-03 16:55:31.842225,0 days 00:00:00.062616,0.28488353568913005,30,euclidean,6,,COMPLETE
127,0.8305615521974362,2026-08-03 16:55:31.904793,2026-08-03 16:55:31.967413,0 days 00:00:00.062620,0.11836960156682366,20,euclidean,5,,COMPLETE
128,0.8124289791656066,2026-08-03 16:55:32.029972,2026-08-03 16:55:32.503169,0 days 00:00:00.473197,0.13927709377755118,10,manhattan,5,,COMPLETE
129,0.8152298349288035,2026-08-03 16:55:32.568195,2026-08-03 16:55:32.632058,0 days 00:00:00.063863,0.18555633772536476,10,euclidean,6,,COMPLETE
130,0.8124289791656066,2026-08-03 16:55:32.694481,2026-08-03 16:55:33.163066,0 days 00:00:00.468585,0.07628187703360467,30,minkowski,5,1.0,COMPLETE
131,0.8305615521974362,2026-08-03 16:55:33.213331,2026-08-03 16:55:33.276141,0 days 00:00:00.062810,0.14607079832486683,10,euclidean,5,,COMPLETE
132,0.8305615521974362,2026-08-03 16:55:33.353268,2026-08-03 16:55:33.414890,0 days 00:00:00.061622,0.15302878368835207,10,euclidean,5,,COMPLETE
133,0.8305615521974362,2026-08-03 16:55:33.475291,2026-08-03 16:55:33.536257,0 days 00:00:00.060966,0.24822041598230135,10,euclidean,5,,COMPLETE
134,0.8152298349288035,2026-08-03 16:55:33.600409,2026-08-03 16:55:33.660275,0 days 00:00:00.059866,0.16945515814796772,50,euclidean,6,,COMPLETE
135,0.8305615521974362,2026-08-03 16:55:33.711310,2026-08-03 16:55:33.774613,0 days 00:00:00.063303,0.1297334770144421,10,euclidean,5,,COMPLETE
136,0.8152298349288035,2026-08-03 16:55:33.837235,2026-08-03 16:55:33.910127,0 days 00:00:00.072892,0.10910912692383476,20,euclidean,6,,COMPLETE
137,0.8211044239468323,2026-08-03 16:55:33.963188,2026-08-03 16:55:34.026727,0 days 00:00:00.063539,0.15915722128156443,10,euclidean,7,,COMPLETE
138,0.799826339674025,2026-08-03 16:55:34.104969,2026-08-03 16:55:34.178192,0 days 00:00:00.073223,0.09554349387502604,10,euclidean,25,,COMPLETE
139,0.7913792518613818,2026-08-03 16:55:34.246537,2026-08-03 16:55:34.356563,0 days 00:00:00.110026,0.1182286751240761,20,euclidean,62,,COMPLETE
140,0.8305615521974362,2026-08-03 16:55:34.429337,2026-08-03 16:55:34.490138,0 days 00:00:00.060801,0.14543264731211128,60,euclidean,5,,COMPLETE
141,0.8305615521974362,2026-08-03 16:55:34.553162,2026-08-03 16:55:34.613920,0 days 00:00:00.060758,0.1810723822183512,10,euclidean,5,,COMPLETE
142,0.8305615521974362,2026-08-03 16:55:34.670780,2026-08-03 16:55:34.747238,0 days 00:00:00.076458,0.19503665350690483,10,euclidean,5,,COMPLETE
143,0.8305615521974362,2026-08-03 16:55:34.812271,2026-08-03 16:55:34.874913,0 days 00:00:00.062642,0.01789815946770404,10,euclidean,5,,COMPLETE
144,0.8305615521974362,2026-08-03 16:55:34.940802,2026-08-03 16:55:35.009343,0 days 00:00:00.068541,0.1765023424423075,10,euclidean,5,,COMPLETE
145,0.8152298349288035,2026-08-03 16:55:35.075203,2026-08-03 16:55:35.125577,0 days 00:00:00.050374,0.21300980204559006,10,euclidean,6,,COMPLETE
146,0.8305615521974362,2026-08-03 16:55:35.188128,2026-08-03 16:55:35.266161,0 days 00:00:00.078033,0.15914314533740495,40,minkowski,5,2.0,COMPLETE
147,0.8152298349288035,2026-08-03 16:55:35.331885,2026-08-03 16:55:35.394419,0 days 00:00:00.062534,0.13674154151184986,10,euclidean,6,,COMPLETE
148,0.8305615521974362,2026-08-03 16:55:35.459201,2026-08-03 16:55:35.520842,0 days 00:00:00.061641,0.17049712654307672,20,euclidean,5,,COMPLETE
149,0.8305615521974362,2026-08-03 16:55:35.583445,2026-08-03 16:55:35.646022,0 days 00:00:00.062577,0.18875594976044335,50,euclidean,5,,COMPLETE
