number,value,datetime_start,datetime_complete,duration,params_epsilon,params_k,params_lr,params_n_epochs,params_proportion,params_samples,params_wd,state
116,0.8804854130171953,2026-08-04 01:40:05.466973,2026-08-04 01:40:34.797870,0 days 00:00:29.330897,0.2765296913067884,5,0.000623669670488655,300,1,SUBSPACE,0.0028073113582143816,COMPLETE
117,0.8742068078239821,2026-08-04 01:40:34.870250,2026-08-04 01:41:03.801186,0 days 00:00:28.930936,0.2988882019243777,6,0.000605569020389537,300,1,SUBSPACE,0.003920428587673328,COMPLETE
118,0.8725195708585011,2026-08-04 01:41:03.873279,2026-08-04 01:41:32.736456,0 days 00:00:28.863177,0.33605140609871564,5,0.0004593122163876186,300,1,SUBSPACE,0.0028529677475287864,COMPLETE
119,0.8724217468520659,2026-08-04 01:41:32.809120,2026-08-04 01:42:01.712594,0 days 00:00:28.903474,0.27000926648401796,6,0.0006958851573758294,300,1,SUBSPACE,0.006798765097169877,COMPLETE
120,0.8747144023589215,2026-08-04 01:42:01.784463,2026-08-04 01:42:31.242600,0 days 00:00:29.458137,0.28406530887377107,5,0.00038079106369617546,300,1,SUBSPACE,0.005386297779192756,COMPLETE
121,0.8806959012044164,2026-08-04 01:42:31.316908,2026-08-04 01:43:01.013433,0 days 00:00:29.696525,0.2756674329398476,5,0.0005764853237646537,300,1,SUBSPACE,0.002502566325694126,COMPLETE
122,0.8800786710957016,2026-08-04 01:43:01.086319,2026-08-04 01:43:30.612387,0 days 00:00:29.526068,0.26587844133765337,5,0.0005687409609526462,300,1,SUBSPACE,0.003450076796649289,COMPLETE
123,0.8805989857800843,2026-08-04 01:43:30.685992,2026-08-04 01:44:00.242155,0 days 00:00:29.556163,0.2753254310982801,5,0.0005872185007281197,300,1,SUBSPACE,0.0035653279478129432,COMPLETE
124,0.8723987294387869,2026-08-04 01:44:00.320014,2026-08-04 01:44:29.227560,0 days 00:00:28.907546,0.27635103951790574,6,0.000560192739451862,300,1,SUBSPACE,0.003530222365319197,COMPLETE
125,0.8745448003663403,2026-08-04 01:44:29.306189,2026-08-04 01:44:58.805575,0 days 00:00:29.499386,0.3215763880102922,5,0.00046479784053485865,300,1,SUBSPACE,0.0027190787982251993,COMPLETE
126,0.8678700533761698,2026-08-04 01:44:58.868438,2026-08-04 01:45:28.014376,0 days 00:00:29.145938,0.3108593938579341,6,0.0004024246856015709,300,1,UNIFORM,0.004004767913799431,COMPLETE
127,0.8702008693313564,2026-08-04 01:45:28.077447,2026-08-04 01:45:56.510236,0 days 00:00:28.432789,0.2884279302995587,5,0.0002757916772457905,300,1,SUBSPACE,0.004356620315400397,COMPLETE
128,0.879977515621555,2026-08-04 01:45:56.582637,2026-08-04 01:46:25.165522,0 days 00:00:28.582885,0.2629255797815529,5,0.0006131446306040642,300,1,SUBSPACE,0.0022909828996361507,COMPLETE
129,0.873883655455975,2026-08-04 01:46:25.243862,2026-08-04 01:46:54.296950,0 days 00:00:29.053088,0.2673070188279745,6,0.000508393301893206,300,1,SUBSPACE,0.005053977209722353,COMPLETE
130,0.8802022382617251,2026-08-04 01:46:54.368877,2026-08-04 01:47:22.892744,0 days 00:00:28.523867,0.2970995092204404,5,0.000799931770296966,300,1,SUBSPACE,0.007304156832963468,COMPLETE
131,0.8798306281815516,2026-08-04 01:47:22.961516,2026-08-04 01:47:51.405802,0 days 00:00:28.444286,0.2780455664830198,5,0.000815696812311912,300,1,SUBSPACE,0.0071137501030700215,COMPLETE
132,0.8804054577921213,2026-08-04 01:47:51.476682,2026-08-04 01:48:20.341827,0 days 00:00:28.865145,0.30000136945146605,5,0.0006325952454839629,300,1,SUBSPACE,0.0021599426954801207,COMPLETE
133,0.8740329657815866,2026-08-04 01:48:20.411425,2026-08-04 01:48:49.388407,0 days 00:00:28.976982,0.33632399490529596,6,0.0007005754286232303,300,1,SUBSPACE,0.0029937830814296988,COMPLETE
134,0.8796225628799388,2026-08-04 01:48:49.450972,2026-08-04 01:49:18.119557,0 days 00:00:28.668585,0.29942041255926044,5,0.0012302943089790915,300,1,SUBSPACE,0.009746948328342423,COMPLETE
135,0.8804975274452367,2026-08-04 01:49:18.190592,2026-08-04 01:49:46.902663,0 days 00:00:28.712071,0.3232838575569873,5,0.000926573701142301,300,1,SUBSPACE,0.003459528490624455,COMPLETE
136,0.8717920994546086,2026-08-04 01:49:46.973069,2026-08-04 01:50:15.876419,0 days 00:00:28.903350,0.32525888766477096,6,0.0009469941057127003,300,1,SUBSPACE,0.0034613370303500546,COMPLETE
137,0.8600877448023047,2026-08-04 01:50:15.954714,2026-08-04 01:51:06.043344,0 days 00:00:50.088630,0.3526058560784389,69,0.0005731281323837972,300,1,SUBSPACE,0.006029346104584814,COMPLETE
138,0.8756329788651689,2026-08-04 01:51:06.114119,2026-08-04 01:51:35.526435,0 days 00:00:29.412316,0.3078139687677097,5,0.0004966774702717715,300,1,SUBSPACE,0.0044466856390899135,COMPLETE
139,0.8678409787488702,2026-08-04 01:51:35.599369,2026-08-04 01:52:04.687577,0 days 00:00:29.088208,0.36561781624422535,7,0.0007744844214623636,300,1,SUBSPACE,0.007861607337918202,COMPLETE
140,0.8676353363328657,2026-08-04 01:52:04.760504,2026-08-04 01:52:33.873321,0 days 00:00:29.112817,0.2945471208120158,5,0.0004284975469071589,300,1,UNIFORM,0.005475307266942743,COMPLETE
141,0.8803936462247808,2026-08-04 01:52:33.959971,2026-08-04 01:53:03.378808,0 days 00:00:29.418837,0.2821158952367428,5,0.0006412053768637337,300,1,SUBSPACE,0.0020502757936341496,COMPLETE
142,0.8800820025634128,2026-08-04 01:53:03.451936,2026-08-04 01:53:32.722023,0 days 00:00:29.270087,0.2845069354312479,5,0.0008402222789956329,300,1,SUBSPACE,0.0020018013095402408,COMPLETE
143,0.8800692824139693,2026-08-04 01:53:32.800404,2026-08-04 01:54:02.174164,0 days 00:00:29.373760,0.30256737097840053,5,0.001019449027788248,300,1,SUBSPACE,0.002185118737408755,COMPLETE
144,0.8722915167506197,2026-08-04 01:54:02.252405,2026-08-04 01:54:31.302130,0 days 00:00:29.049725,0.2874630478234015,6,0.0008098345991397205,300,1,SUBSPACE,0.0019359753717928516,COMPLETE
145,0.8801970896298072,2026-08-04 01:54:31.373514,2026-08-04 01:55:00.953066,0 days 00:00:29.579552,0.3285546664087088,5,0.0011235356337464606,300,1,SUBSPACE,0.003471625820983366,COMPLETE
146,0.8798736344010991,2026-08-04 01:55:01.022480,2026-08-04 01:55:30.423934,0 days 00:00:29.401454,0.32897140844999795,5,0.0012150968226105141,300,1,SUBSPACE,0.0010376120704335614,COMPLETE
147,0.8713823289261043,2026-08-04 01:55:30.495574,2026-08-04 01:55:59.455835,0 days 00:00:28.960261,0.31333077065281006,6,0.0016098035547810895,300,1,SUBSPACE,0.0024985439179263055,COMPLETE
148,0.8796028769343713,2026-08-04 01:55:59.530240,2026-08-04 01:56:28.074013,0 days 00:00:28.543773,0.279398925889503,5,0.0008779565565640553,300,1,SUBSPACE,0.004023834979434824,COMPLETE
149,0.8794078346429031,2026-08-04 01:56:28.146278,2026-08-04 01:56:57.477473,0 days 00:00:29.331195,0.2952398126585391,5,0.0013433915990536422,300,1,SUBSPACE,0.0013679744657425748,COMPLETE
150,0.8740057083184931,2026-08-04 01:56:57.548083,2026-08-04 01:57:41.003040,0 days 00:00:43.454957,0.335990362970916,6,0.001160505420284176,300,2,SUBSPACE,0.0031263706521767105,COMPLETE
151,0.8804345324194208,2026-08-04 01:57:41.073817,2026-08-04 01:58:09.755908,0 days 00:00:28.682091,0.2721002462967088,5,0.0006536808498814606,300,1,SUBSPACE,0.003662341795582011,COMPLETE
152,0.8805741512025993,2026-08-04 01:58:09.829773,2026-08-04 01:58:39.328520,0 days 00:00:29.498747,0.28570338279281804,5,0.0006484401252101598,300,1,SUBSPACE,0.004946729739690437,COMPLETE
153,0.8805944428695688,2026-08-04 01:58:39.399381,2026-08-04 01:59:08.822037,0 days 00:00:29.422656,0.3207636707416136,5,0.0006719718117304015,300,1,SUBSPACE,0.004753512567520992,COMPLETE
154,0.8806144316758372,2026-08-04 01:59:08.896449,2026-08-04 01:59:38.319710,0 days 00:00:29.423261,0.30360788327598753,5,0.0006258119055600695,300,1,SUBSPACE,0.005020448709645754,COMPLETE
155,0.8742107450130958,2026-08-04 01:59:38.392608,2026-08-04 02:00:05.136855,0 days 00:00:26.744247,0.3093721878662127,6,0.0006897990267077808,275,1,SUBSPACE,0.00481321502801394,COMPLETE
156,0.8757371629463259,2026-08-04 02:00:05.209538,2026-08-04 02:00:33.986777,0 days 00:00:28.777239,0.32033271982560196,5,0.0005188469495357868,300,1,SUBSPACE,0.006158226051584011,COMPLETE
157,0.8804457382653593,2026-08-04 02:00:34.064997,2026-08-04 02:01:01.157639,0 days 00:00:27.092642,0.27594794121014654,5,0.0006524263159002746,275,1,SUBSPACE,0.004487374378994611,COMPLETE
158,0.8740653718765977,2026-08-04 02:01:01.222206,2026-08-04 02:01:27.913731,0 days 00:00:26.691525,0.27451519733614826,6,0.0004897511500077554,275,1,SUBSPACE,0.0040469622554661685,COMPLETE
159,0.8807186157569944,2026-08-04 02:01:27.992209,2026-08-04 02:01:55.248316,0 days 00:00:27.256107,0.2735839392247917,5,0.0006344113515426897,275,1,SUBSPACE,0.002734180120719554,COMPLETE
160,0.8794693153652138,2026-08-04 02:01:55.319231,2026-08-04 02:02:22.433503,0 days 00:00:27.114272,0.28160413524797284,5,0.0005765004942838266,275,1,SUBSPACE,0.0027366790679612778,COMPLETE
161,0.8804408924941427,2026-08-04 02:02:22.494400,2026-08-04 02:02:49.527338,0 days 00:00:27.032938,0.2720899640598431,5,0.0006673067385107096,275,1,SUBSPACE,0.0023390383489880003,COMPLETE
162,0.8799929615173079,2026-08-04 02:02:49.597446,2026-08-04 02:03:16.578686,0 days 00:00:26.981240,0.29024995082301064,5,0.0006362584045813189,275,1,SUBSPACE,0.002379131584528277,COMPLETE
163,0.87693497701893,2026-08-04 02:03:16.666126,2026-08-04 02:03:43.663907,0 days 00:00:26.997781,0.25211441828800574,5,0.00045760328198986495,275,1,SUBSPACE,0.0030799552683139397,COMPLETE
164,0.8724677816786236,2026-08-04 02:03:43.737565,2026-08-04 02:04:10.619836,0 days 00:00:26.882271,0.2735331452337482,6,0.0003728058339963522,275,1,SUBSPACE,0.0046493004566554984,COMPLETE
165,0.8806159459793425,2026-08-04 02:04:10.700722,2026-08-04 02:04:39.583403,0 days 00:00:28.882681,0.3076999118780343,5,0.0007335018874467528,300,1,SUBSPACE,0.0018156766709405319,COMPLETE
166,0.8741044409070317,2026-08-04 02:04:39.661656,2026-08-04 02:05:08.529263,0 days 00:00:28.867607,0.3107088995008448,6,0.0009368706793746751,300,1,SUBSPACE,0.0017928493197188605,COMPLETE
167,0.8803960691103891,2026-08-04 02:05:08.599197,2026-08-04 02:05:35.737735,0 days 00:00:27.138538,0.30515897138939446,5,0.0007554244496858173,275,1,SUBSPACE,0.002233105562921522,COMPLETE
168,0.8675390266299358,2026-08-04 02:05:35.816094,2026-08-04 02:06:02.709482,0 days 00:00:26.893388,0.3197091216312217,5,0.0007505255292844273,275,1,UNIFORM,0.0011547854493957831,COMPLETE
169,0.8737891629172512,2026-08-04 02:06:02.781382,2026-08-04 02:06:29.546259,0 days 00:00:26.764877,0.3059011356762085,6,0.0005271496735169389,275,1,SUBSPACE,0.0025337287244154706,COMPLETE
170,0.8565848579341023,2026-08-04 02:06:29.618414,2026-08-04 02:07:04.913987,0 days 00:00:35.295573,0.29174620856002664,35,0.0009697059311470864,275,1,SUBSPACE,0.0035951345241332215,COMPLETE
171,0.8804845044350921,2026-08-04 02:07:04.992238,2026-08-04 02:07:34.418088,0 days 00:00:29.425850,0.2850323052985448,5,0.0006156564069478229,300,1,SUBSPACE,0.002146436281154306,COMPLETE
172,0.855000593606974,2026-08-04 02:07:34.481048,2026-08-04 02:08:53.109516,0 days 00:01:18.628468,0.3031857372162797,117,0.0005370149598474879,300,1,SUBSPACE,0.0029952314928602952,COMPLETE
173,0.8806250318003735,2026-08-04 02:08:53.187841,2026-08-04 02:09:22.682611,0 days 00:00:29.494770,0.28863581655339604,5,0.0007355443720513818,300,1,SUBSPACE,0.0015543680786472818,COMPLETE
174,0.8808982121527096,2026-08-04 02:09:22.760941,2026-08-04 02:09:52.238747,0 days 00:00:29.477806,0.2896735591134894,5,0.000594047281234345,300,1,SUBSPACE,0.0017260233558464933,COMPLETE
175,0.8804848072957931,2026-08-04 02:09:52.301996,2026-08-04 02:10:21.740930,0 days 00:00:29.438934,0.26357563027404085,5,0.0005813860107854459,300,1,SUBSPACE,0.001637193294684429,COMPLETE
176,0.8804602755790091,2026-08-04 02:10:21.819350,2026-08-04 02:10:51.328221,0 days 00:00:29.508871,0.2843113352297668,5,0.0005641329934483181,300,1,SUBSPACE,0.001421428696302285,COMPLETE
177,0.8778923196949103,2026-08-04 02:10:51.402320,2026-08-04 02:11:21.401462,0 days 00:00:29.999142,0.2876231547757148,5,0.00045071719795060345,300,1,SUBSPACE,0.0008761400458820744,COMPLETE
178,0.8726806927514532,2026-08-04 02:11:21.470392,2026-08-04 02:11:50.645188,0 days 00:00:29.174796,0.2891237998590508,6,0.0003292966635265657,300,1,SUBSPACE,0.001385245760840407,COMPLETE
179,0.8773280902088769,2026-08-04 02:11:50.719098,2026-08-04 02:12:20.666082,0 days 00:00:29.946984,0.26229627009856077,5,0.00041368126010239806,300,1,SUBSPACE,0.0015869115066097239,COMPLETE
180,0.8762320373318216,2026-08-04 02:12:20.739431,2026-08-04 02:12:50.353816,0 days 00:00:29.614385,0.3199280721102793,5,0.0005551429947776687,300,1,SUBSPACE,0.0013237586147494221,COMPLETE
181,0.8805674882671765,2026-08-04 02:12:50.424853,2026-08-04 02:13:20.031093,0 days 00:00:29.606240,0.2736232041513206,5,0.0007187136724923565,300,1,SUBSPACE,0.0015278653025630933,COMPLETE
182,0.8801446947285277,2026-08-04 02:13:20.103464,2026-08-04 02:13:49.481861,0 days 00:00:29.378397,0.27968506615619454,5,0.0007308705799351439,300,1,SUBSPACE,0.0016315590304455943,COMPLETE
183,0.8800562594038248,2026-08-04 02:13:49.555241,2026-08-04 02:14:18.864539,0 days 00:00:29.309298,0.25879651515359087,5,0.0005797201075529133,300,1,SUBSPACE,0.0007062777841528442,COMPLETE
184,0.8789629322730785,2026-08-04 02:14:18.927659,2026-08-04 02:14:48.398531,0 days 00:00:29.470872,0.2920851676974344,5,0.0004837250000692991,300,1,SUBSPACE,0.000927318486824065,COMPLETE
185,0.8723799520753227,2026-08-04 02:14:48.471479,2026-08-04 02:15:17.233963,0 days 00:00:28.762484,0.24667655922373946,6,0.0007301879423488475,300,1,SUBSPACE,0.0011773579314183862,COMPLETE
186,0.8807916051859445,2026-08-04 02:15:17.305001,2026-08-04 02:15:46.679232,0 days 00:00:29.374231,0.28163408713795035,5,0.0005855534295338058,300,1,SUBSPACE,0.001781920875740115,COMPLETE
187,0.8742579912824575,2026-08-04 02:15:46.751130,2026-08-04 02:16:15.807966,0 days 00:00:29.056836,0.2836887683029716,6,0.0005779174937679906,300,1,SUBSPACE,0.001775269865521785,COMPLETE
188,0.880467847096535,2026-08-04 02:16:15.881595,2026-08-04 02:16:45.510106,0 days 00:00:29.628511,0.29937339700176746,5,0.0008982378912349599,300,1,SUBSPACE,0.0016981208560505915,COMPLETE
189,0.8804530069221843,2026-08-04 02:16:45.583002,2026-08-04 02:17:14.994928,0 days 00:00:29.411926,0.3144946155588482,5,0.0008660426859237687,300,1,SUBSPACE,0.00117131524598506,COMPLETE
190,0.8803745660006155,2026-08-04 02:17:15.067821,2026-08-04 02:17:44.512127,0 days 00:00:29.444306,0.2985923612654499,5,0.0009155332804916292,300,1,SUBSPACE,0.0018095577663447737,COMPLETE
191,0.8813088912633169,2026-08-04 02:17:44.585029,2026-08-04 02:18:13.983212,0 days 00:00:29.398183,0.3154784872266466,5,0.0007700547040103299,300,1,SUBSPACE,0.0011728276134038997,COMPLETE
192,0.8798915031824603,2026-08-04 02:18:14.046453,2026-08-04 02:18:43.490369,0 days 00:00:29.443916,0.33936046197103875,5,0.0007750747680609571,300,1,SUBSPACE,0.0014816403269499756,COMPLETE
193,0.8755618066004249,2026-08-04 02:18:43.561792,2026-08-04 02:19:13.041493,0 days 00:00:29.479701,0.3101594633348705,5,0.0005080706880395961,300,1,SUBSPACE,0.0010413488668060075,COMPLETE
194,0.8741468414051767,2026-08-04 02:19:13.116634,2026-08-04 02:19:42.249107,0 days 00:00:29.132473,0.3249869086537716,6,0.000598058937039781,300,1,SUBSPACE,0.0013287743736869772,COMPLETE
195,0.8803685087865947,2026-08-04 02:19:42.337235,2026-08-04 02:20:11.769878,0 days 00:00:29.432643,0.29569131970332146,5,0.0007346748702442187,300,1,SUBSPACE,0.0018000810085075337,COMPLETE
196,0.8717987623900312,2026-08-04 02:20:11.842993,2026-08-04 02:20:40.597445,0 days 00:00:28.754452,0.2866522054742255,6,0.001026556188597647,300,1,SUBSPACE,0.0026951310067580927,COMPLETE
197,0.874727122508365,2026-08-04 02:20:40.670834,2026-08-04 02:21:09.618520,0 days 00:00:28.947686,0.30101598070072144,5,0.00042587403439730566,300,1,SUBSPACE,0.0016247073976309555,COMPLETE
198,0.8804536126435863,2026-08-04 02:21:09.696964,2026-08-04 02:21:39.381021,0 days 00:00:29.684057,0.3179662307386545,5,0.0008546404022838801,300,1,SUBSPACE,0.002056683692685463,COMPLETE
199,0.8799847842783798,2026-08-04 02:21:39.459539,2026-08-04 02:22:08.921816,0 days 00:00:29.462277,0.2643759189937087,5,0.0005802716543033511,300,1,SUBSPACE,0.0013750423597538022,COMPLETE
